Title	Price	Diện tích (m2)	Số phòng ngủ	Số phòng WC	Địa chỉ	Description	Chỗ để xe hơi	Đang cho thuê	CSVC xung quanh	Vấn đề pháp lý, sổ đỏ	ExtractedTitle	Address1	Address2
CƠ HỘI SỞ HỮU LIỀN KỀ HUD SƠN TÂY – GIAI ĐOẠN 2 GIÁ TỪ 3.5 tỷ	6.5	75	4.0	4.0	Khu đô thị HUD Sơn Tây - Phường Quang Trung - Sơn Tây - Hà Nội	"( ✅ Bao gồm cả nhà và đất – ✍️ Sổ đỏ lâu dài )
???? Diện tích: 75m – 85m – 88m – 110m – 150m
Tiến độ đóng tiền : 9 đợt – bàn giao nhà Quý II/2024
- Thiết kế : 3,5 tầng – đồng bộ mặt ngoài
✅ Cam kết đúng giá - ưu tiên khách hàng chọn Lô đẹp
——————————————
???? ????????
???? Gần Chợ - Trường - Trung tâm thương mại
???? Đón đầu quy hoạch TX Sơn Tây lên thành phố trực thuộc Thủ đô
????Dân cư đông đúc, tiện ích đầy đủ: công viên, Trung tâm thương mại, phòng khám đa khoa...
????CĐT #HUD uy tín với nhiều KĐT tại HN, pháp lý hoàn chỉnh, sở hữu lâu dài???????? Số lượng hữu hạn.
Quý khách hàng quan tâm liên hệ: 0342365139 { Mr Dương }"	False	False	True	False	Sơn Tây	Khu đô thị HUD Sơn Tây - Phường Quang Trung - Sơn Tây - Hà Nội	Sơn Tây
Chính chủ bán 100m2 đất đấu giá mặt Hồ Đầm Tranh, Long Biên - Đang cho thuê 10tr/tháng	3.5	100			Hồ Đầm Tranh, Cự Khối, Long Biên, Hà Nội	"Chính chủ bán 100m2 đất đấu giá mặt Hồ Đầm Tranh, Long Biên - Đang cho thuê 10tr/tháng.

+ Diện tích: 100m2, mặt tiền 5,5m, dài 18,2m, đường trước nhà rộng 4m, hướng Đông Bắc.

+ Giá bán: 8.8 tỷ ( có ra lộc cho người mua ).

+ Nhà nhìn ra mặt hồ thoáng mát, view đẹp, tầm nhìn thoáng, cách đường Cổ Linh 50m, cách cầu Thanh Trì 100m, xung quanh hạ tầng đường xá đang được đồng bộ, thuận tiện giao thông đi các tỉnh phía bắc và đi vào nội thành, bán kính 700m có trường học các cấp và chợ đáp ứng sinh hoạt hàng ngày...

+ Pháp lý: Sổ đỏ chính chủ, không cầm cố, sẵn sàng công chứng, hỗ trợ vay bank.

Liên hệ trước 30 phút để xem đất: 0925333999
ThuyAn.Net – Cam Kết Bán Đúng Giá - Không Thu Phí Người Mua - Hỗ Trợ Thủ Tục Sang Tên!"	True	True	True	False	Hồ Đầm Tranh, Long Biên	Hồ Đầm Tranh, Cự Khối, Long Biên, Hà Nội	Hồ Đầm Tranh, Long Biên
Nhà 4 Tầng, đường Lê Văn Chí Phường Linh Trung Thủ Đức, dt 74 m²	8.8	74	4.0	5.0	Đường Lê Văn Chí, Phường Linh Trung, Quận Thủ Đức, TP HCM	"Nhà 4 Tầng, đường Lê Văn Chí Phường Linh Trung Thủ Đức, dt 74 m²
- Kết cấu nhà 1 Trệt 3 lầu Đổ BTCT 4 TẦNG, khu dân cư cao tầng đồng bộ, đẹp,
- Giá bán : 8,5 tỷ ( TLCC )
- Diện tích: 74 m² . Ngang 4,3mx17,2m
- Nhà sổ hoàn công đầy đủ
- Nội thất Cao Cấp đầy đủ
- NHÀ GỒM CÓ 1 SÂN Ô TÔ . + 1 PK + 4 PN + 5 WC SÂN THƯỢNG trước và sau
-Vị trí Hẻm 8m ... Đường thông tứ phía
- Đặc biệt nhà gần chợ, Siêu thị, Trường Cấp 3 Linh Trung, Trường Đại Học Nông Lâm, SPKT, ĐHNH ... Gần đường Lê Văn Chí rộng 30m. Kết nối ra Ngă 4 Thủ Đức .. Xa Lộ Hà Nội . Quốc Lộ 1A……
- Thích hợp cho gia đình an cư , làm văn phòng cty, Spa, căn hộ cho thuê, dạy học thêm…....
Liên hệ : 0898 408 677 xem nhà, làm việc chính chủ"	False	False	True	False	đường Lê Văn Chí, Phường Linh Trung, Quận Thủ Đức	Đường Lê Văn Chí, Phường Linh Trung, Quận Thủ Đức, TP HCM	đường Lê Văn Chí, Phường Linh Trung, Quận Thủ Đức
Nhà hẻm thông 12m, có công viên nội bộ, gần bệnh viện, trường học	8.5	86	4.0	4.0		"Khu dân cư an ninh, yên tĩnh, hàng xóm chan hòa đoàn kết. Nhà xây kiên cố, cách công viên nội bộ 50m.
Sân trước rộng, sân sau ăn sáng uống cà phê, sân thượng nhiều gió và ánh sáng, nhiều góc chill.
Nhà nhiều nắng và gió, có không gian cho việc trồng cây, trồng hoa.
Giá trên còn thương lượng cho khách thiện chí."	False	False	True	False	hẻm thông 12m, gần bệnh viện, trường học	hẻm thông 12m, gần bệnh viện, trường học	hẻm thông 12m, gần bệnh viện, trường học
Nhà 3 tầng Đồng Văn Cống ,ngang 7m , HXH ,gần Coop mart	14	49	3.0	3.0		"Nhà 3 tầng Đồng Văn Cống ,ngang 7m , HXH ,gần Coop mart
Diện tích 7x7m
Đằng trước nhà là đất trống, tận dụng để xe oto
Chỉ 2 phút ra MT Đồng Văn Cống, UBND TP Thủ Đức.
Nhà 3 tầng 3 PN , 3 WC ,ban công thoáng đón gió thoáng mát
Xung quanh tiện ích gồm Coop mart, UBND , rạp chiếu phim
Khu vực yên tĩnh, dân trí
Sổ vuông vắn, hoàn công đầy đủ
Giá chỉ 3 tỷ"	False	False	True	False	Đồng Văn Cống, Quận Thủ Đức	Đồng Văn Cống, Quận Thủ Đức	Đồng Văn Cống, Quận Thủ Đức
Bán nhà Mỗ Lao, Hà Đông, view nhìn sang nhà Văn Hóa thoáng vĩnh viễn, 55m2, 9.5 tỷ	3	55	4.0		Thanh Bình, Mỗ Lao, Hà Đông, Hà Nội, -Dự án-	"+ Nhà nằm ở phố Thanh Bình, hai mặt ngõ to ô tô tránh, thông sang Mỗ Lao, ô tô đỗ cửa thoải mái.
+ Nhà xây 4 tầng kiên cố chắc chắn, diện tích 55m2, đối diện là nhà Văn Hóa tổ dân phố, thoáng vĩnh viễn.
+ Hưởng trọn tiện ích KĐT Mỗ Lao, ngay gần Big C Hà Đông, KĐT Văn Quán, HV An Ninh, ĐH Kiến Trúc, chợ Mỗ Lao, trường học các cấp,..
+Nội thất đẹp mê ly, tất cả đều do tự tay gia chủ lựa chọn và thiết kế.
+Chủ nhà anh Hùng giám đốc công ty xây dựng, nay bán đi chuyển sang biệt thự ở.
+Giá 9.5 tỷ ( có thương lượng với khách thiện chí )
+Sổ đỏ vuông vức đẹp nức nở.
+Liên hệ E Quân Nhà Đẹp 0934503893 để đi xem nhà ngay."	False	False	True	False	phố Thanh Bình, ngõ Mỗ Lao, Hà Đông	Thanh Bình, Mỗ Lao, Hà Đông, Hà Nội, -Dự án-	phố Thanh Bình, ngõ Mỗ Lao, Hà Đông
BÁN TOÀ CĂN HỘ APARTMENT 5 TẦNG NGAY ĐẦU CẦU RỒNG ĐÀ NẴNG, CHỈ 8,1 TỶ.	9.5	82	7.0	8.0	Đường Phạm Cự Lượng, An Hải Đông, Sơn Trà, Đà Nẵng	"TÒA CĂN HỘ VEN BIỂN NẰM TRÊN TUYẾN ĐƯỜNG PHẠM CỰ LƯỢNG, CÁCH ĐẦU CẦU RỒNG 200M – KHU VỰC TẬP TRUNG NHIỀU ĐIỂM VUI CHƠI GIẢI TRÍ, KHÁCH SẠN, NHÀ HÀNG… TRUNG TÂM QUẬN SƠN TRÀ.
- Vị trí và tiện ích xung quanh:
+ Tòa căn hộ nằm ngay đường Phạm Cự Lượng, giao với đại lộ Võ Văn Kiệt & Nguyễn Văn Thoại, song song với đại lộ Ngô Quyền… nơi tập trung các khách sạn, nhà hàng, khu vui chơi giải trí…
+ Cách cầu Rồng, cầu tình yêu, chợ đêm Sơn Trà chỉ vài bước chân, cách công viên Biển Đông, bãi tắm Mỹ Khê khoản 700m.
+ Gần chợ An Hải Đông, bệnh viện Sơn Trà, cầu Trần Thị Lý, cầu Sông Hàn, Vincom Plaza … các trường phổ thông cấp 1,2,3 đi bộ chỉ vài bước chân. Vị trí trung tâm, tiên ích xung quanh không thiếu thứ gì…
Công năng:
+ Tòa căn hộ Apartment 5 tầng, diện tích: 82 m2, DTSD: 350 m2
+ Tầng 1 gồm : Khu vực để xe, phòng khách, bếp+ phòng ăn và 1 phòng căn hộ.
+ Tầng 2,3,4 gồm : 6 phòng căn hộ.
+ Tầng 5 gồm: Phòng thờ, sân thượng phía trước và sau view cầu rồng.
+ Các phòng căn hộ tiêu chuẩn rộng rãi, nội thất bao gồm: giường, tủ, bếp, bàn ăn, ti vi, tủ lạnh, máy giặt, máy nóng lạnh… Hiện đang cho thuê full kín phòng. Doanh thu dòng tiền 30tr/tháng. Chủ mới mua về chỉ việc dọn đến ở và kinh doanh ngay.
+ Sổ cất két sẵn sàng giao dịch.
+ Giá đầu tư: 8,1 tỷ (có ra lộc cho khách thiện chí mua nhà)
+ Liên hệ: Mr.Tín 0905154727 để được tư vấn, xem nhà và làm việc chính Chủ.."	False	True	True	False	Phạm Cự Lượng, Quận Sơn Trà, Đà Nẵng	Đường Phạm Cự Lượng, An Hải Đông, Sơn Trà, Đà Nẵng	Phạm Cự Lượng, Quận Sơn Trà, Đà Nẵng
Bán nhà đẹp DT sàn 127m2, xe hơi trong nhà, gần đường Hoàng Diệu, Linh Trung, Thủ Đức, chỉ 5,6tỷ	8.1	66	3.0	7.0	Đường số 7	"+ DT đẹp 66m2 (4 x 16.4), khu phố yên tĩnh , dân trí cao, sạch sẽ, thoáng mát.
+ Nhà xinh vị trí đẹp đường số 7 - Hoàng Diệu 2 , đường ô tô vào nhà, giá tốt nhất.
+ Ô tô 7 chổ vào nhà, cách MT đường số 7 vài bước, vị trí đẹp 3 phút ra Hoàng Diệu 2 , ngay chợ Linh Trung.
+ Tiện ích ngập tràn, không thiếu gì.
+ Nhà xây kiên cố để ở. Trệt + Lầu 3 PN, còn mới vào ở ngay.
+ Sổ hồng hoàn công chuẩn.
Quý khách xem nhà vui lòng gọi Mr Tín. Tôi hân hạnh được tư vấn."	False	False	True	False	đường số 7, Hoàng Diệu 2	Đường số 7	đường số 7, Hoàng Diệu 2
Bán gấp nhà Mặt tiền KD Nguyễn Hữu Thọ,Hải Châu,S:125m2,6tầng,Giá chỉ 22 tỷ TL	5.6	125	6.0	7.0		"Mô tả:
- Nhà nằm trên khu vực đoạn đường sầm uất nhất Nguyễn Hữu Thọ bên cạnh đường 30/4 kinh doanh, cửa hàng, cải tạo thành Căn Hộ, cho Thuê mở VP Công Ty cực kỳ sướng, khu vực được đánh giá đắt địa nhất nhì Đà Nẵng.Xung quanh các cửa hàng kinh doanh rất nhiều.
- Với diện tích 125m2(5 tầng), thang máy nhập, 1 thang bộ, với trống suốt tầng 1-2 tầng lững kinh doanh, tầng 3,4,5,6 2 sân thượng trước sau, 5 phòng gia đình wc kín.
- Sổ đỏ đầy đủ, pháp lý rõ ràng.
☎ Liên hệ: Trường Vũ (Chuyên nhà phố Đà Nẵng) LVCC"	False	True	True	False	đường Nguyễn Hữu Thọ, Quận Hải Châu, Đà Nẵng	đường Nguyễn Hữu Thọ, Quận Hải Châu, Đà Nẵng	đường Nguyễn Hữu Thọ, Quận Hải Châu, Đà Nẵng
Tân phú, Nhà 5 Tầng- gần chợ Tân Hương, kinh doanh-Giá rẻ	22	72	5.0	4.0	Thành phố Hồ Chí Minh	"????????MẶT TIỀN TÂN PHÚ- NGAY CHỢ TÂN HƯƠNG- VỊ TRÍ KINH DOANH ĐA NGÀNH- GIÁ RẺ, GIẢM MẠNH 2 T.Ỷ-KHU VỰC TIỆN ÍCH BAO QUANH.
????Nhà mới đẹp 5 tầng 4X18 m2, Nội thất cao cấp.
????Chỉ 13 t.ỷ giảm TL mạnh, Pháp lý Chuẩn.
☎️Zalo 0938059388. Nhà Phố SG."	False	False	True	False	Ngay chợ Tân Hương, Quận Tân Phú	Thành phố Hồ Chí Minh	Ngay chợ Tân Hương, Quận Tân Phú
ĐƯỜNG NHỰA 8M PHAN VĂN TRỊ, PHƯỜNG 11, BÌNH THẠNH, 2 TẦNG BTCT, 68M2, 6.x TỶ	26	68	3.0	2.0		"- Diện tích: 5.2 x 13m
- Kết cấu: 1 trệt 1 lầu BTCT; 3 PN, 2 WC. Phòng khách, bếp và ban công rộng rãi
- Đường nhựa xe tải quay đầu, an ninh, sạch đẹp. Khu vực Phạm Văn Đồng, Nơ Trang Long, Phan Văn Trị
- Gần siêu thị Emart, chợ Cầu Đỏ, chợ Cây Thị, ĐH Văn Lang; bao la tiện ích
- Sổ hồng vuông A4, hoàn công đủ, pháp lý chuẩn, công chứng mua bán ngay"	False	False	True	False	Đường Phạm Văn Trị, Phường 11, Quận Bình Thạnh	Đường Phạm Văn Trị, Phường 11, Quận Bình Thạnh	Đường Phạm Văn Trị, Phường 11, Quận Bình Thạnh
Chủ ngộp bán gấp 46m2 nhà Nguyễn Thượng Hiền, phường 5, Bình Thạnh Sổ hồng riêng	6.3	46	4.0	3.0		"Bán nhà đường Nguyễn Thượng Hiền, Phường 5, Bình Thạnh.
Vị trí: Thuận lợi, gần các trường học cấp quận, gần chợ, siêu thị, sân bay Tân Sơn Nhất, khu dân cư yên tĩnh và an ninh.
- Diện tích: 3.5x12m. Nở hậu 5.2m. DTCN: 45.8m². DTSD: 137.7m².
- Kết cấu: Nhà 1 trệt, 2 lầu, sân thượng, 4 phòng ngủ, 3 WC, 1 phòng khách, 1 phòng thờ, 1 sân thượng trước thờ mẹ quan âm còn sân sau phơi đồ. Đặc Biệt 2 bên hông nhà có 2 hẻm nhỏ thông thoáng gió.
- Hẻm 4 mét, cách mặt tiền Nguyễn Thượng Hiền 40 mét vị trí đẹp, thông thoáng và yên tĩnh.
Liên hệ *** em Trường"	False	False	True	False	đường Nguyễn Thượng Hiền, Phường 5, Quận Bình Thạnh	đường Nguyễn Thượng Hiền, Phường 5, Quận Bình Thạnh	đường Nguyễn Thượng Hiền, Phường 5, Quận Bình Thạnh
Bán nhà đẹp Dân xây sẵn ở ngay chỉ 3 tỷ TT Ba Đình Gần Phố	1.74	29	3.0	4.0		"Bán nhà đẹp Dân xây sẵn ở ngay chỉ 3 tỷ TT Ba Đình Gần Phố .
- Nhà vị trí đẹp Gần Phố Hoàng Hoa Thám , Vĩnh Phúc , Quận Ba Đình . Tiếp Giáp 3 Quận Cầu Giấy - Tây Hồ , Ba Đình .
- Khu dân trí cao Gần Trường Cấp 1,2 Vĩnh Phúc , Trường CĐ Sư Phạm ..
- Thiết kế nhà 5 Tầng có 3 PN đầy đủ công năng. sẵn ở ngay .
- Sổ riêng chính chủ, sẵn sàng giao dịch .
Liên hệ Quân 0356793618 xem nhà trực tiếp."	False	False	True	False	Phố Hoàng Hoa Thám, Vĩnh Phúc, Quận Ba Đình	Phố Hoàng Hoa Thám, Vĩnh Phúc, Quận Ba Đình	Phố Hoàng Hoa Thám, Vĩnh Phúc, Quận Ba Đình
DIỆN TÍCH KHỦNG 94m2 Bình Thạnh Phan Văn Trị MT 5m NỞ HẬU chỉ nhỉnh 8T	3	94	3.0	3.0		"Bán GẤP! nhà phường 11 Bình Thạnh, khu vực gần Phạm Văn Đồng Lê Quang Định, giáp Gò Vấp.
+ Kết cấu: 94m2, 5.3x17, 3 phòng ngủ,có sân trước, sân sau, giếng trời, ban công thoáng mát, có phòng ngủ dưới trệt phù hợp nhà có trẻ em hoặc người lớn tuổi.
+ Chỉ 30m ra mặt tiền, hẻm sạch sẽ, rộng thoáng.
+ Phù hợp định cư lâu dài, kinh doanh online....
+ Pháp lý sạch, sổ cưc đẹp, hoàn công đầy đủ, sang tên ngay.
Chủ cần bán gấp nên giá chỉ 8tỷ 35, Trực tiếp gặp chủ thương lượng.
KẾT THÔNG TIN THẬT NHÀ THẬT.
Liên hệ xem nhà ngay 24/24: Phú Lâm 0949206227, chuyên nhà ngợp giá tốt Bình Thạnh, nguồn nhà đa dạng đáp ứng mọi nhu cầu khách hàng."	False	False	True	False	phường 11, quận Bình Thạnh	phường 11, quận Bình Thạnh	phường 11, quận Bình Thạnh
Bán nhà 4 tầng 70m2 đường 31m siêu đẹp lô góc trung tâm Sở Dầu, Hồng Bàng, Hải Phòng 7,5tỷ	8.35	70	4.0	4.0	Sở Dầu, Hồng Bàng, Hải Phòng	"Bán Nhà Đẹp 70m2 x 4 Tầng Mặt Đường Rộng 30m Tại Vinhomes Riverside Chợ Hoa Quả - Độc Đáo, Tiện Nghi Vượt Trội!
Địa chỉ: Sở Dầu, Hồng Bàng, Hồng Bàng.
Liên hệ: Mrs Tâm - 0796-336-866
Thông tin chi tiết:
✅ Diện tích: 70m2, xây dựng 4 tầng - không gian thoải mái và tiện nghi đỉnh cao.
✅ Mặt đường rộng 30m, vỉa hè rộng 5m, xẻ khe rộng 4m - không gian di chuyển cho xe máy và ô tô cực kỳ thoải mái.
✅ Nhà độc lập, mặt tiền rộng 5m, dài 14m - thiết kế vuông vắn và chắc chắn.
✅ Hướng Đông Nam, bìa đỏ chính chủ - pháp lý rõ ràng.
Nhà 4 tầng với tường toàn bộ 20, được thiết kế thông minh và đầy đủ công năng:
* Phòng khách rộng rãi.
* Phòng bếp tiện nghi.
* 4 phòng ngủ riêng tư.
* 4 nhà vệ sinh hiện đại.
* Phòng thờ và phòng kho tiện lợi.
* Ban công ở mỗi tầng có không gian thư giãn.
Vị trí đắc địa tại khu vực Chợ Hoa Quả, cạnh Đầu Mối Hoa Quả Nam Cầu Bính. Gần nhiều tiện ích như Vinhomes Riverside, Hoàng Huy Grand, Khu Hành Chính Quận Hồng Bàng, Vinhomes Thượng Lý, và nhiều điểm đến quan trọng khác.
Vị trí tuyệt vời, phù hợp cho việc mở văn phòng công ty hoặc kinh doanh buôn bán.
GIÁ BÁN: Chỉ 7.5 tỷ - Còn thỏa thuận cho khách hàng nhanh chóng và quyết đoán.
Hãy liên hệ ngay với Mrs Tâm - 0796-336-866 để biết thêm chi tiết và xem nhà. Đừng để lỡ cơ hội sở hữu ngôi nhà tại Vinhomes Riverside Chợ Hoa Quả!"	False	False	True	False	Sở Dầu, Hồng Bàng, Hải Phòng	Sở Dầu, Hồng Bàng, Hải Phòng	Sở Dầu, Hồng Bàng, Hải Phòng
[View Vườn Hoa] Nhỉnh 4 tỷ bạn đã sở hữu 37,5m2 nhà 3 tầng mới tại khu TĐC Trâu Quỳ	7.5	37	3.0	3.0		"[View Vườn Hoa] Nhỉnh 4 tỷ bạn đã sở hữu 37,5m2 nhà 3 tầng mới tại khu TĐC Trâu Quỳ.

+ Diện tích: 37,5m2, mặt tiền 3,75m, dài 10m, tọa hướng Tây Bắc.

+ Giá bán: 4.5 tỷ đồng ( chủ đang rất cần tiền giá nào cũng bán ).

+ Đường trước rộng 12m có vỉa hè, đối diện là vườn hoa rộng nên đỗ xe thoải mái, nhà đã xây xong phần thô, nhưng nay gia đình có việc cần bán, xung quanh các nhà cũng đang xây dựng rất nhiều, vị trí thuận tiện đi lại, mua ở và kết hợp làm văn phòng công ty, khu vực phát triển bật nhất của huyện Gia Lâm, với mật độ dân cư đông đúc...

+ Pháp lý: Sổ đỏ chính chủ, không cầm cố, sẵn sàng công chứng, hỗ trợ vay bank.

Liên hệ trước 30 phút để xem đất: 0925333999
ThuyAn.Net – Cam Kết Bán Đúng Giá - Không Thu Phí Người Mua - Hỗ Trợ Thủ Tục Sang Tên!"	False	False	True	False	Khu TĐC Trâu Quỳ	Khu TĐC Trâu Quỳ	Khu TĐC Trâu Quỳ
1 SẸC DƯƠNG THỊ MƯỜI - HẺM Ô TÔ – 56M2 - 4 TẦNG - CHỈ 4.7 TỶ	5.8	56		3.0	duong thị mười	"+Ngang 4m dài 14m – 4 tầng

+ Nhà đẹp 1T 2L ST đúc BTCT có 4PN 3WC, thiết kế kiểu lệch tầng, chủ dân xây dựng, xây rất tâm huyết.

+ Hẻm ô tô, sạch sẽ, an ninh.

+Dương thị mười - Tân thới hiệp - Q12, tiện ích đầy đủ

+ Phía sau nhà sẽ làm đường lộ giới 12m

+ Sổ hồng riêng vuông.

Giá 4,7 tỷ. Thương lượng

+ Lh 0934 874 723 A Hiếu

+ Nhận ký gửi mua bán BĐS"	True	False	True	False	Đường Dương Thị Mười, Phường Tân Thới Hiệp, Quận 12	duong thị mười	Đường Dương Thị Mười, Phường Tân Thới Hiệp, Quận 12
NHÀ SÁT MẶT TIỀN NGUYỄN HỮU CẢNH, PHƯỜNG 22, BÌNH THẠNH, 2 TẦNG BTCT, 57M2, 5.x TỶ	4.75	57	4.0	4.0		"- Diện tích: 5.7 x 10m
- Kết cấu nhà: 1 trệt 1 lầu BTCT, 4 PN, 4WC. Có ban công và sân phơi. Dọn vào ở luôn
- Đường thông đi tứ tung, an ninh, sạch sẽ, yên tĩnh. Khu vực Nguyễn Hữu Cảnh, Điện Biên Phủ, Xô Viết Nghệ Tĩnh, Ngô Tất Tố
- Gần chợ Võ Duy Ninh, BV Quốc tế Vinmec, Thảo Cầm Viên, Landmark 81, KDL Văn Thánh, vòng xoay Hàng Xanh. Giáp ranh quận 1 và Thủ Thiêm; tiện ích bủa vây
- Sổ hồng chính chủ, hoàn công đủ, pháp lý chuẩn, công chứng mua bán trong ngày"	False	False	True	False	Nguyễn Hữu Cảnh, Phường 22, Quận Bình Thạnh	Nguyễn Hữu Cảnh, Phường 22, Quận Bình Thạnh	Nguyễn Hữu Cảnh, Phường 22, Quận Bình Thạnh
Gò Vấp HXH Phạm Văn Chiêu Phường 9, 72m2, 4x18, 5 tầng chỉ 10.7 tỷ	5.9	72	4.0	4.0	Phạm Văn Chiêu	"MS 24523
* Vị trí: cách mặt tiền đường Phạm Văn Chiêu vài bước chân, khu vực nhiều dịch vụ tiện ích, kết nối giao thông thuận lợi. Tiện kinh doanh, cho thuê.
* Diện tích 72m2, 5 tầng, 4 phòng ngủ, 4 WC, sân để xe hơi.
* Hẻm xe hơi, thông.
* Sổ hồng công nhận đủ , hoàn công đủ."	False	True	True	True	đường Phạm Văn Chiêu, Phường 9, Quận Gò Vấp	Phạm Văn Chiêu	đường Phạm Văn Chiêu, Phường 9, Quận Gò Vấp
Chính chủ cần bán 38,3m2 nhà 3 tầng ngõ 197 Phúc Lợi. Đường trước nhà rộng 2m	10.7	38	3.0	3.0	Phúc Lợi, Long Biên, Hà Nội	"Chính chủ cần bán 38,3m2 nhà 3 tầng ngõ 197 Phúc Lợi. Đường trước nhà rộng 2m.

+ Diện tích: 38,3m2, mặt tiền rộng 4,02m, nở hậu 4,2m, dài 9,74m, tọa hướng Đông Nam.

+ Giá bán: 2.9 tỷ đồng ( mua bán có thương lượng, ra lộc cho người thiện chí ).

+ Nhà gồm: 3 phòng ngủ, 3 phòng vệ sinh, phòng khách, phòng bếp. Vị trí đắc địa: Nằm trong khu dân cư đông đúc, gần chợ Phúc Lợi, gần trường học các cấp, tiện ích xung quanh đầy đủ, giao thông thuận tiện...

+ Chủ nhà cần tiền trả nợ ngân hàng nên bán với giá rẻ hơn thị trường, cơ hội cho những ai đang tìm kiếm một căn nhà để ở hoặc đầu tư sinh lời.

+ Pháp lý: Sổ đỏ chính chủ, không cầm cố, sẵn sàng công chứng, hỗ trợ vay bank.

Liên hệ trước 30 phút để xem đất: 0925333999
ThuyAn.Net – Cam Kết Bán Đúng Giá - Không Thu Phí Người Mua - Hỗ Trợ Thủ Tục Sang Tên!"	True	True	True	True	Phúc Lợi, ngõ 197	Phúc Lợi, Long Biên, Hà Nội	Phúc Lợi, ngõ 197
Chính chủ cần bán 38,3m2 nhà 3 tầng ngõ 197 Phúc Lợi. Đường trước nhà rộng 2m	2.9	38	3.0	3.0	Phúc Lợi, Long Biên, Hà Nội	"Chính chủ cần bán 38,3m2 nhà 3 tầng ngõ 197 Phúc Lợi. Đường trước nhà rộng 2m.

+ Diện tích: 38,3m2, mặt tiền rộng 4,02m, nở hậu 4,2m, dài 9,74m, tọa hướng Đông Nam.

+ Giá bán: 2.9 tỷ đồng ( mua bán có thương lượng, ra lộc cho người thiện chí ).

+ Nhà gồm: 3 phòng ngủ, 3 phòng vệ sinh, phòng khách, phòng bếp. Vị trí đắc địa: Nằm trong khu dân cư đông đúc, gần chợ Phúc Lợi, gần trường học các cấp, tiện ích xung quanh đầy đủ, giao thông thuận tiện...

+ Chủ nhà cần tiền trả nợ ngân hàng nên bán với giá rẻ hơn thị trường, cơ hội cho những ai đang tìm kiếm một căn nhà để ở hoặc đầu tư sinh lời.

+ Pháp lý: Sổ đỏ chính chủ, không cầm cố, sẵn sàng công chứng, hỗ trợ vay bank.

Liên hệ trước 30 phút để xem đất: 0925333999
ThuyAn.Net – Cam Kết Bán Đúng Giá - Không Thu Phí Người Mua - Hỗ Trợ Thủ Tục Sang Tên!"	True	True	True	True	ngõ 197 Phúc Lợi	Phúc Lợi, Long Biên, Hà Nội	ngõ 197 Phúc Lợi
Bán Nhà Khu Quy Hoạch Trần Anh Tông,P8.Đà Lạt	2.9					"Nhà đường TRẦN ANH TÔNG , phường 8, TP. Đà Lạt
Đường xe hơi rộng rãi đường nhựa 8m , thuận tiện di chuyển khu tập trung nhiều villa - khách sạn - Homestay

Vị trí: khu quy hoạch đồi 52 TRẦN ANH TÔNG , phường 8, TP. Đà Lạt
Diện tích: 200 m2. Ngang: 10 Dài: 20
Kết cấu: 1 trệt, 1 lầu, 1 áp
Công năng: 2 PK, 1 bếp, 4PN trong đó có 1 phòng đôi , 4 WC , 3 phòng có wc riêng
Lộ giới: Đường nhựa 8m

Cách trung tâm 2,5 km
Khu vực an ninh, dân trí cao, thích hợp định cư lâu dài"	False	False	True	False	đường Trần Anh Tông, phường 8, TP. Đà Lạt	đường Trần Anh Tông, phường 8, TP. Đà Lạt	đường Trần Anh Tông, phường 8, TP. Đà Lạt
BÁN NHÀ HXH VƯỜN LÀI, Q. TÂN PHÚ - 76M (4.2x18) A4 - 4 TẦNG BTCT - CHỈ NHỈNH 5 TỶ.	5.4	76	4.0	3.0	Thành phố Hồ Chí Minh	"Mô tả:
???? Kết cấu: 1 trệt 2 lầu sân thượng, gồm 4PN, 3WC, sân thượng trước sau.
???? Diện tích: 76m2 (4.2x18) sổ vuông A4, công nhận đủ.
???? Hẻm xe hơi thông tứ tung, gần mặt tiền, khu dân trí, đồng bộ cao tầng.
???? Vị trí siêu đẹp, gần Lũy Bán Bích, Tân Hương, Thoại Ngọc Hầu, 5p đến Aeon Mall Tân Phú.
????Tiện ích xung quanh đầy đủ, gần trường học, bệnh viện, chợ, siêu thị Bách Hoá Xanh.
???? Pháp lý chuẩn, sổ tại nhà, sang tên công chứng ngay.
===================================
???? Hãy gọi xem nhà ngay: 0354299320"	False	False	True	False	Lũy Bán Bích, Quận Tân Phú	Thành phố Hồ Chí Minh	Lũy Bán Bích, Quận Tân Phú
BÁN NHÀ BÌNH TÂN LÊ ĐÌNH CẨN, OTO 83M2-2T 4,6 TỶ LH 0948362610	5.4	83			Lê Đình Cẩn, Tân Tạo, Bình Tân	"BÁN NHÀ BÌNH TÂN, LÊ ĐÌNH CẨN, 83M2 2 TẦNG 4,6 TỶ LH 0948362610
_ Đường ô tô thông, giáp Bà Hom Quận 6, cách Aeon Mall Tên Lửa chỉ 5 phút, bệnh viện Bình Tân chỉ 5 phút.
_ Diện tích 83m2 4,2*18m, nở hậu 8m.
_ Kết cấu 2 tầng 1 trệt 1 lầu, 3PN, 2WC, ban công thoáng mát.
_ Thông Mã Lò, Lê Văn Quới, Hương Lộ 2, Tỉnh Lộ 10,...
_ Sổ hoàn công đủ, mua bán công chứng ngay.
_ Liên hệ Hoa kho nhà 1000 căn xem ngay gọi 0948362610"	False	False	True	False	Đường Lê Định Căn, Phường Tên Lửa, Quận Bình Tân	Lê Đình Cẩn, Tân Tạo, Bình Tân	Đường Lê Định Căn, Phường Tên Lửa, Quận Bình Tân
