Title	Price	Links	Diện tích (m2)	Số phòng ngủ	Số phòng WC	Địa chỉ	Description	Chỗ để xe hơi	Đang cho thuê	CSVC xung quanh	Mặt tiền	index	Số tầng	ExtractedTitle	Address1	Address2
bán nhà phố bùi xương trạch 40m2x6t, 2mặt thoáng-ôtô-kd, giá 4,35 tỷ	4.35	https://batdongsan.vn/ban-nha-pho-bui-xuong-trach-40m2x6t-2mat-thoang-oto-kd-gia-435-ty-r260261	40.0	5.4			". mô tả.
nhà nằm ở vị trí trung tâm otô đỗ cửa, ngõ rộng thông thoáng,tiện ích không thiếu thứ gì điện, đường ,trường , trạm ….giao thông cực kỳ thuận tiện.
nhà chủ tự xây dựng khung cột chắc chắn:
hiện trạng nhà 5.5 tầng.
- tầng 1: kinh doanh, bếp, vs và tiểu cảnh
- tầng lửng : phòng khách rộng
- tầng 3.4 : mỗi tầng 2 phòng ngủ,vs cầu thang giữa.
- tầng 5: phòng thờ và sân phơi .
- tầng 6: hệ thống tum chống nóng.
+ nhà 2 mặt thoáng trước sau, phòng nào cũng có cửa sổ, ban công phía trước
sổ đỏ chính chủ, pháp lí sạch.
-gía : 4,35 tỷ
liên hệ : chị tâm 0985428591 để được xem nhà miễn phí."	True	False	True	False	0	5.8	phố Bùi Xương Trạch	phố Bùi Xương Trạch	phố Bùi Xương Trạch
chỉ 93tr/m2,5x17m,bán nhà hxh bạch đằng mt1,bình thạnh, nhỉnh 7 tỷ	7.95	https://batdongsan.vn/chi-93trm25x17mban-nha-hxh-bach-dang-mt1binh-thanh-nhinh-7-ty-r260260	80.0			Thành phố Hồ Chí Minh	"chỉ 93tr/m2,5x17m,bán nhà hxh bạch đằng mt1,bình thạnh, nhỉnh 7 tỷ

????ts: 23vc001_610

????gọi ngay vân nhà to - 0901248068 (call, zalo, viber) - 24/7
—------------------------
+ vị trí quá đẹp cho khách xây chdv, mở văn phòng ngay vòng xoay hàng xanh, gần chợ bà chiểu, sát quận 1, phú nhuận.vừa ở vừa cho thuê
+ giao thông thuận lợi đi điện biên phủ, đinh bộ lĩnh, xô viết nghệ tĩnh, đi đâu cũng được.
+ khu vực dân trí, yên tĩnh, an ninh, gần cụm trường đh hutech, hồng bàng, ngoại thương,...
+ kết cấu: 3 tầng btct, 5pn, ban công, khách+bếp, giếng trời siêu mát.
+ sổ vuông, pháp lý chuẩn, công chứng ngay, hoàn công đầy đủ.

bán nhà hẻm 194 bạch đằng; bán nhà 29 bạch đằng"	False	False	True	False	1	3.0	hẻm xương Bạch Đằng, MT1, Bình Thạnh	Thành phố Hồ Chí Minh	hẻm xương Bạch Đằng, MT1, Bình Thạnh
ngang 7.5m,bán nhà hxh v1 điện biên phủ, bình thạnh, chỉ 12 tỷ 4	12.4	https://batdongsan.vn/ngang-75mban-nha-hxh-v1-dien-bien-phu-binh-thanh-chi-12-ty-4-r260259	140.0			Thành phố Hồ Chí Minh	"ngang 7.5m,bán nhà hxh v1 điện biên phủ, bình thạnh, chỉ 12 tỷ 4

????ts: 23vc004_1020

????gọi ngay vân nhà to - 0901248068 (call, zalo, viber) - 24/7
—------------------------
-vị trí đắc địa phường 15, gần chợ bà chiều, cầu điện biên phủ, ngã 4 hàng xanh, cạnh quận 1, phú nhuận, xô viết nghệ tĩnh, đinh bộ lĩnh chỉ 1p.
- sát cụm tam giác vàng trường đh lớn: hutech, hồng bàng, ngoại thương, gtvt, tài chính-kinh tế, khai thác dòng tiền hiệu suất tối đa.
- nhà cũ tiện xây mới, phù hợp xây chdv, biệt thự…
- diện tích 140m2(7.5x18.5m)
- pháp lý sạch sẽ, chỉnh chủ 1 đời, chưa qua đầu tư, công chứng ngay.

bán nhà hẻm 27 điện biên phủ quận bình thạnh; bán nhà hẻm điện biên phủ, phường 17, bình thạnh"	False	True	True	False	2	0.2	điện Biên Phủ, Phường 15, Quận Bình Thạnh	Thành phố Hồ Chí Minh	điện Biên Phủ, Phường 15, Quận Bình Thạnh
nhà đẹp ngọc lâm- long biên, 90m x 5 tầng, ôtô, thang máy, kinh doanh	11.5	https://batdongsan.vn/nha-dep-ngoc-lam-long-bien-90m-x-5-tang-oto-thang-may-kinh-doanh-r260258	90.0	4.0	5.0		"nhà đẹp ngọc lâm- long biên, 90m x 5 tầng, ôtô, thang máy, kinh doanh
-cách cầu chương dương 200m, mặt ngõ ôtô thông nguyễn văn cừ -ngọc lâm, 3 phút sang hoàn kiếm, vài bước chân ra mipec long biên
-nhà xây 5 tầng thoáng trước sau, thiết kế hiện đại, thang máy nhập khẩu, nội thất cơ bản, 4 phòng ngủ khép kín.
sổ đỏ chính chủ, pháp lý chuẩn
chào bán : 11.5 tỷ ( có thương lượng )
miễn phí xem nhà và tư vấn : trần hải 0906098086"	True	False	False	False	3	5.0	ngõ ôtô Nguyễn Văn Cừ, Ngọc Lâm, Long Biên	ngõ ôtô Nguyễn Văn Cừ, Ngọc Lâm, Long Biên	ngõ ôtô Nguyễn Văn Cừ, Ngọc Lâm, Long Biên
nhà đẹp ngay ngả 3 lã xuân oai, tăng nhơn phú a, thủ đức 50m, 2 tầng, giá 3 tỷ	3.0	https://batdongsan.vn/nha-dep-ngay-nga-3-la-xuan-oai-tang-nhon-phu-a-thu-duc-50m-2-tang-gia-3-ty-r260255	50.0			666 Lã Xuân Oai	"- kết cấu btct 2 tầng 2pn 2wc.
- vị trí ngay ngã ba lã xuân oai lê văn việt, chợ nhỏ.
- hẻm sạch sẽ an ninh, yên tĩnh.
- pháp lý sạch sẽ, sổ vuông vức, hoàn công đủ, công chứng ngay.
liên hệ: anh thuận xem nhà.
uy tín – tận tâm - trách nhiệm – tốc độ - giá trị.
giúp người mua mua được căn nhà ưng ý!
giúp người bán bán được căn nhà giá trị!"	False	False	True	False	4	2.0	ngã ba Lã Xuân Oai, Lê Văn Việt, Tăng Nhơn Phú A, Quận Thủ Đức	666 Lã Xuân Oai	ngã ba Lã Xuân Oai, Lê Văn Việt, Tăng Nhơn Phú A, Quận Thủ Đức
nhà đẹp ngay ngả 3 lã xuân oai, tăng nhơn phú a, thủ đức 50m, 2 tầng, giá 3 tỷ	3.0	https://batdongsan.vn/nha-dep-ngay-nga-3-la-xuan-oai-tang-nhon-phu-a-thu-duc-50m-2-tang-gia-3-ty-r260254	50.0			666 Lã Xuân Oai	"- kết cấu btct 2 tầng 2pn 2wc.
- vị trí ngay ngã ba lã xuân oai lê văn việt, chợ nhỏ.
- hẻm sạch sẽ an ninh, yên tĩnh.
- pháp lý sạch sẽ, sổ vuông vức, hoàn công đủ, công chứng ngay.
liên hệ: anh thuận xem nhà.
uy tín – tận tâm - trách nhiệm – tốc độ - giá trị.
giúp người mua mua được căn nhà ưng ý!
giúp người bán bán được căn nhà giá trị!"	False	False	True	False	5	2.0	ngã 3 lã xuân oai, Tăng Nhơn Phú A, Quận Thủ Đức	666 Lã Xuân Oai	ngã 3 lã xuân oai, Tăng Nhơn Phú A, Quận Thủ Đức
chính chủ cần bán căn nhà thạch bàn - long biên - 35m - 4 tầng - ô tô qua nhà - chỉ nhỉnh 3 tỷ	3.3	https://batdongsan.vn/chinh-chu-can-ban-can-nha-thach-ban-long-bien-35m-4-tang-o-to-qua-nha-chi-nhinh-3-ty-r260252	35.0	3.0	3.0	Thạch Bàn Long Biên Hà Nội	"chính chủ cần bán căn nhà thạch bàn - long biên - 35m - 4 tầng - ô tô qua nhà - chỉ nhỉnh 3 tỷ
vị trí đỉnh của chóp, cầu vĩnh tuy giai đoạn 2 hoàn thành thì đâu còn nhà để bán... tầm tiền chỉ nhỉnh 3 tỷ nhỏ .
- ngõ thông 2 đầu, ô tô đỗ cổng 20m ra ô tô tránh
- nhà xây 4 tầng - 1 tum. mới tinh.
- thiết kế:
+ tầng 1: phòng khách, bếp, wc
+ tầng 2,3: phòng ngủ + wc.
+ tầng 4: phòng thờ + sân phơi.

- nhà hiện tại chỉ có 2 ngủ khép kín, nhưng có thể cải tạo tầng 4 thêm 1 ngủ nữa.

- sổ đỏ đẹp, vuông vắn đang cất két chờ sang tên chủ mới"	True	False	False	False	6	4.0	Thạch Bàn, Long Biên	Thạch Bàn Long Biên Hà Nội	Thạch Bàn, Long Biên
vị trí siêu đẹp bán nhà gần hồ mộ lao lô góc 2 thoáng 42m 5 tầng giá 5.35 tỷ	5.35	https://batdongsan.vn/vi-tri-sieu-dep-ban-nha-gan-ho-mo-lao-lo-goc-2-thoang-42m-5-tang-gia-535-ty-r260250	42.0	5.0	4.0		"vị trí siêu đẹp bán nhà gần hồ mộ lao lô góc 2 thoáng 42m 5 tầng giá 5.35 tỷ

- nhà bán nằm trong khu dân trí cao, an ninh tốt, hàng xóm thân thiện, gần trường các cấp, chợ mộ lao, ngay khu đô thị mộ lao, cách big c, coopmart, trường đại học kiến trúc, an ninh, bưu chính 500m..tiện ích bạt ngàn.
- ngõ trước nhà 3m, ô tô cách nhà 70m, giao thông thuận tiện.
- nhà lô góc được thiết kế 5 tầng, phòng nào cũng có cửa sổ rất thoáng mát, chủ để lại cơ bản nội thất gồm 4 điều hòa, giường tủ...
+ tầng 1: khách, bếp, vs.
+ tầng 2: ngủ, khách, vs.
+ tầng 3,4: tổng 4 ngủ, 2 vs.
+ tầng 5: 2 sân phơi siêu rộng.
- sổ đổ vuông đẹp, nở hậu nhẹ.
-liên hệ trực tiếp cho nguyên anh:0819508701 để biết thêm chi tiêt."	True	False	True	False	7	5.0	gần hồ Mộ Lao, Khu đô thị Mộ Lao	gần hồ Mộ Lao, Khu đô thị Mộ Lao	gần hồ Mộ Lao, Khu đô thị Mộ Lao
1 căn duy nhất tại thịnh quang - trung tâm đống đa - ở ngay - nội thất nhập khẩu	6.0	https://batdongsan.vn/1-can-duy-nhat-tai-thinh-quang-trung-tam-dong-da-o-ngay-noi-that-nhap-khau-r260249	50.0	4.0	4.0		"1 căn duy nhất tại thịnh quang - trung tâm đống đa - ở ngay - nội thất nhập khẩu
dt 50m2 - 4 tầng - 4 ngủ - thiết kế tinh tế, giếng trời, thoáng sáng, nội thất sang chảnh, xịn xò, khách chỉ việc xách vali về ở.
nhà cạnh ngõ 67 thái thịnh, thông khắp ngả ngõ 181 yên lãng, đường láng, ngõ thái thịnh 1, 2 phút ra ngã tư sở đi đâu cũng tiện.
ngõ rộng, ba gác phóng ầm ầm.
bán kính 1km đủ tiện ích, chợ thái thịnh, chợ vĩnh hồ, trung tâm thương mại, mầm non, cấp 1,2,3 thịnh quang, đại học thủy lợi, công đoàn, hv ngân hàng.
sổ đỏ đẹp, giao dịch trong ngày.
liên hệ ngay gặp chính chủ!!"	False	False	True	False	8	4.0	ngõ 67 thái thịnh, Đống Đa, Thành phố Hà Nội	ngõ 67 thái thịnh, Đống Đa, Thành phố Hà Nội	ngõ 67 thái thịnh, Đống Đa, Thành phố Hà Nội
bán nhà riêng ngõ 217 trần phú văn quán hà đông 34m 4tầng giá 3.9 tỷ	3.9	https://batdongsan.vn/ban-nha-rieng-ngo-217-tran-phu-van-quan-ha-dong-34m-4tang-gia-39-ty-r260243	34.0	4.0	4.0		"bán nhà riêng ngõ 217 trần phú văn quán hà đông 34m 4tầng giá 3.9 tỷ
nhà xây mới 4 tầng, ngõ nông, trung tâm văn quán bạt ngàn tiện ích trong bán kính 500m có đầy đủ hệ thống các trường học từ mầm non đến thcs, chợ, siêu thị, ngân hàng, sân thể thao,…
khu vực đáng sống bậc nhất hà đông. an ninh đảm bảo, hàng xóm thân thiện, dân trí cao.
thiết kế:
tầng 1: khách, bếp, wc
tầng 2,3: mỗi tầng 02 phòng, wc giữa
tầng 4: phòng thờ, sân phơi
sổ đỏ vuông đẹp, sẵn sàng giao dịch.
-liên hệ cho nguyên anh:0819580701 để biết thêm thông tin chi tiết."	False	False	True	False	9	4.0	ngõ 217 Trần Phú, Phường Văn Quán, Hà Đông	ngõ 217 Trần Phú, Phường Văn Quán, Hà Đông	ngõ 217 Trần Phú, Phường Văn Quán, Hà Đông
bán nhà 4 tầng đường an thượng 38, phường mỹ an, khu phố tây an thượng. giá đầu tư	8.3	https://batdongsan.vn/ban-nha-4-tang-duong-an-thuong-38-phuong-my-an-khu-pho-tay-an-thuong-gia-dau-tu-r260242	60.0	4.0	5.0	Đường An Thượng, Phường Mỹ An, Quận Ngũ hành Sơn, Đà Nẵng	"bán nhà 4 tầng đường an thượng 38, phường mỹ an, khu phố tây an thượng.
diện tích đất: 60m2, ngang:5m dài: 12m
đường 5m5 lề 3m
diện tích sàn: 220m2, nhà xây kiên cố.
công năng nhà 4 phòng ngủ 5 wc, phòng khách, phòng bếp, phòng thờ, sân phơi, kho
vị trí ngay khu phố tây an thượng nhộn nhịp, gần đỗ bá, cách mỹ khê 500m
giá đầu tư: 8,3 tỷ có thương lượng
liên hệ: 0934822661 bình"	True	False	False	False	10	4.0	đường An Thượng 38, Phường Mỹ An, Khu Phố Tây An Thượng	Đường An Thượng, Phường Mỹ An, Quận Ngũ hành Sơn, Đà Nẵng	đường An Thượng 38, Phường Mỹ An, Khu Phố Tây An Thượng
cần bán nhà cấp 4 - 2 mặt tiền đường nguyễn thiện kế, an hải đông, sơn trà.	5.15	https://batdongsan.vn/can-ban-nha-cap-4-2-mat-tien-duong-nguyen-thien-ke-an-hai-dong-son-tra-r260239	77.0	2.0	2.0		"cần bán nhà cấp 4 - 2 mặt tiền đường nguyễn thiện kế, an hải đông, sơn trà.
diện tích: 77m2 ngang 5,2m vuông vức.
hướng đông bắc
đường trước nhà 5m lề 1m, phía sau có kiệt 5m thông thoáng, đậu ô tô được.
vị trí đắc địa cách biển mỹ khê 500m, gần cầu rồng, nối nguyễn văn thoại & võ văn kiệt. cách trường học, bệnh viện, chợ chỉ 300m.
giá bán: 5,15 tỷ. thương lượng chính chủ
lh xem nhà: 0934822661"	True	False	True	True	11	0.4	đường Nguyễn Thiện Kế, Phường An Hải Đông, Quận Sơn Trà	đường Nguyễn Thiện Kế, Phường An Hải Đông, Quận Sơn Trà	đường Nguyễn Thiện Kế, Phường An Hải Đông, Quận Sơn Trà
gấp bán ngang 9.5m, bán nhà hxh hoàng hoa thám bình thạnh, 11 tỷ 200	11.2	https://batdongsan.vn/gap-ban-ngang-95m-ban-nha-hxh-hoang-hoa-tham-binh-thanh-11-ty-200-r260225	171.0			Thành phố Hồ Chí Minh	"gấp bán ngang 9.5m, bán nhà hxh hoàng hoa thám bình thạnh, 11 tỷ 200

????ts: 23vc001_1020

????gọi ngay vân nhà to - 0901248068 (call, zalo, viber) - 24/7
—------------------------
+ ngang 9.5m phù hợp xây chdv, tách thửa hoặc xây biệt thự mini.
+ dt 171m2(9.5x18m) công nhận đủ.
+ sát tường gò vấp, phú nhuận, vị trí đẹp ở phường 5, quận nhứt, thuận lợi đi phan đăng lưu, lê quang định,nguyễn văn đậu.
+ dân trí cao, văn minh, hàng xóm thân thiện, gần chợ cây quéo, bà chiểu, bv gia định, trường học các cấp, ngân hàng,...
+ sổ 1 đời chủ 70 năm, pháp lý chuẩn, công chứng ngay.

giá đất đường lê quang định; mặt bằng lê quang định"	False	False	True	False	12	0.0	đường Hoàng Hoa Thám, Phường 5, Quận Bình Thạnh	Thành phố Hồ Chí Minh	đường Hoàng Hoa Thám, Phường 5, Quận Bình Thạnh
chỉ 82tr/m2, 9x18m, bán nhà hxh hoàng hoa thám bình thạnh, nhỉnh 11 tỷ	11.7	https://batdongsan.vn/chi-82trm2-9x18m-ban-nha-hxh-hoang-hoa-tham-binh-thanh-nhinh-11-ty-r260220	167.0			Thành phố Hồ Chí Minh	"chỉ 82tr/m2, 9x18m, bán nhà hxh hoàng hoa thám bình thạnh, nhỉnh 11 tỷ

????ts: 23vc002_1020

????gọi ngay vân nhà to - 0901248068 (call, zalo, viber) - 24/7
—------------------------
+giá quá tốt - chưa đến 85tr/mv hxt không có căn thứ 2.
+ vị trí đẹp ở phường 5, giáp phú nhuận, quận nhứt, gò vấp, thuận lợi đi phan đăng lưu, lê quang định,nguyễn văn đậu.
+ hxt 5m xe hơi ngủ nhà, phù hợp xây chdv- tách thửa- hoặc xây biệt thự.
+ tiện ích đầy đủ. dân trí cao, hàng xóm nhà 4,5 tấm, gần chợ cây quéo, bà chiểu, bv gia định, trường học các cấp, ngân hàng,...
+ sổ 1 đời chủ, pháp lý chuẩn, công chứng ngay.

bán nhà mặt tiền lê quang định, gò vấp; bán nhà 219 lê quang định"	True	False	True	True	13	0.2	đường Hoàng Hoa Thám, Phường Bình Thạnh	Thành phố Hồ Chí Minh	đường Hoàng Hoa Thám, Phường Bình Thạnh
bán nhà hẻm thông đường 18d, dt: 4.2x10m, 1 lầu, giá: 3.1 tỷ tl liên hệ ngay	3.1	https://batdongsan.vn/ban-nha-hem-thong-duong-18d-dt-42x10m-1-lau-gia-31-ty-tl-lien-he-ngay-r260219	42.0				"- bán nhà: hẻm thông đường 19d, dt: 4.2x10m.
- tiện ích: hẻm 3m thông ra đường liên khu 2-10, số 16 và gò xoài, cách mặt tiền đường chỉ vài bước chân. bán kính tiện ích nằm trong 1km như chợ, siêu thị, trường học, cửa hàng công nghệ, dịch vụ ăn uống,v.v...
- kết cấu: 1 trệt, 1 lầu.
- vị trí: khu dân cư an ninh, dân trí cao, văn minh, sạch sẽ.
- giá: 3.1 tỷ tl.

liên hệ: 0707725457 phú cường.
hỗ trợ khách hàng đăng bộ sang tên hoàn toàn miễn phí.
cam kết những thông tin trên đúng 100% sự thật.
uy tín - chuyên nghiệp - tốc độ - hiệu quả.
sàn giao dịch bđs tanphuland.
đc: 229 lê văn quới, p. bình trị đông, q. bình tân, tp. hcm."	False	False	True	False	14	1.6	hẻm thông đường 18d, Phường Bình Trị Đông, Quận Bình Tân, TP. HCM	hẻm thông đường 18d, Phường Bình Trị Đông, Quận Bình Tân, TP. HCM	hẻm thông đường 18d, Phường Bình Trị Đông, Quận Bình Tân, TP. HCM
tân uyên lên thành phố, bán nhà ngay trung tâm tân uyên giá chỉ 2.58 tỷ có shr	2.58	https://batdongsan.vn/tan-uyen-len-thanh-pho-ban-nha-ngay-trung-tam-tan-uyen-gia-chi-258-ty-co-shr-r260215	61.0	3.0	2.0	tân phước khánh 32	"compound phước điền citizen
* vị trí: đường tân phước khánh 32, phường tân phước khánh, tp tân uyên, bình dương.
* diện tích: từ 60m2-120m2
* thiết kế: kiến trúc cổ điển 1 trệt 1 lầu, 1 trệt 2 lầu, đường trước nhà 15m, vỉa hè 2.5m mỗi bên, có cây xanh, điện nước âm
* pháp lí: sổ hồng từng căn đã hoàn công
* giá: từ 2.58 tỷ-3.2 tỷ có sổ hồng riêng đã hoàn công
* tiện ích xung quanh:gần chợ khánh long, chợ vĩnh hiệp, ubnd tân phước khánh, bệnh viện vạn phúc, khu visip i, khu visip ii, gần vincom, dễ dàng kết nối với biên hòa đồng nai, tây ninh, thủ đức, tp mới bình dương.
– khu vực an toàn có cctv, bảo vệ trực 24/7
- tiềm năng: tân uyên lên thành phố, các dự án lớn đổ dồn vào tân uyên, cơ sở hạ tầng đc nâng cấp rất thích hợp làm nhà ở, khu nghỉ dưỡng, kinh doanh đầu tư hoặc cho thuê dài hạn
khu vực này đang cho thuê với giá 8-13tr/căn"	False	True	True	False	15	1.6	đường Tân Phước Khánh, Phường Tân Phước Khánh, Thành phố Tân Uyên, Bình Dương	tân phước khánh 32	đường Tân Phước Khánh, Phường Tân Phước Khánh, Thành phố Tân Uyên, Bình Dương
mặt tiền cmt8 q3 3 tầng không lỗi chỉ 14 tỷ	14.0	https://batdongsan.vn/mat-tien-cmt8-q3-3-tang-khong-loi-chi-14-ty-r260212	43.0				"????????mặt tiền cách mạng tháng 8, con đường kinh doanh đỉnh nhất nhì
quận 3, 42m2, 3 tầng, ngang đẹp 4.3m, vuông như a4, nhà ở đoạn đường không nằm trong giải tỏa cho tuyến metro...????chỉ 14 tỷ thương lượng tốt.

mô tả:
+ mặt tiền kinh doanh đỉnh cmt8 quận 3 chỉ khoản 300tr/m2 tương đương giá đền bù giải tỏa dự án metro.
+ nhà chủ ở đoạn đường không nằm trong giải tỏa cho tuyến metro.
+ ngang siêu đẹp 4.3m.
+ kết cấu 3 tầng btct gồm trệt, 2 lầu có sân thượng trước, tầng trệt cho thuê kinh doanh 18tr/tháng, tầng 2 và 3 chủ ở .
+ sổ vuông đét như tờ a4 và công nhận đủ 42m2.

liên hệ 0906 932696 gặp mr kiều"	False	False	False	True	16	3.0	Mặt tiền Cách Mạng Tháng 8, Quận 3	Mặt tiền Cách Mạng Tháng 8, Quận 3	Mặt tiền Cách Mạng Tháng 8, Quận 3
mặt tiền cmt8 q3 3 tầng không lỗi chỉ 14 tỷ	14.0	https://batdongsan.vn/mat-tien-cmt8-q3-3-tang-khong-loi-chi-14-ty-r260211	43.0				"????????mặt tiền cách mạng tháng 8, con đường kinh doanh đỉnh nhất nhì
quận 3, 42m2, 3 tầng, ngang đẹp 4.3m, vuông như a4, nhà ở đoạn đường không nằm trong giải tỏa cho tuyến metro...????chỉ 14 tỷ thương lượng tốt.

mô tả:
+ mặt tiền kinh doanh đỉnh cmt8 quận 3 chỉ khoản 300tr/m2 tương đương giá đền bù giải tỏa dự án metro.
+ nhà chủ ở đoạn đường không nằm trong giải tỏa cho tuyến metro.
+ ngang siêu đẹp 4.3m.
+ kết cấu 3 tầng btct gồm trệt, 2 lầu có sân thượng trước, tầng trệt cho thuê kinh doanh 18tr/tháng, tầng 2 và 3 chủ ở .
+ sổ vuông đét như tờ a4 và công nhận đủ 42m2.

liên hệ 0906 932696 gặp mr kiều"	False	False	False	True	17	3.0	đường Cách Mạng Tháng 8, Quận 3	đường Cách Mạng Tháng 8, Quận 3	đường Cách Mạng Tháng 8, Quận 3
nhà mới ô tô đỗ cửa phan huy ích cạnh trường chinh, 4.3 tỷ	4.3	https://batdongsan.vn/nha-moi-o-to-do-cua-phan-huy-ich-canh-truong-chinh-43-ty-r260210	39.0	2.0	2.0	Phan Huy Ích, P.15, Tân Bình	"nhà ở vị trí đep, đối diện cổng kcn tân bình, ngay góc trường chinh - phan huy ích, gần chợ tân trụ, aeon citi, viettinbank,.. tiện ích xung quanh đầy đủ. cách sân bay 10 phút, đi vào các quận trung tâm rất thuận tiện.
nhà 1 trệt 1 lầu kiên cố chắc chắn, gồm phòng khách, bếp rộng, 2 phòng ngủ 2wc. nhà mới nên vào ở ngay. hẻm gần 4m ô tô đỗ cửa. khu dân trí. sổ hồng chính chủ, pháp lý chuẩn. liên hệ anh võ: 0909 100 817. không tiếp trung gian."	True	False	True	False	18	2.0	Phan Huy Ích, cạnh Trường Chinh	Phan Huy Ích, P.15, Tân Bình	Phan Huy Ích, cạnh Trường Chinh
hxh lê lợi 4,7x22 8.6 tỷ 2 tầng phường 4 gò vấp	8.6	https://batdongsan.vn/hxh-le-loi-47x22-86-ty-2-tang-phuong-4-go-vap-r260209	103.0	4.0	2.0		"2 mặt hxh - 7c vào nhà được - btct
4,7x22 hxh lê lợi 8.6 tỷ 2 tầng phường 4 gò vấp

- hẻm xe hơi 7c vào nhà, trước nhà có sân rộng 40m2 thoáng mát.
- nhà trệt lầu 4 pn,2wc nhà cũ tiện xd mới.
- ngay đại học công nghiệp, sân bay, phạm văn đồng"	True	False	True	False	19	2.0	đường Lê Lợi, Phường 4, Quận Gò Vấp	đường Lê Lợi, Phường 4, Quận Gò Vấp	đường Lê Lợi, Phường 4, Quận Gò Vấp
bán nhà phân lô bùi xương trạch,40m2x6t,ô tô,kd,2 thoáng,giá 4.38 tỷ 0969945393	4.38	https://batdongsan.vn/ban-nha-phan-lo-bui-xuong-trach40m2x6to-tokd2-thoanggia-438-ty-0969945393-r260208	40.0	6.0	4.0		"thiết kế:
- tầng 1: kinh doanh, bếp, vs và tiểu cảnh
- tầng lửng : phòng khách rộng
- tầng 3.4 : mỗi tầng 2 phòng ngủ,vs cày thang giữa.
- tầng 5: phòng thờ và sân phơi .
- tầng 6: hệ thống tum chống nóng.
+ nhà 2 mặt thoáng trước sau, phòng nào cũng có cửa sổ, ban công phía trước.
-sổ đỏ chính chủ vuông vắn,pháp lí rõ ràng,sẵn sàng giao dịch.
liên hệ trực tiếp a tuyên 0969945393 (mtg)"	False	False	False	False	20	6.0	phân lô Bùi Xương Trạch	phân lô Bùi Xương Trạch	phân lô Bùi Xương Trạch
nguyễn kiệm 2 lầu 4pn 2,8 tỷ 3,5x10 phường 10 gò vấp	2.8	https://batdongsan.vn/nguyen-kiem-2-lau-4pn-28-ty-35x10-phuong-10-go-vap-r260207	35.0	4.0	2.0		"2,8 tỷ 3,5x10 nguyễn kiệm 2 lầu 4pn phường 10 gò vấp

+ 1 trệt 2 lầu btct 4pn 2wc cho thuê 8,5tr
+ ngay ngã 5 gò vấp, tiện ích tràn trề
+ ngay sân bay, phạm văn đồng 500m"	False	False	True	False	21	2.0	đường Nguyễn Kiệm, Phường 10, Quận Gò Vấp	đường Nguyễn Kiệm, Phường 10, Quận Gò Vấp	đường Nguyễn Kiệm, Phường 10, Quận Gò Vấp
nhà tân bình - cmt8 – hẻm ô tô ngay nhà - 3 tầng - ngang 6m - ko quy hoạch lộ giới - giá 4 tỷ thương lượng.	4.0	https://batdongsan.vn/nha-tan-binh-cmt8-hem-o-to-ngay-nha-3-tang-ngang-6m-ko-quy-hoach-lo-gioi-gia-4-ty-thuong-luong-r260206	24.0	2.0	3.0	Đường cách mạng tháng tám, Phường 5, Quận Tân Bình, TP. HCM	"nhà tân bình - cmt8 – hẻm ô tô ngay nhà - 3 tầng - ngang 6m - ko quy hoạch lộ giới - giá 4 tỷ thương lượng.
*diện tích 24m2, hẻm xe hơi đậu ngay nhà.
*nhà 1 trệt 2 lầu đúc 2 phòng ngủ, 3 wc.
*tiện ích xung quanh bao la: gần trường học các cấp, bv thống nhất, siêu thị, chợ, đi các quận trung tâm đều tiện.
* sổ hồng chính chủ, hoàn công đủ, khu hiện hữu không còn quy hoạch lộ giới.
liên hệ oanh: 0931296366 (zalo) để được tư vấn và xem nhà miễn phí."	True	False	True	False	22	3.0	CMT8, Quận Tân Bình	Đường cách mạng tháng tám, Phường 5, Quận Tân Bình, TP. HCM	CMT8, Quận Tân Bình
cmt8 - 4 lầu - 3 phòng ngủ, 4wc - giá chỉ 2.8 tỷ - hẻm 3m.	2.8	https://batdongsan.vn/cmt8-4-lau-3-phong-ngu-4wc-gia-chi-28-ty-hem-3m-r260205	20.0	3.0	4.0	cách mạng tháng tám, P5, Q. Tân Bình, HCM.	"có gì mà hót quá nè! người người đến xem tấp nập.
cmt8 - 4 lầu - 3 phòng ngủ, 4wc - giá chỉ 2.8 tỷ - hẻm 3m.
+ dt: 20 m2, ngang 4m.
+1 trệt 3 lầu, 3 phòng ngủ, 4 vệ sinh, ban công.
+ nhà mới đẹp mua dọn vào ở ngay.
+ sổ đẹp hoàn công, nở hậu.
+ hẻm 3 gác thông.
+ pháp lý chuẩn mua bán trong ngày.
liên hệ oanh nhà phố: 0931296366 để được tư vấn và xem nhà miễn phí."	False	False	False	False	23	4.0	CMT8	cách mạng tháng tám, P5, Q. Tân Bình, HCM.	CMT8
