Title	Price	Links	Diện tích (m2)	Số phòng ngủ	Số phòng WC	Địa chỉ	Description	Chỗ để xe hơi	Đang cho thuê	CSVC xung quanh	Mặt tiền	index	Số tầng	ExtractedTitle	Address1	Address2
phước tài	78.0	https://batdongsan.vn/phuoc-tai-r263626	58.0	4.0	3.0	Đường Lũy Bán Bích, Phường Hiệp Tân, Quận Tân Phú, TP. HCM	"-mặt tiền kinh doanh, gần lũy bán bích, tân phú, 4x15m, đường 10m, 3 tầng, 7.x tỷ.

-gần đường hòa bình, cách đầm sen 5 phút.
-cách trường cấp 3, đại học văn lang 5 phút.
-cách chợ , siêu thị corpmart 3 phút.

liên hệ : 0933 436 564 (tài nhà phố)."	False	False	True	True	0	3.0	đường Phước Tài, gần Lũy Bán Bích, Quận Tân Phú	Đường Lũy Bán Bích, Phường Hiệp Tân, Quận Tân Phú, TP. HCM	đường Phước Tài, gần Lũy Bán Bích, Quận Tân Phú
bán nhà 1t2l thổ cư 61m2 đường ô tô (p. hố nai) chỉ 3 tỉ	3.0	https://batdongsan.vn/ban-nha-1t2l-tho-cu-61m2-duong-o-to-p-ho-nai-chi-3-ti-r263625	61.0	4.0	3.0		"???????? bán nhà 1 trệt 2 lầu shr thổ cư 61m2 đường ô tô (p. hố nai)
+ vị trí: gần giáo xứ xuân trà,cách đường nguyễn ái quốc khoảng 300m
+ sổ hồng riêng thổ cư sang tên công chứng trong một nốt nhạc
+ diện tích: 5x12,2m (61m2)
+ nhà 1 trệt 2 lầu xây dựng theo kiến trúc tân cổ điển,trang trí nội thất cao cấp gồm: 1 phòng khách,4 phòng ngủ,3 tolet,sân đậu ô tô rộng rãi thông thoáng"	True	False	False	False	1	3.0	đường ô tô, Phường Hố Nai	đường ô tô, Phường Hố Nai	đường ô tô, Phường Hố Nai
0329138811	6.5	https://batdongsan.vn/0329138811-r263622	42.0	4.0	2.0	Đường Nguyễn Văn Luông, Phường 12, Quận 6, Hồ Chí Minh	"nhà 3 lầu sân thượng-hxh đường nguyễn văn luông p12 quận 6

+hẽm trước nhà 6m ; xe hơi vào tới cửa.
+dt 4,2x 10m (khuông đất nở hậu= phong thủy rất tốt) ;nhà ko vướng cống , cột điện .
+nhà mới xây còn rất mới ;kết cấu btct kiên cố gồm 1 trệt +lửng +2 lầu + sân thượng ; có thể xách vali vào ở ngay.
+ giá bán 6,5 tỷ thương lượng.
+ pháp lí sổ hồng."	True	False	False	False	2	3.0	đường Nguyễn Văn Luông, Phường 12, Quận 6	Đường Nguyễn Văn Luông, Phường 12, Quận 6, Hồ Chí Minh	đường Nguyễn Văn Luông, Phường 12, Quận 6
gốc chuyển nhượng nhà ở chính chủ quận tân bình	14.69	https://batdongsan.vn/goc-chuyen-nhuong-nha-o-chinh-chu-quan-tan-binh-r263621	92.0	6.0	5.0		"gốc chuyển nhượng nhà ở chính chủ quận tân bình

- diện tích : 92,8m ( thời gian sử dụng lâu dài ),diện tích xây dựng 79m,diện tích sàn 282,8m,giấy tờ pháp lý rõ ràng,minh bạch.

- vị trí nhà đẹp,nhà mới xây,hẻm cụt (duy nhất trong hẻm có 05 căn nhà),đi sân bay 7p,gần các quận 10,3,5,bình thạnh,phú nhuận,gò vấp,tân phú…

- tiện ích:cách mặt đường lý thường kiệt 50m,xe ô tô ra vào thuận lợi,gần trường học cấp 2 cấp 3 ( nguyễn gia thiều,đống đa,nguyễn thái bình ) cách 20m,cách chợ hoa thành thái 200m.

- khu dân cư hiện hữu dân trí cao,không ngập nước,không ô nhiểm,không khí thoáng mát trong lành,nhà có sân trước trồng nhiều hoa lan,sân sau trồng rất nhiều hoa đẹp,đủ không gian cho gia đình thư giãn những ngày cuối tuần,thiết kế nhà đẹp,sang trọng.

- diện tích nhà : 5,2m*5,75m( nỡ hậu ),chiều dài nhà gần 22m,1 trệt 03 lầu,06 phòng ngủ,05 tolet,bếp rộng rãi thoáng mát,có giếng trời,có sân đậu xe trong nhà 6-7 chiếc,có internet,truyền hình cáp....

- khuyến mãi : tặng lại toàn bộ nội thất 90% hàng đẹp nhập từ các nước châu âu,tivi,máy lạnh,tủ lạnh,giường tủ,bàn ăn,sofe,kệ tizi...v...v...

- giá bán : 14 tỷ 690 triệu ( có thương lượng )"	True	False	True	True	3	4.2	quận Tân Bình	quận Tân Bình	quận Tân Bình
chủ kẹt vốn sang lại căn hxh 8m, đường nguyễn cửu vân, p17 bình thạnh, 4x18m giá 7,5 tỷ	75.0	https://batdongsan.vn/chu-ket-von-sang-lai-can-hxh-8m-duong-nguyen-cuu-van-p17-binh-thanh-4x18m-gia-75-ty-r263620	72.0		3.0	Thành phố Hồ Chí Minh	"chủ kẹt vốn sang lại căn hẻm xe hơi 8m, đường nguyễn cửu vân p17 bình thạnh, 4x18m vuông vức.
- vị trí: hẻm xe hơi 8m đường nguyễn cửu vân p17 quận bình thạnh.
- kết cấu: 1 trệt 3 lầu 1 hầm, tặng toàn bộ nội thất cũ.
- pháp lý: có sổ hoàn công.
- diện tích: 4x18m (72m² vuông vức).
- giá gốc 8,8 tỷ, giảm còn 7,5 tỷ ( thương lượng kh thiện chí )
liên hệ nhanh để đi xem nhà.
quan trọng là khuôn mt ngang lớn hơn 6.6m và quỹ đất trên 150m2 đủ để xin trên sở thêm được 2 tầng so với ở quận cấp."	True	False	False	False	4	4.0	đường Nguyễn Cửu Vân, Phường 17, Quận Bình Thạnh	Thành phố Hồ Chí Minh	đường Nguyễn Cửu Vân, Phường 17, Quận Bình Thạnh
bán nhà 9/20 ngõ 47 khúc thừa dụ 1, vĩnh niệm 62m * 3t, giá 3ty450	3.5	https://batdongsan.vn/ban-nha-920-ngo-47-khuc-thua-du-1-vinh-niem-62m-3t-gia-3ty450-r263618	62.0	3.0	3.0		"msp 263
bán nhà đẹp giá rẻ lê chân - hải phòng
căn nhà đẹp tại với giá cực kỳ hấp dẫn. nằm tại địa chỉ 9/20 ngõ 47 khúc thừa dụ 1, vĩnh niệm, lê chân, hải phòng.
- với diện tích 62m2 và cấu trúc mới 3 tầng độc lập, nhà sở hữu không gian thoáng mát và hiện đại với sân sau rộng rãi.
- ô tô để trong nhà với đường nội bộ rộng 4m. vị trí thuận tiện cho cuộc sống khi gần trường cấp 1, cấp 2 vĩnh niệm, chợ, trung tâm thương mại aeomall, vinhome marina, bến xe vĩnh niệm và nhiều khu đô thị, chung cư cao cấp. không chỉ thế, căn nhà còn nằm gần đường thiên lôi, bùi viện, nguyễn văn linh, hồ sen - cầu rào 2 giao thông cực kỳ thuận tiện.
- căn nhà gồm 3 phòng ngủ, 1 phòng khách, phòng thờ, sân phơi và 3 phòng vệ sinh.
- hướng tây bắc, sổ đỏ chính chủ và giá bán hấp dẫn chỉ 3 tỷ 450 triệu có thỏa thuận.
hãy nhanh chân liên hệ ngay với chúng tôi để được tư vấn và xem nhà trực tiếp nhé!"	True	False	True	False	5	3.0	ngõ 47 khúc thừa dụ 1, Vĩnh Niệm, Lê Chân, Hải Phòng	ngõ 47 khúc thừa dụ 1, Vĩnh Niệm, Lê Chân, Hải Phòng	ngõ 47 khúc thừa dụ 1, Vĩnh Niệm, Lê Chân, Hải Phòng
bán nhà góc 2mt hxh thông đường lô tư, dt: 5x13m (nở hậu 5.5m), 1 lầu, giá: 4.8 tỷ tl liên hệ ngay	4.8	https://batdongsan.vn/ban-nha-goc-2mt-hxh-thong-duong-lo-tu-dt-5x13m-no-hau-55m-1-lau-gia-48-ty-tl-lien-he-ngay-r263617	65.0				"- bán nhà: hẻm xe hơi thông đường lô tư, dt: 5x13m.
- tiện ích: hẻm 6m thông ra đường gò xoài, cách mặt tiền đường chỉ vài chục m, cách ngã 3 lô tư - gò xoài chưa đến 200. bán kính tiện ích nằm trong 1km như chợ, siêu thị, trường học, cửa hàng công nghệ, dịch vụ ăn uống,v.v...
- kết cấu: 1 trệt, 1 lầu.
- vị trí: khu dân cư an ninh, dân trí cao, văn minh, sạch sẽ.
- giá: 4.8 tỷ tl.

liên hệ: 0707725457 phú cường.
hỗ trợ khách hàng đăng bộ sang tên hoàn toàn miễn phí.
cam kết những thông tin trên đúng 100% sự thật.
uy tín - chuyên nghiệp - tốc độ - hiệu quả.
sàn giao dịch bđs tanphuland.
đc: 229 lê văn quới, p. bình trị đông, q. bình tân, tp. hcm."	True	False	True	False	6	2.0	đường Lô Tư, Phường Bình Trị Đông, Quận Bình Tân, TP. HCM	đường Lô Tư, Phường Bình Trị Đông, Quận Bình Tân, TP. HCM	đường Lô Tư, Phường Bình Trị Đông, Quận Bình Tân, TP. HCM
bán nhà hxh 8m thông đường hương lộ 2, dt: 4x16m, 3 lầu, giá: 5.7 tỷ tl liên hệ ngay	5.7	https://batdongsan.vn/ban-nha-hxh-8m-thong-duong-huong-lo-2-dt-4x16m-3-lau-gia-57-ty-tl-lien-he-ngay-r263615	64.0				"- bán nhà: hẻm xe hơi thông đường hương lộ 2, dt: 4x16m.
- tiện ích: hẻm 8m thông ra đường ao đôi và mã lò, cách mặt tiền đường ao đôi chỉ vài chục m, cách ngã 3 ao đôi - mã lò chưa đến 200m. bán kính tiện ích nằm trong 1km như chợ, siêu thị, trường học các cấp, bệnh viện, cửa hàng công nghệ, dịch vụ ăn uống,v.v...
- kết cấu: 1 trệt, 2 lầu, sân thượng, 4 phòng ngủ, 4 toilet.
- vị trí: khu dân cư an ninh, dân trí cao, văn minh, sạch sẽ.
- giá: 5.7 tỷ tl.

liên hệ: 0707725457 phú cường.
hỗ trợ khách hàng đăng bộ sang tên hoàn toàn miễn phí.
cam kết những thông tin trên đúng 100% sự thật.
uy tín - chuyên nghiệp - tốc độ - hiệu quả.
sàn giao dịch bđs tanphuland.
đc: 229 lê văn quới, p. bình trị đông, q. bình tân, tp. hcm."	True	False	True	False	7	3.0	hẻm xe hơi thông đường hương lộ 2, Phường Bình Trị Đông, Quận Bình Tân, TP. HCM	hẻm xe hơi thông đường hương lộ 2, Phường Bình Trị Đông, Quận Bình Tân, TP. HCM	hẻm xe hơi thông đường hương lộ 2, Phường Bình Trị Đông, Quận Bình Tân, TP. HCM
bán nhà hxh thông đường số 8 lê văn quới, dt: 4x17m, 1 lửng, giá: 5.55 tỷ tl liên hệ ngay	5.55	https://batdongsan.vn/ban-nha-hxh-thong-duong-so-8-le-van-quoi-dt-4x17m-1-lung-gia-555-ty-tl-lien-he-ngay-r263614	68.0				"- bán nhà: hẻm xe hơi thông đường số 8 lê văn quới, dt: 4x17m.
- tiện ích: hẻm 6m thông ra đường số 1 bình long, giáp với quận tân phú, cách đường bình long chỉ 500m, thuận tiện cho những người đang công tác và làm việc ở quận tân phú. bán kính tiện ích nằm trong 1km như chợ, siêu thị, trường học, cửa hàng công nghệ, dịch vụ ăn uống,v.v...
- kết cấu: 1 trệt, 1 lửng.
- vị trí: khu dân cư an ninh, dân trí cao, văn minh, sạch sẽ.
- giá: 5.55 tỷ tl.

liên hệ: 0707725457 phú cường.
hỗ trợ khách hàng đăng bộ sang tên hoàn toàn miễn phí.
cam kết những thông tin trên đúng 100% sự thật.
uy tín - chuyên nghiệp - tốc độ - hiệu quả.
sàn giao dịch bđs tanphuland.
đc: 229 lê văn quới, p. bình trị đông, q. bình tân, tp. hcm."	True	False	True	False	8	2.0	hẻm xe hơi thông đường số 8 Lê Văn Quới, Phường Bình Trị Đông, Quận Bình Tân, TP. HCM	hẻm xe hơi thông đường số 8 Lê Văn Quới, Phường Bình Trị Đông, Quận Bình Tân, TP. HCM	hẻm xe hơi thông đường số 8 Lê Văn Quới, Phường Bình Trị Đông, Quận Bình Tân, TP. HCM
bán nhà hxh thông đường số 8 lê văn quới, dt: 4x18m, 1 lầu, giá: 6.2 tỷ tl liên hệ ngay	6.2	https://batdongsan.vn/ban-nha-hxh-thong-duong-so-8-le-van-quoi-dt-4x18m-1-lau-gia-62-ty-tl-lien-he-ngay-r263613	72.0				"- bán nhà: hẻm xe hơi thông đường số 1 lê văn quới, dt: 4x18m.
- tiện ích: hẻm 6m thông ra đường số 1 bình long, giáp với quận tân phú, cách đường bình long chỉ 500m, thuận tiện cho những người đang công tác và làm việc ở quận tân phú. bán kính tiện ích nằm trong 1km như chợ, siêu thị, trường học, cửa hàng công nghệ, dịch vụ ăn uống,v.v...
- kết cấu: 1 trệt, 1 lầu.
- vị trí: khu dân cư an ninh, dân trí cao, văn minh, sạch sẽ.
- giá: 6.2 tỷ tl.

liên hệ: 0707725457 phú cường.
hỗ trợ khách hàng đăng bộ sang tên hoàn toàn miễn phí.
cam kết những thông tin trên đúng 100% sự thật.
uy tín - chuyên nghiệp - tốc độ - hiệu quả.
sàn giao dịch bđs tanphuland.
đc: 229 lê văn quới, p. bình trị đông, q. bình tân, tp. hcm."	True	False	True	False	9	2.0	đường Lê Văn Quới, Phường Bình Trị Đông, Quận Bình Tân, TP. HCM	đường Lê Văn Quới, Phường Bình Trị Đông, Quận Bình Tân, TP. HCM	đường Lê Văn Quới, Phường Bình Trị Đông, Quận Bình Tân, TP. HCM
nhà mặt tiền tương lai-ko lộ giới, ko quy hoạch-gần metro tân thới hiệp-q.12-chỉ 3 tỷ 5.	3.5	https://batdongsan.vn/nha-mat-tien-tuong-lai-ko-lo-gioi-ko-quy-hoach-gan-metro-tan-thoi-hiep-q12-chi-3-ty-5-r263612	52.0	1.0	1.0	Tân Thới Hiệp - Quận 12.	"nhà mặt tiền tương lai - ko lộ giới, ko quy hoạch - gần metro - tán thới hiệp - quận 12.

- nhà hẻm thông thoáng, tương lai mặt tiền đường 25 mét.
- dt 52 m2 , ko lộ giới, ko quy hoạch.
- gần ngã tư trương thị hoa.
- mặt tiền tương lai 25 mét, nhà ko lộ giới, ko quy hoạch giá trị tăng cao hơn cả trúng độc đắc.
- thích hợp gia đình trẻ an cư.
- khu vực toàn nhà cao tầng, dân trí.
- sổ hồng riêng , mua bán công chứng mau lẹ.
☎️ 0974642818 - gặp tươi xem nhà, xem sổ ngay."	False	False	False	True	10	0.0	tương lai, Quận 12, Tân Thới Hiệp	Tân Thới Hiệp - Quận 12.	tương lai, Quận 12, Tân Thới Hiệp
nhà hẻm xe hơi 7m phan anh, bình trị đông, bình tân. dt 56m2 gồm 1 trệt 2 lầu đúc btct mới đẹp giá tốt chỉ 5,5 tỷ.	5.5	https://batdongsan.vn/nha-hem-xe-hoi-7m-phan-anh-binh-tri-dong-binh-tan-dt-56m2-gom-1-tret-2-lau-duc-btct-moi-dep-gia-tot-chi-55-ty-r263610	56.0	3.0	3.0	Thành phố Hồ Chí Minh	"nhà hẻm xe hơi 7m phan anh, bình trị đông, bình tân. dt 56m2 gồm 1 trệt 2 lầu đúc btct mới đẹp giá tốt chỉ 5,5 tỷ.
5,5 tỷ - 56 m²
bình tân, hồ chí minh
nhà hẻm xe hơi tránh 7m phan anh, bình trị đông, bình tân. dt 56m2 gồm 1 trệt 2 lầu btct giá chỉ 5,5 ty.
- vị trí đỉnh sát vách tân phú xung quanh nhiều chợ, trường học, tiện ích không thiếu gì.
- ngay trục đường chính giao với ngã tư bốn xã, tân hòa đông, hương lộ 2, 5p đến vòng xoay phú lâm, quận 6....đi đâu cũng tiện.
- hẻm nhựa 7m thẳng 1 trục, xe hơi đổ cửa, khu dân trí an ninh thoáng mát.
- nhà còn mới đẹp dt 56m2 (4×14) gồm 1 trệt 2 lầu 3pn 2wc với đầy đủ công năng.
- sổ vuông đẹp ,chuẩn phong thủy, giá đang rất tốt so với các căn tương tự trong khu vực."	True	False	True	False	11	3.0	hẻm Phan Anh, Phường Bình Trị Đông, Quận Bình Tân, TP. Hồ Chí Minh	Thành phố Hồ Chí Minh	hẻm Phan Anh, Phường Bình Trị Đông, Quận Bình Tân, TP. Hồ Chí Minh
nhà siêu rẻ, hẻm ba gác, đường phạm thế hiển, phường 5, quận 8	3.45	https://batdongsan.vn/nha-sieu-re-hem-ba-gac-duong-pham-the-hien-phuong-5-quan-8-r263609	71.0	2.0	1.0		"nhà siêu rẻ, hẻm ba gác, đường phạm thế hiển, phường 5, quận 8
- nhà 1 xẹt, 1 trệt 1 lầu thông sàn, diện tích 71 m2
- hẻm ba gác thông , cách mặt tiền 50m
- ngay ca quận, ubnd q8, xung quanh là trung tâm văn hóa thể thao , sân vận động, trường tiểu học, chợ nhị thiên đường, chợ phạm thế hiển, bến xe quận 8, bệnh viện phục hồi chức năng q8 ... qua chợ lớn 7 phút, bệnh viện đh y dược 12 phút
- sổ riêng, công chứng nhanh gọn
vui lòng liên thạc sĩ kiệt, chuyên nhà phố, sđt 0907451088"	False	False	True	False	12	2.0	đường Phạm Thế Hiển, Phường 5, Quận 8	đường Phạm Thế Hiển, Phường 5, Quận 8	đường Phạm Thế Hiển, Phường 5, Quận 8
bán nhà 52m,4 tầng tại khúc thừa dụ 2, vĩnh niệm, lê chân giá 3ty690	3.7	https://batdongsan.vn/ban-nha-52m4-tang-tai-khuc-thua-du-2-vinh-niem-le-chan-gia-3ty690-r263608	52.0	4.0	3.0		"msp 272
bán nhà 4 tầng tại khúc thừa dụ 2, vĩnh niệm, lê chân, hải phòng
- diện tích 52m2, mặt tiền rộng 4m nở hậu 4,4m , hướng tây tứ trạch. nội thất bao gồm gara, phòng khách, 3 phòng ngủ và 3 phòng vệ sinh. đặc biệt, xe hơi có thể để trong nhà , đường nội bộ rộng 4m.
- vị trí của căn nhà rất thuận lợi cho cuộc sống hàng ngày khi gần các trường học cấp 1 và cấp 2 vĩnh niệm, chợ đầu mối, trung tâm thương mại aeomall, vinhome marina, bến xe vĩnh niệm và nhiều khu đô thị cao cấp
- ngoài ra, còn gần các tuyến đường thiên lôi, bùi viện, nguyễn văn linh và hồ sen - cầu rào 2, giúp cho việc di chuyển rất thuận tiện.
- giá chỉ 3 tỷ 679 triệu đồng .
- nếu bạn quan tâm đến căn nhà này, hãy liên hệ ngay với chúng tôi để được tư vấn và hỗ trợ mua bán"	True	False	True	True	13	4.0	khúc Thừa Dụ 2, Vĩnh Niệm, Lê Chân, Hải Phòng	khúc Thừa Dụ 2, Vĩnh Niệm, Lê Chân, Hải Phòng	khúc Thừa Dụ 2, Vĩnh Niệm, Lê Chân, Hải Phòng
siêu phẩm cần bán gấp lô góc mặt tiền kinh doanh vô đối, 3p ra biển, phú lộc- liên chiểu	4.15	https://batdongsan.vn/sieu-pham-can-ban-gap-lo-goc-mat-tien-kinh-doanh-vo-doi-3p-ra-bien-phu-loc-lien-chieu-r263606	150.0	3.0			"????hàng hiếm???? giá sập sàn ????
phú lộc- hòa minh - liên chiểu
nhà 1 tầng lô góc cực đẹp
???? dt ; gần 150m² ôtô đổ sân
yên tỉnh, an ninh cực kỳ tốt
100m ra chợ phú lộc
???? giá chỉ 4,x tỷ ????
☎️ ;0981326539 tư vấn chi tiết
làm việc trực tiếp chủ , được giá tốt"	True	False	True	False	14	1.0	phú lộc- hòa minh - liên chiểu	phú lộc- hòa minh - liên chiểu	phú lộc- hòa minh - liên chiểu
siêu phẩm cần bán gấp lô góc mặt tiền kinh doanh vô đối, 3p ra biển, phú lộc- liên chiểu	4.15	https://batdongsan.vn/sieu-pham-can-ban-gap-lo-goc-mat-tien-kinh-doanh-vo-doi-3p-ra-bien-phu-loc-lien-chieu-r263605	150.0	3.0			"????hàng hiếm???? giá sập sàn ????
phú lộc- hòa minh - liên chiểu
nhà 1 tầng lô góc cực đẹp
???? dt ; gần 150m² ôtô đổ sân
yên tỉnh, an ninh cực kỳ tốt
100m ra chợ phú lộc
???? giá chỉ 4,x tỷ ????
☎️ ;0981326539 tư vấn chi tiết
làm việc trực tiếp chủ , được giá tốt"	True	False	True	False	15	1.0	phú lộc- hòa minh - liên chiểu	phú lộc- hòa minh - liên chiểu	phú lộc- hòa minh - liên chiểu
bán nhà 1 trệt 1 lửng 2 lầu đường ô tô (p. tân tiến) chỉ 5 tỉ	5.0	https://batdongsan.vn/ban-nha-1-tret-1-lung-2-lau-duong-o-to-p-tan-tien-chi-5-ti-r263604	65.0	4.0	4.0		"???????? bán nhà 1 trệt 1 lửng 2 lầu 65m2 shr thổ cư đường ô tô (p. tân tiến)
+ vị trí: gần bệnh viện 7b,cách đường nguyễn ái quốc khoảng 80m
+ diện tích: 4,4x15m (65m2)
+ sổ hồng riêng thổ cư có hoàn công nhà trên sổ
+ nhà 1 trệt 1 lửng 2 lầu thiết kế hiện đại,trang trí theo phong cách cổ điển gồm: 1 phòng khách,4 phòng ngủ,4 tolet,nhà bếp,đường thông thoáng ô tô né nhau chạy vi vu"	True	False	True	False	16	3.4	đường ô tô, Phường Tân Tiến	đường ô tô, Phường Tân Tiến	đường ô tô, Phường Tân Tiến
căn nhà đẹp vũ chí thắng, lê chân, hải phòng. 46 * 4 tầng giá 3tỷ500	3.2	https://batdongsan.vn/can-nha-dep-vu-chi-thang-le-chan-hai-phong-46-4-tang-gia-3ty500-r263602	46.0	4.0	3.0		"căn nhà đẹp tọa lạc tại khu vực vũ chí thắng, lê chân, hải phòng.
với sổ đỏ chính chủ, diện tích 46m2 và 4 tầng, hướng đông tứ mệnh và nằm gần đường trần nguyên hãn hoàng minh thảo. khu vực này là nơi sinh hoạt đông đúc với đầy đủ tiện nghi và nhiều sự lựa chọn cho các trường học và chợ.
thiết kế căn nhà bao gồm phòng khách, bếp, 4 phòng ngủ, phòng thờ và sân phơi, được hoàn thiện bởi một kiến trúc sư chuyên nghiệp. nội thất được lắp ráp với chất lượng cao, kết hợp với gam màu trắng tạo nên không gian sang trọng và đẳng cấp.
với giá 3 tỷ 500 triệu đồng, đây là mức giá vô cùng hấp dẫn để sở hữu một căn nhà quá đẹp như thế này. nếu quý khách cần thêm thông tin vui lòng liên hệ với chúng tôi nhé."	False	False	True	False	17	4.0	đường Vũ Chí Thắng, Lê Chân, Hải Phòng	đường Vũ Chí Thắng, Lê Chân, Hải Phòng	đường Vũ Chí Thắng, Lê Chân, Hải Phòng
bán nhà trần thái tông cầu giấy 44m x 4t chỉ 4,9 tỷ	4.9	https://batdongsan.vn/ban-nha-tran-thai-tong-cau-giay-44m-x-4t-chi-49-ty-r263600	44.0	4.0	3.0		"- chủ nhà bán căn nhà 4 tầng đẹp đường trần thái tông diện tích 44m2 mặt tiền 4m.
- gần phố, vị trí đẹp, đầy đủ tiện nghi.
- sổ đỏ chính chủ vuông vắn.
liên hệ- mr mạnh mặt ngõ 0367549898- mua bán ki gửi nhà đất hà nội"	False	False	False	True	18	4.0	đường Trần Thái Tông, Phường Cầu Giấy	đường Trần Thái Tông, Phường Cầu Giấy	đường Trần Thái Tông, Phường Cầu Giấy
bán nhà hxh đường lê văn quới, dt: 4x16.5m, 3 lầu, giá: 7.6 tỷ tl liên hệ ngay	7.6	https://batdongsan.vn/ban-nha-hxh-duong-le-van-quoi-dt-4x165m-3-lau-gia-76-ty-tl-lien-he-ngay-r263592	66.0				"- bán nhà: hẻm xe hơi đường lê văn quới, dt: 4x16.5m.
- tiện ích: hẻm trước nhà 5m, xe hơi vô đến nhà. cách mặt tiền đường chỉ vài chục m, cách ngã 4 bốn xã 500m. bán kính tiện ích nằm trong 1km như chợ, siêu thị, cửa hàng công nghệ, dịch vụ ăn uống,v.v...
- kết cấu: 1 trệt, 2 lầu, sân thượng, 4 phòng ngủ, 4 toilet.
- vị trí: khu dân cư an ninh, dân trí cao, văn minh, sạch sẽ.
- giá: 7.6 tỷ tl.

liên hệ: 0707725457 phú cường.
hỗ trợ khách hàng đăng bộ sang tên hoàn toàn miễn phí.
cam kết những thông tin trên đúng 100% sự thật.
uy tín - chuyên nghiệp - tốc độ - hiệu quả.
sàn giao dịch bđs tanphuland.
đc: 229 lê văn quới, p. bình trị đông, q. bình tân, tp. hcm."	True	False	True	False	19	3.2	Đường Lê Văn Quới, Phường Bình Trị Đông, Quận Bình Tân, TP. HCM	Đường Lê Văn Quới, Phường Bình Trị Đông, Quận Bình Tân, TP. HCM	Đường Lê Văn Quới, Phường Bình Trị Đông, Quận Bình Tân, TP. HCM
bán nhà hxh thông đường lô tư, dt: 4x17m, 3 lầu, giá: 7.7 tỷ tl liên hệ ngay	7.7	https://batdongsan.vn/ban-nha-hxh-thong-duong-lo-tu-dt-4x17m-3-lau-gia-77-ty-tl-lien-he-ngay-r263591	68.0				"- bán nhà: hẻm xe hơi thông đường lô tư, dt: 4x17m.
- tiện ích: hẻm 6m thông ra đường gò xoài, cách mặt tiền đường chỉ vài chục m, cách ngã 3 lô tư - gò xoài chưa đến 300m. bán kính tiện ích nằm trong 1km như chợ, siêu thị, trường học, cửa hàng công nghệ, dịch vụ ăn uống,v.v...
- kết cấu: 1 trêt, 1 lửng, 2 lầu, sân thượng, 4 phòng ngủ, 4 toilet.
- vị trí: khu dân cư an ninh, dân trí cao, văn minh, sạch sẽ.
- giá: 7.7 tỷ tl.

liên hệ: 0707725457 phú cường.
hỗ trợ khách hàng đăng bộ sang tên hoàn toàn miễn phí.
cam kết những thông tin trên đúng 100% sự thật.
uy tín - chuyên nghiệp - tốc độ - hiệu quả.
sàn giao dịch bđs tanphuland.
đc: 229 lê văn quới, p. bình trị đông, q. bình tân, tp. hcm."	True	False	True	False	20	3.6	hxh thông đường lô tư, Phường Bình Trị Đông, Quận Bình Tân, TP. HCM	hxh thông đường lô tư, Phường Bình Trị Đông, Quận Bình Tân, TP. HCM	hxh thông đường lô tư, Phường Bình Trị Đông, Quận Bình Tân, TP. HCM
bán nhà mt đường tân hoà đông, dt: 4.6x19m, 3 lầu, giá: 11 tỷ tl liên hệ ngay	11.0	https://batdongsan.vn/ban-nha-mt-duong-tan-hoa-dong-dt-46x19m-3-lau-gia-11-ty-tl-lien-he-ngay-r263590	88.0				"- bán nhà: mặt tiền đường tân hoà đông, dt: 4.6x19m.
- tiện ích: mặt tiền đường 12m, cách ngã 3 tân hoà đông - hương lộ 2 chỉ 300m, thuận lợi để kinh doanh, buôn bán hoặc cho thuê. bán kính tiện ích nằm trong 1km như chợ, siêu thị, trường học các cấp, cửa hàng công nghệ, dịch vụ ăn uống,v.v...
- kết cấu: 1 trệt, 2 lầu, sân thượng.
- vị trí: khu dân cư an ninh, sầm uất, xe lưu thông thường xuyên.
- giá: 11 tỷ tl.

liên hệ: 0707725457 phú cường.
hỗ trợ khách hàng đăng bộ sang tên hoàn toàn miễn phí.
cam kết những thông tin trên đúng 100% sự thật.
uy tín - chuyên nghiệp - tốc độ - hiệu quả.
sàn giao dịch bđs tanphuland.
đc: 229 lê văn quới, p. bình trị đông, q. bình tân, tp. hcm."	False	False	True	True	21	3.0	đường Tân Hoà Đông	đường Tân Hoà Đông	đường Tân Hoà Đông
