Unnamed: 0	Address2	Latitude	Longitude
1452	đường Hai Bà Trưng, TP Huế	164.607.721	1.075.892.472
1453	Đường Đỗ Văn Thi,Phường Hiệp Hòa	109.378.305	1.068.383.495
1454	Thanh Xuân, Luôn, Lô Góc	108.834.303	1.066.703.963
1455	Lưu Nguyên, Quận Thanh Xuân	209.959.819	1.058.097.244
1456	Khu vực Trung tâm Quận Hoàng Mai, gần Linh Đàm, Khu đô thị Linh Đàm, kđt Định công	209.649.464	1.058.248.383
1457	 KP3, Thị Trấn Trảng Bom, Huyện Trảng Bom, Tỉnh Đồng Nai	10.956.586	1.070.055.424
1458	đường Minh Khai, Phường Hai Bà Trưng	209.943.823	1.058.627.172
1459	đường Nguyễn Xí, Phường 13, Quận Bình Thạnh	108.200.411	1.067.039.308
1460	đường Đồng Khởi, Phường Tân Hiệp, TP Biên Hồ, Tỉnh Đồng Nai	10.956.768	1.068.611.827
1461	đường Cự Lộc, phường Thượng Đình, Quận Thanh Xuân, Hà Nội	210.012.554	1.058.137.407
1462	Cao Đằng Kinh Tế	107.648.701	1.066.733.308
1463	đường 3/2, Quận 10	107.687.587	1.066.689.151
1464	Đặng Thủy Trâm, Phường 13, Quận Bình Thạnh	108.286.444	1.067.029.558
1465	Đặng Thủy Trâm, Phường 13, Quận Bình Thạnh	108.286.444	1.067.029.558
1466	Đại lộ 3, Phước Bình	108.128.241	1.067.721.882
1467	đường Số 7 Cư Xá Đô Thành, Phường 4, Quận 3	107.722.727	1.066.821.955
1468	Nguyễn Quý Yêm	107.299.144	1.066.183.388
1469	Lê Định, Bình Tân	12.208.616	1.091.908.359
1470	không có địa chỉ		
1471	Đại Sứ Quận Hàn Quốc	210.668.748	1.057.967.778
1472	P. Yên Hòa, Cầu Giấy	210.218.044	105.790.872
1473	Mặt phố Trần Đại Nghĩa	209.998.093	105.845.367
1474	Đường Hoàng Quốc Việt, Phường Nghĩa Đô, Quận Cầu Giấy	210.462.978	1.057.994.211
1475	đường Trần Đại Nghĩa	107.399.008	1.065.481.438
1476	Hương Lộ 2, Bình Trị Đông, Quận Bình Tân, Thành phố Hồ Chí Minh	107.695.049	10.661.276
1477	Số 1 Mã Lò, Phường Bình Trị Đông, Quận Bình Tân, Thành phố Hồ Chí Minh	10.758.468	1.066.066.393
1478	đường Lê Văn Quới, Phường Bình Trị Đông, Quận Bình Tân, Thành phố Hồ Chí Minh	107.759.904	1.066.134.613
1479	đường Ngang 8m, gần Ngã tư bốn xã, Bình Tân	107.652.581	1.066.038.535
1480	Kiệt 39 Trần Phú	209.369.877	1.063.298.081
1481	đường số khu Lê Văn Quới, Quận Bình Tân	10.776.189	1.066.113.201
1482	Hoàng Hoa Thám, Phường 6, Quận Bình Thạnh	10.807.912	1.066.888.124
1483	đường Lê Thành, Phường Bình Tân	106.667.874	1.077.799.066
1484	diện AIon Mall, Chợ Sơn Kỳ	108.013.384	1.066.179.585
1485	Định Công Thượng, Quận Hoàng Mai	209.784.143	1.058.282.959
1486	đường Nơ Trang Long, Phan Văn Trị	108.111.789	1.066.954.879
1487	Mặt Tiền Quận 10	107.745.965	1.066.679.542
1488	đường Lê Quang Định, Phường 7, Quận Bình Thạnh	108.095.223	1.066.929.528
1489	đường TCH 26, Quận 12	108.683.572	1.066.201.999
1490	đường lớn, Phường Thạnh Mỹ Lợi	107.583.621	1.067.647.475
1491	Phan Văn Trị, Phường 10, Quận Gò Vấp	108.327.364	1.066.724.769
1492	Hẻm xe hơi 4 chỗ, Quận Thủ Đức	108.494.094	1.067.537.055
1493	Đường Tô Hiến Thành, Quận 10	107.772.543	1.066.646.765
1494	Hương Lộ 2, Quận Bình Tân	107.670.756	1.066.075.906
1495	đường Chu Văn An, Phường 12, Quận Bình Thạnh	108.109.464	1.067.019.597
1496	số 4 Bốn Xã, Phường Bình Tân	106.667.874	1.077.799.066
1497	H.233 Nguyễn Văn Cừ, Phường An Hoà, Quận Ninh Kiều	100.455.043	105.771.494
1498	đường số 10, Linh Trung, Thủ Đức	108.586.724	1.067.722.225
1499	đường số 10 Linh Trung, Thủ Đức	108.586.724	1.067.722.225
1500	Ngã 3 Bình Yên, gần ChangShin		
1501	Khu phân lô HL2, Quận Bình Tân	107.670.756	1.066.075.906
1502	Phan Văn Trị, Quận Bình Thạnh	1.081.931	1.066.945.295
1503	Thạnh Mỹ Lợi, Tp. Thủ Đức	107.583.621	1.067.647.475
1504	Thoại Ngọc Hầu, Luỹ Bán Bích, Nguyễn Sơn, Hiền Vương, Thạch Lam, Quận Tân Phú	107.817.241	1.066.359.669
1505	đường 5,5m, gần Cầu Rồng, Quận Sơn Trà	160.610.998	1.082.275.115
1506	hẻm Lê Văn Quới, Bình Tân	10.776.189	1.066.113.201
1507	Chế Lan Viên, Quận Tân Phú	108.121.189	106.629.257
1508	đường Phùng Văn Cung, Phường 7, Quận Phú Nhuận	108.011.196	1.066.851.508
1509	đường Trần Văn Ơn	109.766.151	1.066.755.364
1510	đường Khương Đình, Quận Thanh Xuân	209.923.852	1.058.136.426
1511	đường Nguyễn Văn Cừ, Phường Gia Thụy, Long Biên	210.495.394	1.058.834.124
1512	HL2, Bình Tân	107.670.756	1.066.075.906
1513	Nguyễn Duy Trinh		
1514	đường Bình Tiên, Quận 6	107.437.112	106.643.168
1515	Phú Lâm, gần khu vực Coopmart, công viên Bình Phú	107.417.608	1.066.327.796
1516	Kinh Dương Vương, Tên Lửa, Bến Xe Miền Tây, Võ Văn Kiệt	107.401.132	1.066.191.384
1517	đường Vạn Kiếp, Phường 3, Quận Bình Thạnh	107.994.304	1.066.935.618
1518	Nguyễn Văn Cừ, Phường Gia Thuỵ	210.495.394	1.058.834.124
1519	đường số 5, Linh Trung, Thủ Đức	108.532.813	106.767.873
1520	Đường 27, Phường Hiệp Bình Chánh	108.332.403	1.067.318.574
1521	Đường 27, Hiệp Bình Chánh	108.332.403	1.067.318.574
1522	Lạc Long Quân, Phường Long Lanh, Quận Tân Bình	108.014.659	1.066.525.974
1523	Phần Lăng, Thanh Khê	203.481.027	1.061.948.542
1524	 Niên Sư Huỳnh, L/phường Tân Bình	115.190.638	1.068.856.933
1525	Gò Dầu, Nguyễn Súy	107.958.831	1.066.226.935
1526	Đặng Văn Bi, Trường Thọ, Quận Thủ Đức	108.439.717	106.762.358
1527	đường Hoàng Văn Thụ, Phường 8, Quận Phú Nhuận	107.996.351	1.066.737.125
1528	hẻm Thoại Ngọc Hầu, Phường Luỹ Bán Bích, Quận Tân Phú	107.781.857	106.630.569
1529	đường Hoàng Cầu	210.164.782	1.058.227.056
1530	Đường lớn, Quận 2		
1531	Nguyễn Thị Định		
1532	đường D5, Phường 25, Quận Bình Thạnh	108.060.852	1.067.149.816
1533	đường D5, Phường 25, Quận Bình Thạnh	108.060.852	1.067.149.816
1534	Phan Văn Trị, Nguyễn Oanh, Nguyễn Văn Lượng	108.384.998	1.066.755.728
1535	Điện Biên Phủ, Phường 17, Quận Bình Thạnh	107.978.161	1.067.049.832
1536	Nơ Trang Long	108.146.132	1.066.978.649
1537	đường 12M, Quận oluştur lên, cạnh trường, giáp Q6	107.480.929	1.066.352.362
1538	Khuông Việt, Lạc Long Quân, Hòa Bình	208.330.182	1.053.403.393
1539	Ngã 6 Quán Trữ, Kiến An, Hải Phòng	208.214.343	1.066.482.886
1540	đường Chiến Lược, Phường Lê Định, Quận Bình Tân	107.628.484	1.066.178.313
1541	Nguyễn Văn Lạc, Phan Văn Hân, Huỳnh Tịnh Của, Phường 19, Quận Bình Thạnh	107.919.823	1.067.088.786
1542	đường số 20, Phường 5, Quận Gò Vấp	108.348.727	1.066.873.658
1543	đường 7,5 m, phía sau lưng Võ Nguyên Giáp, Sơn Trà	160.691.374	1.082.453.792
1544	phố Lương Ngọc Quyến, ngõ thông sang Triều Khúc, ĐH Sư Phạm Trung Ương, ĐH Công Nghệ Giao Thông Vận Tải, HV Kỹ Thuật Mật Mã	209.801.219	105.802.612
1545	gần trường học		
1546	ngõ lớn trên đường Nguyễn Văn Cừ, Phường Gia Thụy	210.495.394	1.058.834.124
1547	Hồ Tam Bạc, Hồng Bàng, Hải Phòng	20.855.311	1.066.761.078
1548	Phạm Văn Chiêu, Phường 14, Quận Gò Vấp, Thành phố Hồ Chí Minh	108.484.293	106.648.556
1549	Xuân Thủy, Cầu Giấy, Hà Nội	21.036.503	1.057.854.012
1550	Phan Xích Long, Phường 7, Quận Phú Nhuận	107.983.097	1.066.884.708
1551	đường Hai Bà Trưng, phường Lê Chân, Hải Phòng	208.526.987	1.066.779.598
1552	đường 48 nhánh 3, Hiệp Bình Chánh	108.349.815	1.067.257.698
1553	Điện Biên Phủ, Sapa	223.407.143	1.038.407.273
1554	đường Hai Bà Trưng, Phường 6, Quận 3	107.855.577	1.066.948.593
1555	đường Nguyễn Thành Phương, phường Thống Nhất, quận Biên Hòa	109.375.355	1.068.287.555
1556	đường Tôn Thất Thuyết, Quận 4	1.075.325	1.067.052.862
1557	Lạc Long Quân, Phường 3, Quận 11	107.660.492	106.642.303
1558	đường Thị Cấu, Phường Thị Cấu, TP. Bắc Ninh	211.931.547	1.060.882.146
1559	đường Đặng Văn Bi, Phường Trường Thọ	108.439.717	106.762.358
1560	Đặng Văn Bi, Phường Trường Thọ	108.439.717	106.762.358
1561	đường Nguyên Hồng	210.203.433	1.058.122.241
1562	Ngõ thông cả ngả Nhân Chính, Nguỵ Như Komtum, Nguyễn Trãi, Đường Láng, Phường Quan Nhân, Quận Thanh Xuân	210.005.603	1.058.029.176
1563	đường Hoàng Văn Thụ, phường Hồng Bàng, Hải Phòng	208.610.801	1.066.813.713
1564	đường rộng 19.5m, Gần Chợ, Phường Bùi Thị Xuân, Quận...	137.447.566	1.091.519.305
1565	phố Phạm Văn Hai, Tân Bình	107.945.549	1.066.632.715
1566	đường Thuận Giao 08, Phường Thuận Giao, Thành phố Thuận An	109.621.318	1.066.992.715
1567	ngõ 66 Tân Mai, ngõ 94 Tân Mai, ngõ 120 Tân Mai, ngõ 149 Tân Mai, ngõ 163 Tân Mai, ngõ 182 Tân Mai, Đền lừ, Tam Trinh	209.833.992	1.058.501.801
1568	Phố Vạn Phúc	210.331.834	1.058.169.705
1569	Phổ Quang, Phường 2, Quận Tân Bình	108.059.195	1.066.682.118
1570	Ngô Quyền, Khu đô thị Văn Khê	209.708.916	1.057.643.286
1571	Ngô Quyền, Quận ...	208.566.653	1.066.994.903
1572	Nguyễn Văn Đậu, Phường 11, Quận Bình Thạnh	108.118.426	1.066.922.921
1573	Cách MT Đất Mơi, Phường Bình Tân, Quận Bình Tân	107.668.701	1.066.096.908
1574	đường Hưng Phú, Quận 8	10.747.128	1.066.733.135
1575	đường Kiến Hưng	209.502.034	1.057.910.665
1576	Bùi Thanh Khiết, ngay cầu vượt Nguyễn Văn Linh	106.878.301	1.066.827.456
1577	Xuân La, Quận Tây Hồ	210.596.756	1.058.040.796
1578	Hòa Hảo, Nguyễn Tiểu La, Nguyễn Tri Phương, Quận 10	107.614.914	1.066.668.271
1579	Khương Hạ, Quận Thanh Xuân	209.922.632	1.058.157.908
1580	Đường số 23, phường Hiệp Bình Chánh, TP. Thủ Đức, TP.HCM.	108.282.919	106.726.749
1581	phố Ngô Quyền, phường Vạn Phúc, quận Hà Đông	210.243.907	105.854.995
1582	đường ô tô, Phường Tam Hiệp, Quận Biên Hòa, Đồng Nai	109.477.668	106.855.756
1583	hẻm đường nhựa 10m, khu Tân Sơn Nhì, Quận Tân Phú	108.319.383	1.066.435.268
1584	Hẻm đường nhựa 10m, khu đông dân cư, Quận Tân Sơn Nhì, Quận Tân Phú	108.319.383	1.066.435.268
1585	Wę Ninh		
1586	đường Hoàng Hoa Thám, Phường Bình Thạnh	10.807.912	1.066.888.124
1587	Tân Trang, gần Lý Thường Kiệt	107.739.582	1.066.570.975
1588	Đa Sỹ	209.592.584	1.057.857.359
1589	KĐT Đền Lừ	209.816.101	1.058.573.644
1590	Khu dân cư Sông Giồng, An Phú, Quận 2	107.868.252	1.067.522.744
1591	Ngõ ô tô tránh nhau, đường Cầu Giấy	210.329.533	1.057.982.426
1592	phố Hào Nam, quận Đống Đa	210.252.222	1.058.272.153
1593	Hồng Bảng, Phường 1, Quận 11	107.545.885	1.066.388.727
1594	Hòa Hảo, Phường 5, Quận 10	10.761.538	1.066.670.398
1595	Đinh Tiên Hoàng, Phường ..., Quận ...	109.480.196	1.082.976.447
1596	Chợ Thạnh Phú, TP. Biên Hòa	110.106.492	1.068.293.391
1597	Đương Nội, Quận ....	20.979.868	1.057.439.194
1598	đường Đồng Đen, ngay ngõ Nguyễn Hồng Đào, đường Bàu Cát	10.794.153	106.644.974
1599	Lê Văn Quới, Hương Lộ 2, Bình Tân	107.737.112	1.066.213.049
1600	đường cặp sông Cái Răng Bé, phường Thường Thạnh, quận Cái Răng, TP. Cần Thơ	99.920.047	1.057.611.226
1601	Hòa Hưng, Quận 10	107.789.834	1.066.738.954
1602	Hẻm ô tô, Quận 1	107.756.587	1.067.004.238
1603	đường Lê Trọng Tấn	209.818.482	105.742.568
1604	đường Tam Châu, Thủ Đức, TP.HCM	108.678.038	1.067.445.156
1605	Đường số 51, Phường 14, Gò Vấp	10.845.846	106.643.129
1606	Vườn Lài, Lê Văn Phan, Phú Thọ Hòa, Quận Tân Phú	107.871.353	1.066.349.209
1607	Khương Trung, Quận Thanh Xuân	209.971.504	1.058.216.911
1608	Khu phân lô cán bộ, Quận Hà Đông	20.955.835	1.057.563.658
1609	đường Văn Quán, khu phân lô	209.796.446	1.057.923.394
1610	Phạm Ngọc Thạch, Quận Đống Đa	210.085.871	1.058.341.166
1611	Đường Láng, Quận Đống Đa	21.014.156	1.058.065.054
1612	Văn Phú, Hà Đông	209.619.409	1.057.685.991
1613	đường Văn Quán, Phường/C Beverrage, Quận Hà Đông	209.786.778	1.057.960.298
1614	đường Mễ Trì, Phường Mễ Trì, Quận Nam Từ Liêm	210.144.475	1.057.778.288
1615	đường Trần Văn Quang, Phường 10, Quận Tân Bình	10.779.581	1.066.471.074
1616	đường Bùi Thế Mỹ, Quận Tân Bình	107.850.864	1.066.483.414
1617	Vạn Phúc, Hà Đông	209.786.876	105.771.796
1618	Ngay các trường ĐH, Phường Tăng Nhơn Phú A	108.409.534	10.679.719
1619	đường An Phú, Quận 2	107.935.216	1.067.308.195
1620	đường ô tô, Phường Tân Hiệp	109.656.045	106.866.728
1621	Phố Quang Trung, Hà Đông	209.703.917	1.057.697.163
1622	Tôn Đức Thắng, Đống Đa	210.248.712	1.058.328.825
1623	Phường 12, Gò Vấp	108.347.203	1.066.394.461
1624	Phú Quốc	10.289.879	10.398.402
1625	đường An Thượng		
1626	Ngõ Văn Hương, Tôn Đức Thắng, Đống Đa	210.248.712	1.058.328.825
1627	Xuân La, Tây Hồ	210.596.756	1.058.040.796
1628	Phố Đại La, Quận Hai Bà Trưng	209.967.983	1.058.459.272
1629	đối Cấn, Ba Đình	210.353.698	1.058.192.143
1630	CMT8		
1631	Ðường 3-2, Quận 11, Thành phố Hồ Chí Minh	107.598.558	1.066.525.809
1632	Phan Chu Trinh, TTTP, Huế	164.559.634	1.075.895.414
1633	Phan Chu Trinh, TTTP, Huế	164.559.634	1.075.895.414
1634	KDC Phú Gia 2, Phường Trảng Dài, Biên Hòa, Đồng Nai	109.859.925	1.068.691.758
1635	đường Thái Hà, Quận Đống Đa, Hà Nội	210.129.882	105.820.014
1636	 ĐỊNH CÔNG, QUẬN HOÀNG MAI	209.831.371	1.058.319.653
1637	Kênh Tân Hóa, giáp Quận 6, Quận 11	10.766.481	1.066.359.011
1638	Kênh Tân Hóa, cạnh cv xanh	107.697.214	1.066.356.313
1639	Thuỵ Khuê	21.046.133	1.058.246.266
1640	Lê Trọng Tấn, hàng xóm Park Cty	209.818.482	105.742.568
1641	Ngô Thì Nhậm		
1642	Ngô Thì Nhậm		
1643	Dương Nội, Hà Đông	20.979.868	1.057.439.194
1644	Phú Thượng, Quận Tây Hồ	210.838.905	1.058.084.823
1645	ngõ 71 Kim Hoàng, Xã Vân Canh, Quận Hoài Đức	210.400.172	1.057.285.156
1646	ngõ phố Tôn Đức Thắng, Đống Đa	210.248.712	1.058.328.825
1647	Tỉnh lộ 932, Nhơn Nghĩa, Phong Điền	99.672.268	1.056.767.944
1648	Trường Chinh, Tân Bình	108.076.158	1.066.348.442
1649	KĐT Đặng Xá	210.134.684	1.059.492.764
1650	Trần Bình Trọng, Phường 1, Quận Gò Vấp	108.131.643	1.066.875.503
1651	đường D4 Võ Thị Sáu, Phường Thống Nhất	109.469.111	1.068.272.499
1652	Đường số 10, Linh Trung, Quận Thủ Đức, TPHCM	108.586.724	1.067.722.225
1653	Đường số 10, Linh Trung, Quận Thủ Đức	108.586.724	1.067.722.225
1654	Đường số 18, Linh Chiểu, Quận Thủ Đức	108.540.168	1.067.616.751
1655	số 2 ngõ Yên Hòa, Cầu Giấy	210.226.691	1.057.935.241
1656	Phố Nhân Hòa, Phường Nhân Chính, Quận Thanh Xuân, Hà Nội	21.002.125	1.058.089.493
1657	hẻm Phan Đình Phùng, Phường 2, Quận Phú Nhuận	10.794.454	106.683.644
1658	đường Xô Viết Nghệ Tỉnh, Phường 26, Quận Bình Thạnh	108.110.484	1.067.137.928
1659	đường Trương Quốc Dung, Phường 10, Quận Phú Nhuận	10.796.578	1.066.725.669
1660	đường Sơn Kỳ	108.011.535	1.066.183.755
1661	Nguyễn Thiện Thuật, Phường 24, Quận Bình Thạnh	108.054.965	1.066.991.847
1662	đường Nguyễn Thị Tươi, Phường Tân Bình, Dĩ An	109.506.997	1.067.535.228
1663	Lê Trọng Tấn, Quận Tân Phú	108.079.431	1.066.201.184
1664	Hẻm xe hơi Huỳnh Văn Nghệ	108.300.603	1.066.379.851
1665	2 mặt phố Hoàn Kiếm	210.322.132	1.058.531.777
1666	hẻm 313 quốc lộ 13, Quận Thủ Đức	108.383.486	1.067.137.316
1667	đƯỜNG Trần Văn Kiểu, Phường Bình Phú, Quận 6	107.394.133	1.066.275.584
1668	 Đường 18m, Quận 6	107.480.929	1.066.352.362
1669	Lũy Bán Bích, Tô Hiệu, Quận 11, Bình Tân	107.763.945	1.066.338.312
1670	Phước Thiện, gần Vinhome	10.760.068	1.069.299.579
1671	Phước Thiện, gần Vinhome	10.760.068	1.069.299.579
1672	An Dương Vương, Kinh Dương Vương, Võ Văn Kiệt, Aeon Bình Tân	107.358.416	1.066.214.714
1673	Kha Vạn Cân, Quận Bình Thạnh	108.105.831	1.067.091.422
1674	Xuân La, Tây Hồ	210.596.756	1.058.040.796
1675	Ngõ 58 Thanh Bình, P. ...		
1676	Võ Nguyên Giáp, ???		
1677	Văn La, Hà Đông	209.579.999	1.057.631.668
1678	phố Nguyễn Khuyến	210.281.869	1.058.389.741
1679	đường An Hải 14, Quận Sơn Trà, TP Đà Nẵng	160.857.919	1.082.350.551
1680	Phố 4, trường Hoàng Diệu, Hải Châu, Đà Nẵng	160.646.082	108.219.119
1681	hẻm 445 đường Tân Hòa Đông, Phường Bình Trị Đông, Quận Bình Tân	107.658.195	1.066.158.934
1682	phố Hoàng Cầu	210.164.782	1.058.227.056
1683	đường ô tô, Phường Tân Vạn	109.117.711	1.068.272.458
1684	Lê Đức Thọ, Phường 6, Gò Vấp	108.374.106	1.066.806.374
1685	Lê Đức Thọ, Phường 17, Quận Gò Vấp	108.415.165	1.066.772.486
1686	Kẻ Tạnh, Giang Biên, Long Biên	210.621.803	1.059.164.058
1687	đường Đồng Khởi, Quận ???	107.761.225	1.067.030.267
1688	đường Lê Đình Thám, Quận Tân Phú	107.972.734	1.066.213.031
1689	Xã Cửa Dương, Phú Quốc, Kiên Giang	10.289.879	10.398.402
1690	số Thái Thịnh, Quận Đống Đa	210.180.725	1.058.299.495
1691	Phan Xích Long, Phan Đăng Lưu, Lê Văn Duyệt, Trường Sa, Phú Nhuận	107.971.068	1.066.904.728
1692	Nguyễn Xiển		
1693	Nguyễn Lương Bằng, Đống Đa	210.161.795	1.058.286.026
1694	đường Phan Huy Ích, Phường 15, Quận Tân Bình	108.303.911	1.066.330.059
1695	đường Linh Đông, Phường Linh Đông, TP. Thủ Đức	108.479.658	1.067.467.678
1696	Đường Số 4, Khu Đô Trang Tên Lдается, Quận Bình Tân	107.652.581	1.066.038.535
1697	Lê Văn Quới, Mã Lò, Tân Kỳ Tân Quý, Hương Lộ 2, Bình Trị Đông, Ngã Tư Bốn Xã	107.875.871	1.065.984.064
1698	ngõ Mỗ Lao, Hà Đông	209.796.434	1.057.788.154
1699	Hẻm kinh dương Vương An Lạc, Quận Bình Tân	107.320.917	1.066.207.377
1700	đường Thích Quảng Đức, Phường 4, Quận Phú Nhuận	108.060.643	1.066.813.234
1701	đường Thích Quảng Đức, Phường 4, Quận Phú Nhuận	108.060.643	1.066.813.234
1702	đường Đồng Khởi, TP Biên Hòa	109.738.572	1.068.520.291
1703	Phạm Văn Bạch, Gần Trường Chinh, Trần Thái Tông		
1704	đường Cát Cụt, Lê Chân, Hải Phòng	208.528.751	1.066.765.963
1705	Số 16, Gò Xoài, Bình Trị Đông, Quận Bình Tân, Thành phố Hồ Chí Minh	10.777.449	106.602.713
1706	đường Trương Phước Phan, Phường Bình Trị Đông, Quận Bình Tân	107.667.203	1.066.133.357
1707	Phố thông Phố Lớn, Quận Hà Đông	20.955.835	1.057.563.658
1708	hẻm xe hơi thông đường Mã Lò, Phường Bình Trị Đông, Quận Bình Tân, TP. Hồ Chí Minh	107.728.591	1.066.018.083
1709	đường Hương Lộ 2, Phường Bình Trị Đông, Quận Bình Tân, Thành phố Hồ Chí Minh	107.699.131	1.066.119.636
1710	P. Quang Vinh, ngay ngã 3 Thành		
1711	đường Hương Lộ 2, Phường Bình Trị Đông, Quận Bình Tân, Thành phố Hồ Chí Minh	107.699.131	1.066.119.636
1712	hẻm xe tải, Đường Số 22, Phường Linh Đông, TP Thủ Đức	108.494.678	1.067.435.583
1713	đường 188 Lê Đình Cẩn, Phường Linh Trung, Quận Bình Tân	107.595.835	1.065.982.538
1714	đường Nhựa Xe Hơi, khu Lê Văn Quới, Quận Bình Tân	10.776.189	1.066.113.201
1715	đường Nguyễn Văn Cừ, Phường Gia Thụy, Quận Long Biên	210.495.394	1.058.834.124
1716	Hoàng Văn Thụ, Phường 8, Quận Phú Nhuận	107.996.351	1.066.737.125
1717	duit number 2, Thao Dien, Quan 2	108.019.001	1.067.383.426
1718	NguyễnDu, Phường 7, Quận Gò Vấp	108.271.084	1.066.861.979
1719	phố Chính Kinh, phường Nhân Chính, Quận Thanh Xuân	209.995.544	1.058.113.326
1720	Tăng Nhơn Phú	108.409.534	10.679.719
1721	Nhà Đình Phong Phú, Quận ???	108.369.642	1.067.814.925
1722	đường số, KDC Lê Thành, Quận 8, TP. Hồ Chí Minh	107.197.683	1.066.183.223
1723	Đường Kênh Tân Hóa, Quận 6	107.588.676	1.066.343.553
1724	đường Hoàng Văn Thái	16.052.296	1.081.530.577
1725	Gần mặt tiền Tân Hòa, Hẻm ô tô, Nhà Đẹp, DT Rộng, TÂN PHÚ	107.900.517	1.066.281.901
1726	mạng Tháng Tám, Quận Tân Bình	108.014.659	1.066.525.974
1727	Cổ Linh	225.512.095	1.056.200.598
1728	phố Tân Triều	209.704.346	1.057.905.755
1729	đường Hoàng Bật Đạt, Phường 15, Quận Tân Bình	108.244.441	1.066.351.758
1730	Nguyễn Đình Chiểu, Phường 5, Quận 3	107.728.965	1.066.848.042
1731	đường Lê Văn Sỹ, Phường 14, Quận 3	107.884.861	1.066.767.003
1732	Kế MT Lý Thánh Tông, Khu VIP Tô Hiệu, Quận Tân Phú	107.691.501	1.066.269.722
1733	ðường Điện Biên Phủ, Phường 15, Quận Bình Thạnh	107.978.161	1.067.049.832
1734	Bùi Quang Là, Phường P14, Quận Gò Vấp	108.351.606	1.066.394.244
1735	đường số 10, Bình Thành, Liên Khu 4-5	108.003.271	1.065.864.795
1736	Khu Phố Châu Âu, trung tâm TP Đà Nẵng	160.544.563	1.080.717.219
1737	Lê Văn Lương, Phường Tân Phong, Quận 7	107.300.587	1.067.003.372
1738	đường Nguyễn Sơn, Quận Tân Phú	10.796.321	1.066.313.205
1739	ngõ 44 An Hòa, Hà Đông	209.849.165	1.057.906.913
1740	Thị Xã Sapa	223.363.608	1.038.437.852
1741	đường Cách Mạng Tháng 8, Phường 15, Quận 10	107.851.151	1.066.679.902
1742	đường Cách Mạng Tháng 8, Phường 15, Quận 10	107.851.151	1.066.679.902
1743	khu Vip Lê Văn Sỹ, Phường 11, Quận Phú Nhuận	107.914.703	1.066.720.667
1744	khu Vip Lê Văn Sỹ, Phường 11, Quận Phú Nhuận	107.914.703	1.066.720.667
1745	ngõ 76/32, An Dương	210.509.388	1.058.428.491
1746	Lam Sơn, Phường 6, Thành phố Đà Lạt	119.526.576	1.084.297.988
1747	Phan Chu Trinh, Phường Vĩnh	186.746.546	1.056.696.523
1748	 Ngõ 2, Kiệt 44, Lê Ngô Cát, Thanh Hải	140.502.185	1.091.701.666
1749	Việt Hưng, Long Biên	210.575.538	1.059.024.322
1750	số 33, Hoàng Quốc Việt, Cầu Giấy	21.047.406	105.797.904
1751	Lê Đình-CN, Bình Tân	107.652.581	1.066.038.535
1752	Giáp Quận 6, Bình Tân	107.652.581	1.066.038.535
1753	Cái Nai, Hưng Thạnh, Cái Răng, TPCT	99.999.013	1.057.657.824
1754	Ngọc Thụy, Long Biên	210.588.582	1.058.583.873
1755	Ngọc Thụy, Long Biên	210.588.582	1.058.583.873
1756	Lê Trọng Tấn, Hà Đông	20.977.862	1.057.465.724
1757	Lê Trọng Tấn, Hà Đông	20.977.862	1.057.465.724
1758	Lũy Bán Bích, Thoại Ngọc Hầu, Âu Cơ, Quận Tân Phú	107.817.241	1.066.359.669
1759	Thị Nghè, Phường 17, Quận Bình Thạnh	107.927.036	1.067.087.064
1760	Phường Bửu Long	109.586.438	1.068.053.993
1761	Bùi Văn Hoà, Phường Long Bình	109.195.379	1.068.831.366
1762	đường ĐT743, Phường Bình Chuẩn, thành phố Thuận An	109.839.171	1.067.226.453
1763	đường Nguyễn Viết Xuân, phường Không, quận Lê Trọng Tấn	210.378.383	1.057.439.194
1764	đường Hoàng Diệu, Phường 10, Quận Phú Nhuận	107.959.019	106.671.056
1765	Nguyễn Trãi, Vũ Trọng Phụng, phường Thanh Xuân Trung, Quận Thanh Xuân, Hà Nội	209.965.819	1.058.103.547
1766	đường Xô Viết Nghệ Tỉnh, Phường 21, Quận Bình Thạnh	107.981.379	106.710.916
1767	ngõ thông sang chùa Láng	210.235.819	1.058.051.698
1768	đường Nguyễn Văn Trỗi, Phường 11, Quận Phú Nhuận	107.955.541	1.066.755.032
1769	Bùi Quang Là, Gò Vấp	108.351.606	1.066.394.244
1770	Bùi Quang Là, Gò Vấp	108.351.606	1.066.394.244
1771	View công viên, Phố dạo bộ, Phố hoa, Phố nướng ẩm thực, Khuôn viên cây xanh	108.016.071	1.066.337.258
1772	đường Nguyễn Đức Cảnh, Lê Chân, Hải Phòng	208.546.393	1.066.745.767
1773	Kha Vạn Cân		
1774	Phố Hiệp Bình, Quận Thủ Đức	108.454.029	1.067.261.562
1775	đường số 11, Trường Thương		
1776	Định Công Thượng, Hoàng Mai	209.784.143	1.058.282.959
1777	Bùi Xương Trạch, Thanh Xuân	209.878.704	1.058.183.772
1778	Bùi Xương Trạch, Thanh Xuân	209.878.704	1.058.183.772
1779	Lê Quang Định, Bình Thạnh	108.107.331	1.066.921.173
1780	Phố hái, Sapa	223.363.608	1.038.437.852
1781	Đường Tân Hòa Đông, Quận 6	10.759.585	1.066.284.508
1782	Tân Hương, Quận Tân Phú	107.900.436	1.066.222.343
1783	phố Việt Hưng, Long Biên	210.570.822	1.059.026.394
1784	đường An Dương Vương, Phường 2, Quận Đà Lạt	119.526.152	1.084.356.695
1785	đường 475 Phước Long B, Quận 9	108.189.144	1.067.753.194
1786	Bình Tân, gần AEON Mall	107.652.581	1.066.038.535
1787	đường Đặng Văn Bi, Tp Thủ Đức	108.380.903	106.766.843
1788	đường Phan Tứ, khối phố Tây An Thượng, Đà Nẵng	16.049.809	108.245.884
1789	Phùng Tá Chu, Quận 6	107.480.929	1.066.352.362
1790	Phố Quan Nhân	210.034.012	1.058.110.263
1791	Võ Văn Kiệt, Aeon Bình Tân	107.427.497	1.066.119.309
1792	dường Nhựa 6m, Bình Tân	101.397.218	1.057.203.631
1793	đường Lũy Bán Bích, Quận Tân Phú	107.766.943	1.066.341.303
