Title	Price	Diện tích (m2)	Số phòng ngủ	Số phòng WC	Địa chỉ	Description	Chỗ để xe hơi	Đang cho thuê	CSVC xung quanh	Vấn đề pháp lý, sổ đỏ	ExtractedTitle	Address1	Address2
Bán nhà 3 tầng tại ngõ Dầu Lửa, Sở Dầu, Hồng Bàng, Hải Phòng giá 69,4m2- 3 tầng- 2,9 tỷ	2.9	69	3.0	3.0	Dầu Lửa, Sở Dầu, Hồng Bàng, Hải Phòng	"Bán nhà 3 tầng tại ngõ Dầu Lửa, Sở Dầu, Hồng Bàng, Hải Phòng giá 69,4m2- 3 tầng- 2,9 tỷ. LH: 0796-336-866.

* Nhà xây 3 tầng kiên cố chắc chắn, hiện đại sang trọng, nhà mới khách về chỉ việc ở ngay.

*Thông số:
- Diện tích: 69,4m2
- Ngang: 4m
- Hướng: ĐB
- Đường: 3m
- Sổ đỏ chính chủ, pháp lý rõ ràng

* Cấu trúc:
- Tầng 1: sân để xe ô tô, phòng khách, bếp, 1wc, khe kỹ thuật sau nhà.
- Tầng 2: 2 phòng ngủ, 1wc
- Tầng 3: 1 phòng ngủ, 1 phòng thờ, sân phơi

* Giá: 2,9 tỷ.( TT)

* Nhà ngay Sở Dầu, đi lại thuận tiện bán kính vài trăm m có trường mầm non Sở Dầu, trường học các cấp, trung tâm hành chính quận Hồng Bàng, siêu thị HC, Megarket, Điện máy Xanh, Bến xe khách Thượng Lý, Ga Thượng Lý.
* Đi vào trung tâm thành phố chỉ mất 10p đi xe máy.

☎️ KH quan tâm LH Mrs Tâm: 0796-336-866 Công ty Bán Nhà Hải Phòng."	False	False	True	False	Ngõ Dầu Lửa, Sở Dầu, Quận Hồng Bàng, Hải Phòng	Dầu Lửa, Sở Dầu, Hồng Bàng, Hải Phòng	Ngõ Dầu Lửa, Sở Dầu, Quận Hồng Bàng, Hải Phòng
NHÀ BÁN 2 TẦNG, BÙI ĐÌNH TUÝ, BÌNH THẠNH, 21m2, NHỈNH 2 TỶ.	2.85	21	2.0	2.0		"Mô Tả:

Kết cấu: trệt 1 lầu có ban công.

Gồm: 2 phòng ngủ, 2 tolet, phòng khách, bếp, đầy đủ công năng.

Vị trí: Nằm gần Trường học các cấp, gần chợ, Bệnh viện, Uỷ Ban Quận. Hẻm 3m, cách hẻm xe hơi 6 căn nhà.

Khu vực: Khu vực an ninh yên tĩnh, dân trí cao nhà xây dựng đồng đều.

Pháp lý: Chuẩn, Sổ hồng công chứng 1p30s."	False	True	True	False	Bùi Đình Tuý, Bình Thạnh	Bùi Đình Tuý, Bình Thạnh	Bùi Đình Tuý, Bình Thạnh
Bán nhà hẻm 4m Nguyễn Thanh Tuyền, 52m2, 3PN, dòng tiền 9 triệu/tháng	2.95	52	3.0	3.0		"Bán nhà hẻm 4m Nguyễn Thanh Tuyền, 52m2, 3PN, dòng tiền 9 triệu/tháng
. Vị trí: gần Nguyễn Trọng Tuyển, Lê Văn Sỹ, vòng xoay lăng cha cả.
. Tiện ích trung tâm Phường 2 Tân Bình.
. Diện tích 52m2, 1 trệt 1 lầu BTCT chắc chắn, 3 phòng ngủ, nhà mới ở liền.
. Hiện đang cho thuê 9 triệu/ tháng, khu vực dân trí cao.
. Pháp lý đẹp, hoàn công đủ, không lộ giới, sổ đang vay bank.
Gọi 0902177052 xem nhà, đang gấp bán."	True	True	True	True	hẻm 4m Nguyễn Thanh Tuyền, Phường 2, Quận Tân Bình	hẻm 4m Nguyễn Thanh Tuyền, Phường 2, Quận Tân Bình	hẻm 4m Nguyễn Thanh Tuyền, Phường 2, Quận Tân Bình
BÁN NHÀ MẶT AN DƯƠNG VƯƠNG VIEW SÔNG HỒNG, Ô TÔ ĐỖ CỬA. 150M2, MẶT TIỀN: 6M, GIÁ 20 TỶ.	4.6	150	5.0	4.0		"BÁN NHÀ MẶT AN DƯƠNG VƯƠNG VIEW SÔNG HỒNG, Ô TÔ ĐỖ CỬA. 150M2, MẶT TIỀN: 6M, GIÁ 20 TỶ.
Chính chủ nhờ bán nhà mặt phố An Dương Vương, phường Đông Ngạc, quận Bắc Từ Liêm, Hà Nội.
Nhà có diện tích 150m2, mặt phố lớn, mặt tiền 6m (mặt tiền view Sông Hồng lý tưởng).
SIÊU PHẨM MẶT PHỐ - CHỦ TỰ XÂY - KINH DOANH
- Diện 150M , Bao Gồm. Sổ đỏ 104M + Lưu Không Phía Trước Tổng 150M.
- Nhà Chủ tự Xây, có thể lắp thang máy, thiết kế 6 tầng.
+ Tầng Hầm : Gara ô tô + Kho.
+ Tầng 2: 2 phòng ngủ + 2 WC.
+ Tầng 3: 2 Phòng ngủ + 2 WC.
+ Tầng 4: Phòng Thờ + Phòng ngủ.
+ Tầng 5 : Tum + Sân Phơi.
- Sổ đỏ Phân Lô Vuông Đét , sẵn giao dich.
Giá bán: 20 tỷ - có thương lượng cho khách mua thực sự thiện trí."	False	False	True	False	An Dương Vương, phường Đông Ngạc, quận Bắc Từ Liêm, Hà Nội	An Dương Vương, phường Đông Ngạc, quận Bắc Từ Liêm, Hà Nội	An Dương Vương, phường Đông Ngạc, quận Bắc Từ Liêm, Hà Nội
SIÊU PHẨM NHÀ MẶT PHỐ XUÂN ĐỈNH NHƯNG GIÁ TRONG NGÕ, Ô TÔ ĐỖ CỬA. 110M2, MẶT TIỀN: 8M, GIÁ CHỈ 15,5 TỶ.	20	110	2.0	2.0		"SIÊU PHẨM NHÀ MẶT PHỐ XUÂN ĐỈNH NHƯNG GIÁ TRONG NGÕ, Ô TÔ ĐỖ CỬA. 110M2, MẶT TIỀN: 8M, GIÁ CHỈ 15,5 TỶ.
Nhà có diện tích 110m2, mặt phố lớn, mặt tiền 8m (mặt tiền view Sông Hồng lý tưởng).
SIÊU PHẨM MẶT PHỐ - KINH DOANH SẦM UẤT
- Diện 110M , Bao Gồm. Sổ đỏ 104M + Lưu Không Phía Trước Tổng 150M.
- Mặt phố gần nhiều trường Đại học, Trường MN, TH, THCS, THPT Xuân Đỉnh
Sổ đỏ Phân Lô Vuông Đét , sẵn giao dich."	True	True	True	False	đường Xuân Đỉnh, Quận	đường Xuân Đỉnh, Quận	đường Xuân Đỉnh, Quận
BÁN GẤP NHÀ MẶT TIỀN, KHU TÊN LỬA, BÌNH TÂN, 5 TẦNG, THANG MÁY, 84M2(4×21), GIÁ 11.5 TỶ	15.5	84	8.0	8.0	Tên Lửa	"BÁN GẤP NHÀ MẶT TIỀN, KHU TÊN LỬA, BÌNH TÂN, 5 TẦNG, THANG MÁY, 84M2(4×21), GIÁ 11.5 TỶ

+ Kết cấu: Nhà 5 tầng còn rất mới, thang máy, gồm 8PN, vệ sinh khép kín. Có 4 phòng Master. Phòng Khách suốt rộng. Nhà thiết kế lệch tầng hiện đại.

+ Vị trí: Ngay cạnh giao lộ Tên Lửa và Đường số 1 sầm uất. Gần Aeon Mall, Bệnh viện Quốc Tế City, Bến xe Miền Tây,...

+ Sổ hồng chính chủ, hoàn công đầy đủ, mua bán nhanh gọn. T455"	True	False	True	False	Tên Lừa, Quận Bình Tân	Tên Lửa	Tên Lừa, Quận Bình Tân
Chính chủ đi nước ngoài cần bán gấp nhà vuông vức đường Trương Quốc Dung, P.10, Phú Nhuận	11500000000	30	3.0	2.0		"???? Diện tích: 4.2 x 7.25m (30,45m2). Tổng diện tích sử dụng: 92.2m2
✅ Kết cấu nhà 1 trệt, 1 lửng, 2 lầu
✅ Gồm 1 phòng khách, bếp, 3 phòng ngủ và 2 nhà vệ sinh
❌ Khu trung tâm thuận tiện đi lại, hẻm rộng 3m
❌ Ưu điểm khu vực trung tâm nên tiện ích đầy đủ, kết nối sân bay quốc tế và nội địa chỉ 10 phút đi xe
‼️ Vị trí nhà sát ngay đường Nguyễn Văn Trỗi, thuận tiện đi làm các quận 1, 3, 10 và Tân Bình
⚠️ Pháp lý sổ hồng đầy đủ
⚠️ Giá: 3tỉ920
???? Call/Zalo: Tấn Nghĩa 0935626988"	False	False	True	False	đường Nguyễn Văn Trỗi, Phường 10, Quận Phú Nhuận	đường Nguyễn Văn Trỗi, Phường 10, Quận Phú Nhuận	đường Nguyễn Văn Trỗi, Phường 10, Quận Phú Nhuận
Bán nhà phố Ngụy Như Kon Tum, Thanh Xuân 138m, mt 8m. Giá: 45 tỷ	11.5	138	4.0		Hà Nội	"""Bán nhà phố Ngụy Như Kon Tum, Thanh Xuân 138m, mt 8m. Giá: 45 tỷ
Bán nhà phố Ngụy Như Kon Tum, nhà 4 tầng, đầy đủ công năng, nhà đang cho thuê 40tr/ tháng
Diện tích 138m, mặt tiền 8m,đáp ứng mọi loại hình kinh doanh
Hiện trạng nhà 4 tầng, chủ mới về sử dụng luôn hoặc xây tòa nhà 9 tầng kinh doanh hiệu xuất khủng
Sổ đỏ chính chủ, pháp lý chuẩn, sẵn sàng giao dịch
Giá: 45 tỷ, có thương lượng.
Liên hệ trực tiếp hoặc zalo: 0937.158.386"	False	True	True	False	Ngụy Như Kon Tum, Thanh Xuân	Hà Nội	Ngụy Như Kon Tum, Thanh Xuân
NHÀ 2 MẶT TIỀN KIỆT Ô TÔ 24 LƯƠNG VĂN CAN CHỈ 2,9 TỈ	45	75				"✅NHÀ 2 MẶT TIỀN KIỆT Ô TÔ 24 LƯƠNG VĂN CAN chi 2,9 tỉ
✅Cách đường chính chỉ 20m - đường rộng rãi, ô tô vào tận nơi
✅DT 75m2. Nở hậu.
✅Nhà 2 tầng thiết kế hiện đại. Đầy đủ công năng.
✅Giá 2.9 tỷ thương lượng
☎️ Liên hệ: 0766.546.405 gặp em Thảo để xem nhà và thương lượng chính chủ ạ"	False	False	True	False	24 Lương Văn Can	24 Lương Văn Can	24 Lương Văn Can
Bán nhà mặt tiền Hải Châu, Đà Nẵng chỉ 3 tỷ 400 triệu	6	60	2.0	1.0	Đường Huỳnh Thúc Kháng, Hải Châu, Đà Nẵng	"* Cần bán nhà khu Tyên Sơn,P. Hoà Cường Nam, Hải Châu giá 3 tỷ 400 triệu.
* Đường 5,5m, lề 3m.
* Dt 4 x 15 = 60m2. Cấp 4, 2 phòng ngủ. Đầy đủ công năng sủ dụng.
* Gần khu thể thao Tuyên Sơn,dân cư đông đúc, trí thức, thân thiện.
* Thích hợp vừa ở vừa kinh doanh. Giá tốt nhất khu vực.
Liên hệ: Đức Phương 0905616141 để xem nhà ngoài giờ hành chính."	False	False	True	False	đường Tyên Sơn, Phường Hoà Cường Nam, Quận Hải Châu, Đà Nẵng	Đường Huỳnh Thúc Kháng, Hải Châu, Đà Nẵng	đường Tyên Sơn, Phường Hoà Cường Nam, Quận Hải Châu, Đà Nẵng
Hxh 3pn 4x12 Thống Nhất P11 Gò Vấp 4,8 tỷ	3.4	48	3.0	2.0		"3pn Hxh 4x12 Thống Nhất Phường 11 Gò Vấp 4,8 tỷ

+ 1 trệt 1 lầu 3 phòng ngủ xe hơi vô nhà, sát mặt tiền
+ Khu vực an ninh, dân trí cao kề Cityland
+ Quang trung, Lotte, Nguyễn Văn Lượng ..."	True	False	True	False	Thống Nhất, Phường 11, Quận Gò Vấp	Thống Nhất, Phường 11, Quận Gò Vấp	Thống Nhất, Phường 11, Quận Gò Vấp
Bán nhà chợ Tân Bình 2mặt tiền	4.8	80	4.0	3.0	3a	"Nhà 2 mặt tiền 3A Tân Tiến - Đông Hồ -phường 8- Tân Bình

Diện tích: 80m2 - 4 tầng - xe hơi thông tứ tung - ngay chợ Tân Bình kinh doanh nhộn nhịp - dòng tiền chính chủ kinh doanh - trên 50 triệu/ tháng

Giá 22.22 tỷ THƯƠNG LƯỢNG MẠNH CHO KHÁCH THIỆN CHÍ.

Kết cấu: 4 tầng BTCT, ngang đẹp 4m, nở hậu 4,7m dài 20m, sân để xe, phòng khách, bếp, sân thượng, 4 phòng ngủ, 3 WC.

Mặt tiền Tân Tiến hướng Đông Bắc - Mặt tiền Đông Hồ hướng Tây Nam.

Ngay chợ vải Tân Bình, kinh doanh sầm uất, gần siêu thị, trường học, các ngân hàng, tiện ích bủa vây.

Giao thông cực kỳ thuận tiện, ra các trục đường chính của quận Tân Bình: Lý Thường Kiệt, Lạc Long Quân, Âu Cơ, Hồng Lạc, Bàu Cát, Đồng Đen, Trường Chinh... Chỉ vài nốt nhạc.

Pháp lý đầy đủ.

Ac môi giới có khách gọi e . Hh 1%

Liên hệ chính chủ: 0908335993 Phong

https://www.google.com/maps/place/167%2F3+T%C3%A2n+Ti%E1%BA%BFn,+Ph%C6%B0%E1%BB%9Dng+8,+T%C3%A2n+B%C3%ACnh,+Th%C3%A0nh+ph%E1%BB%91+H%E1%BB%93+Ch%C3%AD+Minh,+Vi%E1%BB%87t+Nam/@10.7857226,106.6488339,17z/data=!3m1!4b1!4m6!3m5!1s0x31752eb60d7e509d:0x558ffbd49f0a2001!8m2!3d10.7857173!4d106.6514088!16s%2Fg%2F11jzmnn78w?hl=vi-VN&entry=ttu"	False	True	True	False	3A Tân Tiến, Phường 8, Quận Tân Bình	3a	3A Tân Tiến, Phường 8, Quận Tân Bình
Bán nhà chợ Tân Bình 2mặt tiền	22.22	80	4.0	3.0	3a	"Nhà 2 mặt tiền 3A Tân Tiến - Đông Hồ -phường 8- Tân Bình

Diện tích: 80m2 - 4 tầng - xe hơi thông tứ tung - ngay chợ Tân Bình kinh doanh nhộn nhịp - dòng tiền chính chủ kinh doanh - trên 50 triệu/ tháng

Giá 22.22 tỷ THƯƠNG LƯỢNG CHO KHÁCH THIỆN CHÍ.

Kết cấu: 4 tầng BTCT, ngang đẹp 4m, nở hậu 4,7m dài 20m, sân để xe, phòng khách, bếp, sân thượng, 4 phòng ngủ, 3 WC.

Mặt tiền Tân Tiến hướng Đông Bắc - Mặt tiền Đông Hồ hướng Tây Nam.

Ngay chợ vải Tân Bình, kinh doanh sầm uất, gần siêu thị, trường học, các ngân hàng, tiện ích bủa vây.

Giao thông cực kỳ thuận tiện, ra các trục đường chính của quận Tân Bình: Lý Thường Kiệt, Lạc Long Quân, Âu Cơ, Hồng Lạc, Bàu Cát, Đồng Đen, Trường Chinh... Chỉ vài nốt nhạc.

Pháp lý đầy đủ.

A/c môi giới thoải mái nhé. Hh 1% . Cám ơn a chị

Liên hệ chính chủ: 0908335993

https://www.google.com/maps/place/167%2F3+T%C3%A2n+Ti%E1%BA%BFn,+Ph%C6%B0%E1%BB%9Dng+8,+T%C3%A2n+B%C3%ACnh,+Th%C3%A0nh+ph%E1%BB%91+H%E1%BB%93+Ch%C3%AD+Minh,+Vi%E1%BB%87t+Nam/@10.7857226,106.6488339,17z/data=!3m1!4b1!4m6!3m5!1s0x31752eb60d7e509d:0x558ffbd49f0a2001!8m2!3d10.7857173!4d106.6514088!16s%2Fg%2F11jzmnn78w?hl=vi-VN&entry=ttu"	False	True	True	False	Tân Tiến, Phường 8, Quận Tân Bình	3a	Tân Tiến, Phường 8, Quận Tân Bình
BÁN NHÀ 2 TẦNG LẠI THẾ KIỆT 245 PHẠM VĂN ĐỒNG	22.22	71				"✅ Bán nhà 2 tầng Lại Thế kiệt 245 Phạm Văn Đồng
✅ Dt : 71,8m2 ngang 7m Đường OTO Tận Nhà
✅ Nhà đổ 2 mê kiên cố. Gồm phòng khách, bếp, 3 phòng ngủ, phòng làm việc, phòng thờ, wc đầy đủ nội thất và công năng. Dọn vào ở ngay.
✅ Để lại điều hoà, tủ lạnh, bếp,… đầy đủ
✅ Khu vực dân trí cao, cách đường chính Phạm Văn Đồng vài trăm mét, ngay TTTP đầy đủ tiện ích
✅ Bán nhanh : 2,650 tỷ ( thương lượng )
☎️ ☎Liên hệ: 0766.546.405 gặp em Thảo Để xem nhà
Trân Trọng!"	False	False	True	False	Lại Thế Kiệt, Phạm Văn Đồng	Lại Thế Kiệt, Phạm Văn Đồng	Lại Thế Kiệt, Phạm Văn Đồng
Nhà rộng hẻm thoáng ở ngay, Ni Sư Huỳnh Liên, 3.2 tỷ	4	30	2.0	2.0	Ni Sư Huỳnh Liên, P.10, Tân Bình	Nhà 1 trệt 1 lầu, 1 phòng ngủ có thể ngăn được 2 phòng, phòng khách, bếp, 2 vệ sinh. Hẻm 3m thông hẻm ô tô tránh. Khu vực giao thông rất thuận tiện, chỉ 2 phút qua Quận 10, Tân Phú. Tiện ích xung quanh đầy đủ. Sổ hồng riêng nở hậu, hoàn công đầy đủ. Liên hệ anh Võ: 0909 100 817. Không tiếp trung gian.	False	False	True	False	Ni Sư Huỳnh Liên	Ni Sư Huỳnh Liên, P.10, Tân Bình	Ni Sư Huỳnh Liên
Bán nhà HXH đường LÊ VĂN QUỚI, DT: 4x12m, 2 lầu, giá: 5.3 tỷ TL Liên Hệ Ngay	3.2	48				"- Bán nhà: Hẻm xe hơi đường Lê Văn Quới, DT: 4x12m.
- Hiện trạng: Hẻm trước nhà 5m xe hơi vô đến nhà, cách ngã 3 Lê Văn Quới - Đất Mới chỉ 300m. Bán kính tiện ích nằm trong 1km như chợ, siêu thị, dịch vụ ăn uống, cửa hàng công nghệ,v.v...
- Kết cấu: 1 trệt, 2 lầu.
- Vị trí: Khu dân cư an ninh, dân trí cao, văn minh, sạch sẽ.
- Giá: 5.3 tỷ TL.

Liên hệ: 0707725457 Phú Cường.
Hỗ Trợ Khách Hàng Đăng Bộ Sang Tên Hoàn Toàn Miễn Phí.
Cam kết những thông tin trên đúng 100% sự thật.
Uy Tín - Chuyên Nghiệp - Tốc Độ - Hiệu Quả.
Sàn giao dịch BĐS TanPhuLand.
Đc: 229 Lê Văn Quới, P. Bình Trị Đông, Q. Bình Tân, TP. HCM."	False	False	True	False	đường Lê Văn Quới, Phường Bình Trị Đông, Quận Bình Tân, Thành phố Hồ Chí Minh	đường Lê Văn Quới, Phường Bình Trị Đông, Quận Bình Tân, Thành phố Hồ Chí Minh	đường Lê Văn Quới, Phường Bình Trị Đông, Quận Bình Tân, Thành phố Hồ Chí Minh
KHU Vàng 304A Phường 25 Bình Thạnh Giá: 18.5 tỷ	5.3		5.0	5.0	Nguyễn văn thương	"KHU Vàng 304A Phường 25 Bình Thạnh
Giá: 18.5 tỷ
Kết cấu: 4 tầng ( 9 x 8m )
HẺM XE HƠI TRÁNH - KHU VIP P25 BÌNH THẠNH - HẺM NHƯ MẶT TIỀN
+ Kết cấu: nhà 4 tầng, gồm 5 phòng ngủ, toilet, sân để xe. Có phòng ở trệt cho người lớn tuổi.
+ Vị trí vàng khu Bình Thạnh, kế bên là các trường đại học, khu kinh doanh sầm uất, đầy đủ tiện ích."	False	False	True	False	Khu Vàng 304A, Phường 25, Quận Bình Thạnh	Nguyễn văn thương	Khu Vàng 304A, Phường 25, Quận Bình Thạnh
NHÀ HOÀN THIỆN SÁT TP BIÊN HOÀ - SỔ HỒNG RIÊNG CHỈ 800TR	5.6	112			tân phong	"NHÀ HOÀN THIỆN SÁT TP BIÊN HOÀ - SỔ HỒNG RIÊNG THỔ CƯ THANH TOÁN 800TR NHẬN NHÀ ( bao thuế phí )
-Diện tích : 112m2 , Đường Nhựa trước nhà 6 mét
-Nhà xây 1 trệt 1 lầu 3 Phòng Ngủ , 2 WC , 1 Phòng Thờ , Bếp , Phòng Khách
- Giá bán : 1tỷ750 ( ngân hàng vietcombank hỗ trợ 1tỷ2 )
☎️ 03 567 567 39 em Quý để xem nhà ạ ❤️"	False	False	True	False	NHÀ HOÀN THIỆN SÁT TP BIÊN HOÀ	tân phong	NHÀ HOÀN THIỆN SÁT TP BIÊN HOÀ
BÁN NHÀ CẤP 4 90M2 1 SẸC TL8,SHR,945TR	1750	90			thị trấn củ chi, củ chi	"- Chủ cần bán căn nhà cấp 4 ở 1 sẹc tỉnh lộ 8, gần cầu vượt Củ Chi
- Diện tích: 90m2(5x18)
- Giá:945 triệu
- Sổ hồng riêng
- Vị Trí : cách cầu vượt Củ Chi 600m , hướng ra đường Liêu , xung quanh , có nhiều cửa hàng , nhà thuốc ,công ty,...
Kết Cấu : sân đậu xe rộng rãi ,1 phòng khách ,2 phòng ngủ ,1 bếp , 1 WC .
- Anh chị quan tâm thì liên hệ em xem đất nhé
- Miễn tiếp MG"	False	False	True	False	tỉnh lộ 8, Quận Củ Chi	thị trấn củ chi, củ chi	tỉnh lộ 8, Quận Củ Chi
Người thân cầntiền bán gấp nhà 2tỷ750 2lầu đường PhanĐìnhPhùng-Phú Nhuận	3.3	40	2.0	3.0	Phường1, Phan Đình Phùng	"???? Diện tích 3 x 7 m  –  DTSD 37.8m2
???? Kết cấu Nhà 1 trệt 2 lầu đúc
???? Gồm 1 phòng khách, 1 phòng bếp, 2 phòng ngủ, 3 nhà vệ sinh, đầy đủ công năng
???? Giao thông cực kỳ thuận tiện
???? Cách ngã tư Phú Nhuận 200m, dễ dàng đi tất cả các quận trong thành phố
???? Tiện ích xung quanh có nhiều trường học, khu ăn uống
???? Hẻm thông ra Phan Xích Long, Bệnh viện Hoàn Mỹ, đường Hoàng Sa có nhiều công viên cây xanh ven kênh,…
???? Hẻm đối diện đường Nguyễn Trọng Tuyển, đi ra bệnh viện Phú Nhuận, Bệnh viện Y học Dân Tộc, Sân bay Tân Sơn Nhất…
???? Rất thích hợp đầu tư kinh doanh, gia đình nhỏ hoặc mới cưới
???? Pháp lý sổ hồng riêng, hoàn công đầy đủ
???? Giá: 2 tỷ 750
Cam kết thông tin thật 100%
Liên hệ 0703.630.491 (Trúc Vi) xem nhà luôn"	False	False	True	False	đường Phan Đình Phùng, Phươn Phú Nhuận	Phường1, Phan Đình Phùng	đường Phan Đình Phùng, Phươn Phú Nhuận
Bán Nhà siêu đẹp đường Mai Văn Ngọc, Phường 10, Phú Nhuận	2.75	30	3.0	4.0		"Bán Nhà siêu đẹp đường Mai Văn Ngọc, Phường 10, Phú Nhuận
Thông Nguyễn Văn Trỗi, Trần Hữu Trang, Nguyễn Đình Chính.
Diện Tích: 3,17m× 9,85m CN 30,2m2
Kết Cấu: Trệt, 2 lầu, sân thượng
Nhà sát mặt tiền, gồm 3 phòng ngủ 4 nhà vệ sinh, ngay khu trung tâm Phú Nhuận, ra sân bay Tân Sơn Nhất chỉ 5 phút, giáp Q1,Q3
Sổ hồng riêng cầm tay, công chứng trong ngày
Liên hệ Tấn Nghĩa 0935626988 để xem trực tiếp"	False	False	True	False	đường Mai Văn Ngọc, Phường 10, Quận Phú Nhuận	đường Mai Văn Ngọc, Phường 10, Quận Phú Nhuận	đường Mai Văn Ngọc, Phường 10, Quận Phú Nhuận
Nhà 1 trệt 2 lầu Sân Thượng đường 38 Hiệp Bình Chánh, dt 67 m² Giá 6,3 Tỷ	3920	67	4.0	5.0	Đường Số 38, Phường Hiệp Bình Chánh, Quận Thủ Đức, TP HCM	"Nhà 1 trệt 2 lầu Sân Thượng đường 38 Hiệp Bình Chánh, dt 67 m² Giá 6,3 Tỷ
+ NHÀ ĐẸP, NỘI THẤT GỖ CAO CẤP
- Giá bán : 7,2 TỶ GIẢM CÒN 6,3 TỶ ( còn thương lượng cho khách thiện chí mua nhanh )
- Diện tích : 67 m² (4.02m x 16.568m) , DT Sàn 175,38 m²
- Nhà xây 3 tầng, kiên cố đúc BTCT , nhà có 4 phòng ngủ, 5 toilet.....
- Hẻm nhựa ôtô 7 chỗ thoải mái
- Khu nhà phố cao ráo sạch sẽ, đồng bộ
- Vị trí: Cách chợ hiệp Bình 100 m, gần TTTM GiGamall, thuận tiện di chuyển ra Phạm Văn Đồng , Quốc Lộ 13, Sân bay Tân Sơn Nhất...................
- Sổ hồng riêng, hoàn công đầy đủ, hỗ trợ vay 80 %
Liên hệ : 0898 408 677 xem nhà, làm việc chính chủ"	False	True	True	False	đường 38 Hiệp Bình Chánh	Đường Số 38, Phường Hiệp Bình Chánh, Quận Thủ Đức, TP HCM	đường 38 Hiệp Bình Chánh
Hẻm 1 sẹc đường Số 11 (NVK) Phường 11 Gò Vấp, 50m2, 2 tầng chỉ 4.98 tỷ	6.3	50	3.0	3.0	Đường Số 11	"MS 23723
* Vị trí: hẻm 1 sẹc đường Số 11 (nay là đường Nguyễn Văn Khối) Phường 11 Gò Vấp. Thiên đường của tiện ích : công viên Làng Hoa, siêu thị, chợ, trường v.v.
* Diện tích 50m2, 4m x 12.5m, 2 tầng, 3 phòng ngủ (có phòng ngủ dưới trệt), 2WC. Nhà mới, tặng nội thất cơ bản, chủ mới chỉ việc vào ở.
* Đường trước nhà 3.5m.
* Sổ hồng, vuông vức."	False	False	True	False	Số 11, Phường 11, Quận Gò Vấp	Đường Số 11	Số 11, Phường 11, Quận Gò Vấp
Bán toà nhà căn hộ dịch vụ thu nhập 500tr/tháng, Quận 7. Giá 100 tỷ	4.98	300				"Toà Nhà CHDV MT Lâm Văn Bền, Quận 7
- Diện tích : 7n x 46m
- Kết cấu : Hầm + 8 Tầng (84 Phòng Full nội thất)
- TN 500tr/tháng
- Giá: 100 Tỷ

Liên hệ xem nhà thương lượng giá trực tiếp chủ nhà : không chín ba tám tám một một tám bốn không"	True	False	True	False	Lâm Văn Bền, Quận 7	Lâm Văn Bền, Quận 7	Lâm Văn Bền, Quận 7
Bán CHDV-38P, thu nhập 170tr. Tại Q.Tân Bình, DT: 9x35 nở hậu 13m, Giá chỉ 35tỷ	100	280				"Bán CHDV Q.Tân bình
- DT: 9m x 33,8m. Nở hậu 12,8m. Công nhận 280m2.
- Kết cấu: 1 Trệt 4 Lầu. Gồm 38PN, thang máy. Thu nhập 170 triệu/th
- Giá chỉ 35 tỷ tl
Liên hệ xem nhà: không chín ba tám tám một một tám bốn không"	False	True	True	False	Tiền Giang, Quận Tân Bình	Tiền Giang, Quận Tân Bình	Tiền Giang, Quận Tân Bình
BÁN GẤP NHÀ ĐẸP, TỈNH LỘ 10, GẦN KHU TÊN LỬA BÌNH TÂN, 3 TẦNG, 120M2, NGANG 6.2M, GIÁ 7.9 TỶ	35	120	4.0	4.0	Tỉnh Lộ 10	"BÁN GẤP NHÀ ĐẸP, TỈNH LỘ 10, GẦN KHU TÊN LỬA BÌNH TÂN, 3 TẦNG, 120M2, NGANG 6.2M, GIÁ 7.9 TỶ

- Nhà mới xây, hoàn công đầy đủ 12/2022. Cửa tự động, sân để xe rộng rãi, giếng trời sau nhà, thoáng sáng, mát mẻ. Tặng full nội thất cao cấp.

- Kết cấu: trệt, lầu, sân thượng trước sau với 4 phòng ngủ, 4wc. Phòng ngủ dưới đất đầy sáng, view đẹp.

- Gần khu Tên Lửa, Aeon mall Bình Tân, Bệnh viện quốc tế city, Bến xe miền tây... Tiện ích xung quanh ngập tràn.

- Sổ hồng chính chủ, vuông A4, hoàn công đầy đủ. T452

☎️ Liên hệ: 0372515252 Mr. Tuấn ( xem nhà ngay)."	False	False	True	False	Khu Tên Lửa, T Qin lược 10, Bình Tân	Tỉnh Lộ 10	Khu Tên Lửa, T Qin lược 10, Bình Tân
