Ưu điểm cửa nhựa giả gỗ tại Vũng Tàu | ABS, Sungyu, Đài Loan	7900000000					"Cửa nhựa giả gỗ Composite là gì ? cấu tạo cửa Composite như thế nào ? giá cửa nhựa composite bao nhiêu ? Cửa nhựa ABS Hàn Quốc là gì ? ưu điểm cửa nhựa abs ? cấu tạo cửa abs ? Cửa nhựa giả gỗ Đài Loan ? Giá cửa nhựa Đài Loan ? Ưu điểm cửa nhựa giả gỗ tại Vũng Tàu.

HOTLINE + zalo: 035.312.6411 – 0888.696.029 (NVKD Như Ý)

Facebook: Cửa nhựa cửa gỗ

Ưu điểm cửa nhựa giả gỗ tại Vũng Tàu | ABS, Sungyu, Đài Loan
Những dòng cửa nhựa giả gỗ đang được thịnh hành tại Vũng Tàu
I. Cửa nhựa giả gỗ Composite (Sungyu) (Ưu điểm cửa nhựa giả gỗ tại Vũng Tàu)

Cửa nhựa composite hay còn gọi là cửa nhựa giả gỗ composite là dòng cửa nhựa giả gỗ cao cấp được làm từ như gỗ WPC (Wood Plastic Composite). Nhựa gỗ, còn có tên gọi khác là vật liệu Composite nhựa sợi tự nhiên hay sợi tự nhiên được gia cường bằng nhựa, là một loại nguyên vật liệu tổng hợp được tạo thành từ bột gỗ và nhựa kết hợp cùng một số chất phụ gia gốc cellulose. Hiện nay nhựa gỗ Composite được ứng dụng rất nhiều trong ngành nội thất đặc biệt là cửa chính, cửa thông phòng hay cửa nhà vệ sinh.

Toàn bộ cánh, khung bao, nẹp cửa của cửa nhựa composite đều được làm bằng nhựa gỗ composite 100% nên khách hàng yên tâm vộ độ chịu nước 100% và không sợ mối mọt.

1. Thành phần cấu tạo nên bộ cửa nhựa Composite

Cửa nhựa giả gỗ Composite được làm từ bột gỗ và nhựa PVC tạo thành nguyên khối gỗ nhựa vô cùng chắc chắn và cứng cáp. Là sự kết hợp hoàn hảo giữa độ cứng, độ bền của gỗ và độ chống thấm nước của nhựa.

Quy cách: 
Kích thước phủ bì (800 x 2100 /900 x 2.200) mm hoặc gia công theo kích thước thực tế tại công trình.
Khung bao chuẩn (55 x 100)mm (Làm bằng nhựa gỗ)
Dày cánh : 40 mm
2. Ưu điểm cửa nhựa giả gỗ Composite (Ưu điểm cửa nhựa giả gỗ tại Vũng Tàu)

- Trong điều kiện ẩm ướt, nhiệt độ môi trường thay đổi ra sao cũng không ảnh hưởng đến lớp phủ bên ngoài.

- Cửa nhựa giả gỗ Composite chống thấm nước tuyệt đối, chống cong vênh, mối mọt, giãn nở.

- Khả năng cách âm cách nhiệt tốt.

- Độ bền cao, khả năng chịu lực tốt.

- Trọng lượng tầm 50 – 60kg, cầm chắc tay, đóng mở êm, nhẹ nhàng.

- Thời gian lắp đặt nhanh, khả năng tương thích cao bởi hệ khung bao tăng giảm tiện lợi.

- Dễ vệ sinh, chỉ cần lau nhẹ với khăn khô là cửa đã sạch như mới.

- Kiểu dáng, màu sắc đa dạng. Cửa nhựa giả gỗ Composite có 3 dòng cửa: phủ da, sơn PU và sơn vân gỗ phù hợp với mọi không gian sống, kiến trúc khác nhau.




3. Báo giá cửa nhựa giả gỗ Composite tại Vũng Tàu
LOẠI MODEL KÍCH THƯỚC
(mm) ĐƠN GIÁ
(VNĐ)
CỬA NHỰA COMPOSITE
(Khung bao hệ 90)
(áp dụng cho tường dày từ 90mm – 110mm) Phủ da 900 x 2.200 x 110 3.000.000
Sơn PU 900 x 2.200 x 110 3.300.000
Luxury 900 x 2.200 x 110 3.900.000
II. Cửa nhựa giả gỗ ABS Hàn Quốc (Ưu điểm cửa nhựa giả gỗ tại Vũng Tàu)
1. Cấu tạo cửa nhựa ABS Hàn Quốc
1️⃣ Lớp bề mặt của cửa là DeCo-Sheet có độ dày khoảng 3mm là loại nhựa thông hợp tính với khả năng chống thấm không hút ẩm và đa dạng về màu sắc, giống như gỗ thật.
 
2️⃣ Tiếp đến là lớp nhựa ABS và được kết hợp pha trộn với các chất phụ gia khác làm tăng khả năng không bắt lửa và chịu nhiệt nằm ngay sau phía trong của lớp bề mặt cửa.


3️⃣ Qua lớp nhựa ABS là lớp gỗ PVC được ép xung quanh cánh cửa để tạo độ vững chắc và bắt vít.
 
4️⃣ Tiếp đến là lớp gỗ cứng LVL làm tăng khả năng chịu lực của cửa và khắc phục các khe hở và tình trạng cong vênh do thời tiết.
 
5️⃣ Sau các lớp trên là khoảng không được gia cố bằng Honey – Comb nhằm tăng khả năng cách âm và cách nhiệt cho cửa.
Tất cả được gắn kết với nhau bằng loại keo đặc biệt và được ép bằng máy thủy lực 7 tấn trong thời gian 10 giờ, tạo ra cánh cửa dày 35mm, chắc chắn nên cửa nhựa ABS có độ ổn định và độ bền cao, độ phẳng chuẩn.
2. Ưu điểm cửa nhựa ABS Hàn Quốc

- Nhựa ABS là một tổng hợp nhựa gồm Acrylonitrin, butadien, styren có tính năng vượt trội về độ bền và độ dẻo dai.

Cửa nhựa giả gỗ ABS Hàn Quốc có cấu tạo từ 5 lớp:

• Hai lớp ngoài cùng là Deco Sheet (nhựa thông hợp tính), bề mặt có đa dạng các mẫu vân gỗ giống gỗ tự nhiên.

• Hai lớp tiếp theo là hai lớp ABS Sheet, một trong những loại nhựa có độ dẻo dai cao.

• Lớp giữa có gỗ PVC giãn nở được ép xung quanh cánh để tạo độ vững chắc và bắt khoá.

• Tiếp theo là LVL gỗ cứng được xếp thành nhiều lớp nhằm hạn chế tối đa việc giãn nở và cong vênh. 

• Cuối cùng là giấy tổ ong được gia cố ở giữa có tác dụng cách nhiệt, cách âm.

3. Báo giá cửa nhựa giả gỗ ABS Hàn Quốc tại Vũng Tàu
LOẠI CỬA MODEL KÍCH THƯỚC
(mm) ĐƠN GIÁ BỘ
(VNĐ / Bộ)
CỬA NHỰA ABS HÀN QUỐC LOẠI 1
(Chính hãng Hàn Quốc) Theo catalogue
(102-105-110-111-116-117) 800 / 900 x 2.100 2.900.000
800 / 900 x 2.200 3.000.000
NẸP CHỈ ABS HÀN QUỐC 2 mặt 800 / 900 x 2.200 400.000
III. Cửa nhựa giả gỗ Đài Loan (Ưu điểm cửa nhựa giả gỗ tại Vũng Tàu)
1. Những thành phần cấu tạo cửa Đài Loan

Cửa Nhựa Đài Loan có quy cách:

Kích thước phủ bì (800 x 2100 /900 x 2.200)mm hoặc gia công theo kích thước thực tế tại công trình.

Khung bao chuẩn (55 x 100)mm (Làm bằng nhựa PVC hoặc nhựa gỗ)

Dày cánh : 35 mm ±2 mm

+ Cấu tạo cánh : Cấu tạo đúc nguyên khối hoặc ghép thanh theo mẫu nhà sản xuất.

2. Ưu điểm cửa nhựa Đài Loan (Ưu điểm cửa nhựa giả gỗ tại Vũng Tàu)

– Độ thẩm mỹ cao và giá rẻ

– Đa dạng mẫu mã: do kết cấu cánh là từng thanh ghép lại với nhau theo mẫu tùy thích nên có thể làm nhiều mẫu, đa dạng và có thể phủ nhiều loại vân gỗ đẹp.

– Đa dạng màu sắc: do bề mặt là lớp vân giả gỗ nhân tạo nên có thể chọn nhiều màu sắc và mẫu tùy thích phù hợp với mọi không gian nội thất.

– Độ ổn định cao: không bị mối mọt, không bị công vênh cao ngót, không bị thấm nước.

– Cách âm cách nhiệt tốt: do kết cấu bên trong cửa có nhiều khoảng trống do khung xương tạo ra nên có phần cách âm, cách nhiệt. Cánh cửa nhựa, tránh được tình trạng xệ bản lề và giảm tải trọng công trình.

3. Báo giá cửa nhựa Đài Loan tại Vũng Tàu
LOẠI CỬA KÍCH THƯỚC
(mm) ĐƠN GIÁ
(VNĐ)
CỬA NHỰA ĐÀI LOAN
GHÉP THANH
(VÂN GỖ) 800 x 2050 1.800.000
900 x 2150 1.950.000
CỬA NHỰA ĐÀI LOAN
NHỰA ĐÚC
(VÂN GỖ) 800 x 2050 2.000.000
900 x 2150 2.150.000
Thông tin liên hệ mua cửa - Ưu điểm cửa nhựa giả gỗ tại Vũng Tàu

Khách hàng có nhu cầu mua cửa nhựa giả gỗ Kingdoor chúng tôi làm theo hướng dẫn dưới đây:

Để lại thông tin trên web hoặc gọi trực tiếp + zalo: 035 312 6411 – 088 869 6029 (NVKD Như Ý)

Khi nhân viên kinh doanh gọi tư vấn, khách hàng cung cấp kích thước, mẫu mã, phụ kiện đi kèm…

Hình thức thanh toán bên công ty: 40% đặt cọc, 40% giao hàng, 20% lắp dựng hoàn thiện

Đối với đơn hàng không lắp dựng: 40% đặt cọc, 60% giao hàng.

Hình thức giao hàng và lắp dựng: Khi có cửa được nhân viên kinh doanh gọi giao hàng. Sau khi giao cửa và thu số tiền đợt 2 sẽ bố trí thợ lắp đặt trong ngày hôm sau.

>> Xem thêm báo giá cửa nhựa gỗ Composite  tại đây.

>>> Xem thêm báo giá cửa nhựa ABS Hàn Quốc  tại đây.

>>> Xem thêm báo giá cửa nhựa Đài Loan  tại đây.

> >Xem thêm báo giá cửa gỗ công nghiệp  tại đây.

>  Xem thêm báo giá cửa gỗ MDF  tại đây.

Xem thêm báo giá cửa thép chống cháy  tại đây.

Xem thêm báo giá cửa gỗ chống cháy  tại đây.

THÔNG TIN NHÀ CUNG CẤP

HOTLINE: 035.312.6411 – 088.869.6029 Gặp NVKD (Như Ý)

WEBSITE: http://Cuanhuacuago.net

FANPAGE: Cửa nhựa cửa gỗ

SHOWROOM CÔNG TY KINGDOOR

SHOWROOM 1: 639 QL 13 P.Hiệp Bình Phước, TP.Thủ Đức

SHOWROOM 2: 602 Kinh Dương Vương, P.An Lạc, Q.Tân Bình

SHOWROOM 3: 731 Lê Hồng Phong, P.Phước Long, Tp. Nha Trang

SHOWROOM 4: 671 Nguyễn Duy Trinh, Bình Trưng Đông, Quận 2"	False	False	True	False			
2 tỷ 29 có nhà 3 tầng Ni Sư Huỳnh Liên hẻm thông DTSD 60m2	8	20	2.0	2.0	Thành phố Hồ Chí Minh	"2 tỷ 29 có nhà 3 tầng Ni Sư Huỳnh Liên hẻm thông DTSD 60m2
- Hẻm ba gác thông, gần Âu Cơ, Lạc Long Quân.
- Kết cấu: 1 trệt, 1 lửng, 1 lầu, đang cho thuê 6.5tr/tháng.
- Nhà mới vào ở ngay 2 phòng ngủ, đủ công năng cho gia đình.
- Sổ hồng riêng, nở hậu, mua bán nhanh.
Lh 0902177052 xem nhà thật, giá thật."	True	True	True	False	Ni Sư Huỳnh Liên, hẻm thông DTSD	Thành phố Hồ Chí Minh	Ni Sư Huỳnh Liên, hẻm thông DTSD
Bán Nhà ngõ 48 Ngô Gia Long Biên Tự 52m2x6tx4m giá 8.8 tỷ có gara	2.29	52	5.0	5.0	ngô gia Tự	"Ngõ thông từ Ngô Gia Tự sang Việt Hưng Ngõ Rộng ô tô tránh
Xung Quanh BK 1km. Trường Tiểu Học THCS Việt Hưng
BigC Long Biên Vin Com Long Biên.
Bệnh Viện đa khoa Đức Giang Bệnh Viện Tâm Anh
Nhà thiết kế đẹp hiện đại Tầng 1 thang máy gara nhà vs
-Tầng 2.3.4.phòng ngủ nhà vs tầng 5,6 phòng ăn phòng thờ Vs
sổ đỏ chính chủ LH Anh Khoát 0983488355.chuyên viên môi giới bất động sản nhà đất thổ cư chung cư khu vực Long Biên Hà nội"	True	False	True	False	Ngõ 48 Ngô Gia Tự, Long Biên	ngô gia Tự	Ngõ 48 Ngô Gia Tự, Long Biên
Bán cho con đi nước ngoài, đường 8 m, Nhà đẹp, ở ngay, kế Lê Văn Chí, Linh Trung, Thủ Đức, Nhỉnh 6tỷ	8800000000	76	2.0	1.0	Lê Văn Chí	"Mô tả: Nhà MT đường 8m hẻm đẹp nhất đường Lê Văn Chí, khu nhà giàu, dân trí tốt, vừa ở vừa kinh doanh hoặc mở VP công ty, 3 phút ra ngã tư Thủ Đức, Võ Văn Ngân.
- Hạ tầng đẹp, phân lô đồng bộ, dân trí cao, kế bên bệnh viện Thủ Đức đang xây dựng, đường Lê Văn Chí đang mở rộng 30m.
- DT 4x19m vuông vức , XD trệt lững gồm 2 PN, 1 WC.
- Chủ đã dọn sang nhà mới cần bán cho con đi nước ngoài, sổ hồng chuẩn hoàn công đủ công chứng ngay
- Tiện ich xung quanh, Gần trường Cao Đẳng, Đại Học..."	False	False	True	False	đường Lê Văn Chí, Phường Linh Trung, Quận Thủ Đức	Lê Văn Chí	đường Lê Văn Chí, Phường Linh Trung, Quận Thủ Đức
Bán nhà vừa ở tiện kinh doanh homestay	6.2	143	4.0	6.0	KQH Ngô Quyền, phường 6, Đà Lạt	"BÁN NHÀ - KQH Ngô Quyền, P6, Đà Lạt
Diện tích: 143m2 - 5.02 x 27.37
Sổ riêng xây dựng - Hướng Đông
Lộ giới: 11m
Nhà 1 hầm 1 trệt với 2 chức năng: Phía trước để ở với đầy đủ công năng - Phía sau có 3p kinh doanh home, 5 wc, có phòng xông hơi.
Rất thích hợp định cư, nghỉ dưỡng, kết hợp thêm kinh doanh homestay,...
Giá bán 10 tỷ 500 triệu
Liên hệ xem nhà: Mr Minh 0917270366 - Ms Hiền 0917494166"	False	False	True	False	KQH Ngô Quyền, Phường 6, Đà Lạt	KQH Ngô Quyền, phường 6, Đà Lạt	KQH Ngô Quyền, Phường 6, Đà Lạt
Chính chủ cần BÁN ĐẤT Thượng Phúc 33mx 3,2m Thanh Trì Hà Nội	10.5	33				"Chính chủ cần BÁN ĐẤT Thượng Phúc 33mx 3,2m Thanh Trì Hà Nội
Bán đất thượng Phúc, Thanh Trì Hà Nội, đầu tư là có lãi
Khu vực đang phát triển, nhiêu trường học mọc lên
Rất nhiều dự án đầu tư vào, rất tiềm năng
đường thông các ngả, đường rộng mênh mông
Sổ đẹp như A4 chờ giao dịch
LH: Ngân 0965321338 để được tư vấn"	False	False	True	False	Thượng Phúc, Thanh Trì, Hà Nội	Thượng Phúc, Thanh Trì, Hà Nội	Thượng Phúc, Thanh Trì, Hà Nội
Hẻm Xe Hơi Đường Võ Duy Ninh Phường 22 Bình Thạnh Ngang 4.6 x 10m, 2 Tầng BTCT, Nhỉnh 4 Tỷ	1400	47	4.0	4.0	Võ Duy Ninh, Phường 22, Quận Bình Thạnh, Tphcm	"Nhà siêu đẹp sát Thị Nghè View Landmark ngày đêm đường Võ Duy Ninh trung tâm Bình Thạnh giao các tuyến đường Ngô Tất Tố, đường Phú Mỹ, đường Nguyễn Hữu Cảnh, đường Trần Quang Long di chuyển nhanh qua quận 1, quận 3, quận Tân Bình, quận Phú Nhuận , Tp Thủ Đức đi đến sân bay Tân Sơn Nhất chỉ 5 phút
Thông số : diện tích 47m2 ( ngang 4.6m x 10m) công nhận đủ.
Kết cấu 1 trệt 1 lầu đúc bê tông cốt thép.
Nhà phong thủy cực tốt, tài lộc, sinh khí rất tốt
Pháp lý chuẩn, Hoàn công đầy đủ. Công chứng mua bán trong ngày.
Liên hệ NGAY Xuân Nghi để xem nhà miển phí 0987581589"	False	False	True	False	đường Võ Duy Ninh, Phường 22, Quận Bình Thạnh	Võ Duy Ninh, Phường 22, Quận Bình Thạnh, Tphcm	đường Võ Duy Ninh, Phường 22, Quận Bình Thạnh
NHÀ MẶT TIỀN ĐƯỜNG KDC NAM LONG, AN LẠC - BÌNH TÂN, 4X19.1, 3 PHÒNG NGỦ, 5 TỶ 300	7.3	76				"NHÀ MẶT TIỀN ĐƯỜNG KDC NAM LONG, AN LẠC - BÌNH TÂN, 4X19.1, 3 PHÒNG NGỦ, 5 TỶ 300
- Kết cấu: trệt và lửng, 3 phòng ngủ. Nằm trong khu được cấp phép xây dựng 5 tầng
- Nằm trong khu dân cư Nam Long yên tĩnh, thông Võ Văn Kiệt, Hồ Học Lãm, Kinh Dương Vương,…
- Gần chợ khu phố 2, bệnh viện Triều An, Aeon Bình Tân, trường học các cấp
Liên hệ Ms Thư 0904552026 để được hỗ trợ xem nhà"	False	False	True	False	Đường KDC Nam Long, An Lac, Quận Bình Tân	Đường KDC Nam Long, An Lac, Quận Bình Tân	Đường KDC Nam Long, An Lac, Quận Bình Tân
CHỢ LÊ ĐÌNH CẨN, OTO5M, BÌNH TÂN, 49M2, 2T CHỈ 3,7 TỶ, LH 0948362610	3.45	49			Lê Đình Cẩn, Tân Tạo, Bình Tân	"CHỢ LÊ ĐÌNH CẨN, OTO5M, BÌNH TÂN, 49M2, 2T CHỈ 3,7 TỶ, LH 0948362610
_ Vị trí đông dân cư, Lê Đình Cẩn, Tân Tạo, Bình Tân.
_ DT: 4x12m, ô tô đỗ cửa, nhà vào ở ngay.
_ Kết cấu 1 trệt 1 lầu đúc BTCT, 2WC, bếp, ban công, phòng khách rộng rãi.
_ Giáp Quận 6, Aeon Mall Tên Lửa, gần Bệnh viện Bình Tân.
_ Sổ vuông A4, hoàn công đủ mua bán công chứng ngay.
_ Liên hệ Hoa kho 1000 căn nhà phố Sài Gòn 0948362610
#bán_nhà_bình_tân #bán_nhà_3_tỷ #bán_nhà_lê_đình_cẩn #bán_nhà_bình_trị_đông_a #bán_nhà_tân_tạo #bán_nhà_giáp_quận_6"	False	False	True	False	đường Lê Đình Cẩn, Phường Tân Tạo, Quận Bình Tân	Lê Đình Cẩn, Tân Tạo, Bình Tân	đường Lê Đình Cẩn, Phường Tân Tạo, Quận Bình Tân
Bình Tân, Hẻm Xe Tải, 3tầng 4x19m, gần MT Hương Lộ 2, Rẻ nhỉnh 4 tỷ.	3.7	76	3.0	3.0	Thành phố Hồ Chí Minh	"- BÌNH TÂN - HẺM 8M HƯƠNG LỘ 2 - VÀI BƯỚC RA MẶT TIỀN - 76M2 (4X19) - GIÁ RẺ, CHỈ NHỈNH 50TR/M2- KINH DOANH TỐT- NHỈNH 4. TỶ.
- Nhà 3 tầng, ở hoặc cho thuê ổn định. tiên xây mới.
☎️zalo 0938059388. Nhà Phố SG.
- Vị trí: Sát MT Hương Lộ 2 ngay gần ngã tư Bốn Xã, cách mặt tiền 50m.
- Ngay gần chợ, trường học, hệ thống ngân hàng
- Di chuyển về Q.Tân Phú, Q.6, Q.11 khoảng 5 tới 10 phút."	False	False	True	False	Hẻm 8m, Hương lộ 2, Quận Bình Tân	Thành phố Hồ Chí Minh	Hẻm 8m, Hương lộ 2, Quận Bình Tân
Bán nhà phố Trần Phú, ngõ thông ô tô đỗ cửa, nhà 4 tầng 38m2 mặt tiền 4.1m giá 5.85 tỷ	4.38	38				"* Nhà cần bán nằm trên mặt ngõ thông, ô tô đỗ cửa ngay gần đường Trần Phú, thuộc khu chia lô danh cho cán bộ giảng viên trường Đại học Kiến trúc Hà Nội. Với vị trí trung tâm rất nhiều tiện ích, gần trường đại học lớn, lại liền kề khu đô thị Văn Quán, có thể nói nhà nằm ở vị trí rất đẹp, phù hợp việc ở và kinh doanh đa dạng.
* Nhà được xây dựng 4 tầng, diện tích xây dựng mỗi tầng là 38m2, mặt tiền khá rộng lên đến 4.1m, hình thửa đất vuông vắn, thoáng trước, thoáng sau. Nhà được thiết kế khá hợp lý, khách mua nhà có thể sử dụng vào nhiều mục đích.
* Nhà có pháp lý rõ ràng, sổ đỏ chính chủ sẵn sàng giao dịch. Giá bán hiện tại là 5.85 tỷ.
* Quan tâm liên hệ điện thoại / zalo: 0963146879 gặp anh Dũng."	False	False	True	False	đường Trần Phú, khu chia lô danh cho cán bộ giảng viên trường Đại học Kiến trúc Hà Nội	đường Trần Phú, khu chia lô danh cho cán bộ giảng viên trường Đại học Kiến trúc Hà Nội	đường Trần Phú, khu chia lô danh cho cán bộ giảng viên trường Đại học Kiến trúc Hà Nội
Bán nhà căn góc trung tâm Biên Hoà 59m2 (P. Hoà Bình) chỉ 2,280 tỉ	5.85	59	2.0			"???????? Bán nhà căn góc trung tâm Biên Hoà 59m2 SHR thổ cư (P. Hoà Bình)
+ Vị trí: Gần trường tiểu học Quang Vinh,cách đường Cách Mạng Tháng 8 khoảng 100m
+ Diện tích: 4x14m (nở hậu 4,7m)
+ Nhà cấp bốn xây dựng kiên cố hiện đại gồm: 1 phòng khách,2 phòng ngủ,tolet,nhà bếp và sân để xe
+ Sổ hồng riêng thổ cư có hoàn công"	False	False	True	False	đường Cách Mạng Tháng 8, Phường Hòa Bình, Thành phố Biên Hòa	đường Cách Mạng Tháng 8, Phường Hòa Bình, Thành phố Biên Hòa	đường Cách Mạng Tháng 8, Phường Hòa Bình, Thành phố Biên Hòa
PHÂN LÔ, GARA Ô TÔ 7 CHỖ, DÂN XÂY, TẶNG FULL NỘI THẤT – 12.6 TỶ - TRẦN QUỐC HOÀN, CẦU GIẤY	2.28	40	6.0	4.0		"PHÂN LÔ, GARA Ô TÔ 7 CHỖ, DÂN XÂY, TẶNG FULL NỘI THẤT – 12.6 TỶ - TRẦN QUỐC HOÀN, CẦU GIẤY

Nhà đẹp Cầu Giấy, khu phân lô ô tô tránh, 2 mặt ngõ, dân xây, chủ tặng full nội thất, mua chỉ việc ở.

Cách phố 20m, ngõ thông, làm văn phòng, kinh doanh đều hợp lí

Sổ đỏ, pháp lý rõ ràng sẵn sàng giao dịch – 12.6 Tỷ (Có thương lượng)

Liên hệ: 0825.420.555"	True	False	True	False	Cầu Giấy, Trần Quốc Hoàn, Quận	Cầu Giấy, Trần Quốc Hoàn, Quận	Cầu Giấy, Trần Quốc Hoàn, Quận
Bán 5 phòng trọ SHR thổ cư 106m2 (X.Thạnh Phú) chỉ 1,6 tỉ	12.6	106	5.0			"???????? Bán 5 phòng trọ SHR thổ cư 106m2 đường ô tô (Xã Thạnh Phú)
+ Vị trí: Cổng sau công ty Chansing,cách đường DT 768 khoảng 300m
+ Diện tích: 5x21m (106m2)
+ Sổ hồng riêng thổ cư 100%
+ Gồm 5 phòng lớn xây mới leng keng chỉ cần xách valli vào ở. Doanh thu khoảng 6,5 triệu/tháng."	False	False	True	False	đường DT 768, Xã Thạnh Phú	đường DT 768, Xã Thạnh Phú	đường DT 768, Xã Thạnh Phú
CHỈ 3,6 TỶ NHÀ 2 TẦNG HƯƠNG LỘ 2 48m2, OTO5M, BÌNH TÂN, LH 0948362610	1.6	48			Lê Đình Cẩn, Tân Tạo, Bình Tân	"CHỈ 3,6 TỶ NHÀ 2 TẦNG HƯƠNG LỘ 2 48m2, OTO5M, BÌNH TÂN, LH 0948362610
_ Vị trí đường 5m thông đông dân cư, Lê Đình Cẩn, Tân Tạo, Bình Tân.
_ DT: ông nhận 48m2: 4x12m, ô tô vào nhà, nhà vào ở ngay.
_ Kết cấu 1 trệt 1 lầu đúc BTCT, 2WC, bếp, ban công, phòng khách rộng rãi.
_ Giáp Quận 6, Aeon Mall Tên Lửa, gần Bệnh viện Bình Tân.
_ Sổ vuông A4, hoàn công đủ mua bán công chứng ngay.
_ Liên hệ Hoa kho 1000 căn nhà phố Sài Gòn 0948362610
#bán_nhà_bình_tân #bán_nhà_3_tỷ #bán_nhà_mã_lò #bán_nhà_bình_trị_đông_a #bán_nhà_tân_tạo #bán_nhà_giáp_quận_6"	False	False	True	False	đường Lê Đình Cẩn, Tân Tạo, Quận Bình Tân	Lê Đình Cẩn, Tân Tạo, Bình Tân	đường Lê Đình Cẩn, Tân Tạo, Quận Bình Tân
NHÀ SÁT MẶT TIỀN TRUNG TÂM PHƯỜNG 17, PHÚ NHUẬN, 5 TẦNG BTCT, NGANG 5.5M, 4.x TỶ	3.6	30	4.0	4.0		"- Kết cấu: 1 trệt 1 lửng 2 lầu, sân thượng BTCT, 4 PN, 4 WC. Phòng khách và bếp hiện đại, đầy đủ công năng. Nhà siêu mới siêu đẹp, khách mua xách vali vào ở luôn
- Nhà đang có dòng tiền 15tr/tháng, mua là có ngay thu nhập cao
- Khu vực giáp ranh và cách quận 3 chỉ một cây cầu. Nhà cách mặt tiền chỉ 20m, sát hẻm ôtô khổng lồ chỉ 10m, hẻm thông rộng rãi, an ninh, yên tĩnh. Khu dân trí cao ngay Nguyễn Văn Trỗi và các đường lớn như Hoàng Văn Thụ, Phan Đình Phùng, Trường Sa, đi đâu cũng gần cũng nhanh cũng tiện
- Gần BV An Sinh, chợ Phú Nhuận, UBND quận, ĐH Sư Phạm, phố ẩm thực, khu vực tiện ích bao la
- Sổ hồng chính chủ, hoàn công đủ, pháp lý chuẩn, công chứng mua bán trong ngày"	False	True	True	False	Trung Tâm Phường 17, Phú Nhuận	Trung Tâm Phường 17, Phú Nhuận	Trung Tâm Phường 17, Phú Nhuận
Nở hậu 4,7x10 Hxh Nguyễn Thái Sơn P5 Gò Vấp	4.2	47	2.0	3.0		"Nở hậu 4,7x10 Hxh Nguyễn Thái Sơn Phường 5 Gò Vấp

+ 2 phòng ngủ, 3wc oto tới nhà 3,7 tỷ
+ Ngay Vincom, Cityland, Phan Văn Trị"	False	False	True	False	Nguyễn Thái Sơn, Phường 5, Quận Gò Vấp	Nguyễn Thái Sơn, Phường 5, Quận Gò Vấp	Nguyễn Thái Sơn, Phường 5, Quận Gò Vấp
Hxh 3pn 5x10 Nơ Trang Long P13 Bình Thạnh 4,9 tỷ	3.7	50	3.0	4.0		"3pn Hxh 5x10 Nơ Trang Long P13 Bình Thạnh 4,9 tỷ

+ Hẻm thông oto tận nhà, gần tiện mặt tiền, 3 phòng ngủ + 4WC.
+ An ninh, dân trí, tiện ích bến xe miền đông, Vincom.
+ Phạm Văn Đồng, Chu Văn An, hàng xanh"	False	True	True	False	Nô Trang Long, Phường 13, Quận Bình Thạnh	Nô Trang Long, Phường 13, Quận Bình Thạnh	Nô Trang Long, Phường 13, Quận Bình Thạnh
Bán Nhà Tân Hương, Hẻm xe Tải,45m2,3 Tầng ,An Ninh, Tân Phú, Gía Nhỉnh 4 Tỷ	4.9	45	4.0	3.0		"Bán Nhà Tân Hương, Hẻm xe Tải,45m2,3 Tầng ,An Ninh, Tân Phú, Gía Nhỉnh 4 TỶ
Hẻm xe tải trước nhà cách MT 100m
Kết cấu 1 trệt 2 lầu ban công .
Gồm 3 PN, 2 WC, PHÒNG KHÁCH , BẾP, đầy đủ công năng .
Vị trí nằm gần trường học, bệnh viện ,sát chợ Tân Hương, gần ủy ban Quận.
Khu vực an ninh yên tĩnh dân trí cao toàn nhà xây cao tầng
Pháp lý chuẩn sổ hồng công chứng nhanh
Khách quan tâm xin liên hệ gấp để được tư vấn tận tình
LH 0901668469 gặp Nhạn tư vấn chi tiết hơn"	False	True	True	False	Hẻm xe Tải, Tân Hương, Quận Tân Phú	Hẻm xe Tải, Tân Hương, Quận Tân Phú	Hẻm xe Tải, Tân Hương, Quận Tân Phú
Nhà Lê Đình Cẩn cách hẻm xe tải 15m giá chỉ 2 tỷ 7	4	45	2.0	2.0	LÊ ĐÌNH CẨN	"Cần bán gấp nhà cấp 4 có gác sạch đẹp
Vị trí đường Lê Đình Cẩn gần Mã Lò, khu Tên Lửa, đi đâu cũng tiện, tiện ích đầy đủ, hẻm thông
Nhà ngang 4,4 m dài 10.5m thoáng, có gác lửng
Sổ hồng riêng, công chứng ngay
Chính chủ rất muốn bán để định cư Mỹ"	False	False	True	False	đường Lê Đình Cẩn	LÊ ĐÌNH CẨN	đường Lê Đình Cẩn
Bán Nhà Mặt tiền - BÀ HOM - Quận 6 - 2 TẦNG - 108m2 (4.5*24m)- GIÁ 14 Tỷ	2.7	108	3.0	2.0		"+ Diện tích 108m2, 4.5 x 24m.
+ Kết cấu 1 trệt 1 lầu, sân thượng btct.
+ Mặt tiền đường 20m, trục đường giao thông liên quận kinh doanh buôn bán đỉnh.
+ Vị trí trung tâm ngay Gần vòng xoay Phú Lâm.
+ Cạnh chợ Phú Lâm, Bến xe miền Tây, Aeon Bình Tân...
+ Chủ lâu đời chưa qua đầu tư.
+ Pháp lý rõ ràng,
+ không lỗi phong thủy.
+ Sổ hồng tại gia, công chứng sang tên ngay .
+ Chính chủ gấp bán.
+ Giá bán 14 tỷ có thương lượng.
+ Liên hệ Nhu Nhà Phố 24/7 để xem nhà."	False	False	True	False	Mặt tiền đường, Quận 6	Mặt tiền đường, Quận 6	Mặt tiền đường, Quận 6
