Gò Vấp Phan Huy Ích Phường 12, HXH, 64m2 3 tầng chỉ 6.9 tỷ	8.5	64.0	3.0		Phan Huy Ích	"MS 16823
* Vị trí: hẻm 1 sẹc đường Phan Huy Ích, cách mặt tiền đường chính khoảng 50m.
* Diện tích 64m2, ngang 4m, dài 16m, 3 tầng. gồm phòng khách, bếp, 3 phòng ngủ, garage xe hơi.
* Hẻm xe hơi tránh, thuận tiện di chuyển.
* Sổ hồng hoàn công đủ"	False	False	True	đường Phan Huy Ích, Phường 12, Quận Gò Vấp	Phan Huy Ích	đường Phan Huy Ích, Phường 12, Quận Gò Vấp
Bán nhà Phan Huy Ích Phường 12 Gò Vấp, 56m2, 4x14, 2 tầng chỉ 4.35 tỷ	6.9	56.0	2.0	2.0	Phan Huy Ích	"MS 16923
* Vị trí: nhà hẻm 1 sẹc đường Phan Huy Ích, phường 12, Gò Vấp, cách mặt tiền đường chính 20m.
* Diện tích 56m2, ngang 4m, dài 14m, 2 tầng BTCT với 2 phòng ngủ, 2 WC.
* Đường trước nhà 4m. Khu vực an ninh, yên tĩnh.
* Hình sổ vuông vức, hoàn công đủ"	True	False	True	đường Phan Huy Ích, phường 12, Quận Gò Vấp	Phan Huy Ích	đường Phan Huy Ích, phường 12, Quận Gò Vấp
Cần bán nhà mặt phố Cự Lộc, hàng xóm Royal City 60m2 giá 11 tỷ	4.35	60.0			Nhân Chính, Thanh Xuân, Hà Nội	"* Phố Cự Lộc dài 650m, rộng từ 4 đến 5m. Từ đường Nguyễn Trãi đi vòng qua ao đình Cự Chính, đến phố Quan Nhân. Nay thuộc phường Thượng Đình, quận Thanh Xuân, thành phố Hà Nội.
* Vị trí đẹp nhất của phố Cự Lộc là khoảng 300m gần đường Nguyễn Trãi, tiếp giáp với khu Chung cư cao cấp Royal City. Đây là đoạn phố rộng nhất và có khả năng kinh doanh sầm uất cả ngày lẫn đếm. Tại đây các vị trí mặt phố Cự Lộc đều kề cận các tiện ích tốt nhất như: Trung tâm thương mại, khu vui chơi giải trí, sân bóng mini, Tennis, bể bơi bốn mùa, bệnh viện quốc tế, trường học… Việc di chuyển ra đường Nguyễn Trãi đi Ngã Tư Sở hay về Hà Đông rất nhanh và thuận tiện.
* Do nhu cầu cần tiền chia cho các con, gia chủ muốn bán lại căn nhà 2 tầng có diện tích trên sổ là 60m2, mặt tiền 4.5m vuông vắn với giá 11 tỷ.
* Nhà có vị trí đắc địa nằm ngay đoạn rộng nhất phố Cự Lộc, gia chủ xác định bán đất tặng nhà. Vị trí này rất phù hợp đầu tư xây tòa nhà 6-7 tầng với thang máy hiện đại vừa ở vừa kinh doanh.
* Quan tâm liên hệ: 0963.14.68.79 gặp anh Dũng."	False	False	True	phố Cự Lộc, phường Thượng Đình, quận Thanh Xuân, thành phố Hà Nội	Nhân Chính, Thanh Xuân, Hà Nội	phố Cự Lộc, phường Thượng Đình, quận Thanh Xuân, thành phố Hà Nội
Nhà phố 2 tầng nằm ngay vị trí đắc địa, liền kề Thuận An giá chỉ 2 tỷ 365 triệu/ 61m2, SHR, đã hoàn công	11	61.0	2.0	3.0		"Nhà phố 2 tầng nằm ngay vị trí đắc địa, liền kề Thuận An giá chỉ 2 tỷ 365 triệu/ 61m2, SHR, đã hoàn công
Phước điền Citizen nằm ngay mặt tiền đường Tân Phước Khánh 32, liền kề Thuận An.
Cách ngã tư miếu ông Cù 3km
Xung quanh đầy đủ tiện ích, chợ, trường học, bệnh viện,….
Khu nhà phố cực kỳ an ninh, có bảo vệ, camera quan sát 24/7
Đây là thời điểm thích hợp để mua ở hoặc mua đầu tư
Chủ đầu tư giảm sát giá cho quý khách hàng
Làm việc trực tiếp với chủ đầu tư
Cho thuê 1 năm 120 triệu
Liên hệ : 0947464497 đi xem nhà trực tiếp"	True	True	True	đường Tân Phước Khánh 32, Thuận An	đường Tân Phước Khánh 32, Thuận An	đường Tân Phước Khánh 32, Thuận An
Bán nhà mới đẹp q.4 - hẻm 5m Tôn Thất Thuyết - nhà 5T có 4PN - dt 35m2 giá nhỉnh 4 tỷ	2.37	35.0	4.0	3.0		"BÁN NHÀ MỚI ĐẸP Q.4 - HẺM 183F TÔN THẤT THUYẾT - HẺM THÔNG RA KHU ĐƯỜNG SỐ VĨNH HỘI - NHÀ 5 TẦNG BTCT CÓ 4 PHÒNG NGỦ - DIỆN TÍCH 35M2 KDC HIỆN HỮU GIÁ CHỈ 4.XX TỶ.
????Mô tả:
- Bán nhà hẻm 183F đường Tôn Thất Thuyết, phường 4, quận 4.
????Diện tích: 35m2 (5 x 7). Nhà hướng Đông Bắc.
????Kết cấu: Nhà 5 tầng gồm 1 trệt + 1 lửng + 2 lầu + san thượng. Nhà đẹp xây dựng BTCT kiên cố.
????Nhà gồm phòng khách, bếp ăn, 4 phòng ngủ, 3 toilet, sân thượng rộng rãi.
????Vị trí: Hẻm trước nhà 5m, xe hơi đậu cách nhà 20m, cách mặt tiền đường Tôn Thất Thuyết khoảng 70m, hẻm thông qua khu đường số Vĩnh Hội. Nhà cách cầu Ông Lãnh khoảng 700m, giao thông thuận tiện cách quận 1, quận 5, quận 7, quận 8 chỉ 4 phút di chuyển xe máy.
????Tiện ích: nhà gần chợ, các siêu thị, cửa hàng, quán ăn uống đầy đủ. Gần trường học, bệnh viện, khu vui chơi thiếu nhi Khánh Hội, hồ bơi Vân Đồn, trung tâm thể dục thể thao quận 4...
????Pháp lý: Sổ hồng riêng, kdc hiện hữu, không bị quy hoạch. Hỗ trợ mua vay ngân hàng.
????Giá chủ bán chỉ 4.XX tỷ còn thương lượng.
☎️Liên hệ khoaland xem nhà."	False	False	True	hẻm 183F, đường Tôn Thất Thuyết, phường 4, quận 4	hẻm 183F, đường Tôn Thất Thuyết, phường 4, quận 4	hẻm 183F, đường Tôn Thất Thuyết, phường 4, quận 4
GIÁ MỚI 3 TỶ , 87M, SÁT XA LỘ HÀ NỘI, ĐƯỜNG 3M.	5.45	87.0	3.0	2.0	LINH XUÂN	"+ Khu dân trí thức cao, khu an ninh tốt chưa bị mất thứ gì, sát bên trường tiểu học Nguyễn Văn Banh, cách ngã tư Bình Thái khoảng 500m, cách phạm Văn Đồng khoảng 1km, tiện di chuyển ra siêu thị Coopmart thủ Đức, trung tâm mua sắm Gigamall Phạm Văn Đồng, di chuyển ra bến xe miền Đông, sân bay....

+ Nhà cấp 4 còn mới, có thể ở liền hoặc tiện xây mới

+ Sổ hồng chính chủ, sẵn sàng giao dịch

+ Chủ gấp bán TRẢ NỢ."	True	False	True	đường 3m, Sát xa Lộ Hà Nội	LINH XUÂN	đường 3m, Sát xa Lộ Hà Nội
Bán nhà ngõ 73 Hoàng Ngân, phường Nhân Chính, tầng 1 để ô tô, mặt tiền 5m giá 7.7 tỷ	3.3	45.0			Ngõ 73	"* Do nhu cầu thay đổi chỗ ở để phù hợp với công việc và sinh hoạt gia đình nên gia chủ cần bán gấp một căn nhà 5 tầng mặt tiền 5m tại ngõ 73 phố Hoàng Ngân, phường Nhân Chính, quận Thanh Xuân, thành phố Hà Nội.
* Nhà nằm tại vị trí khá đẹp, đường vào nhà ô tô đi lại thuận tiện nên gia chủ đã thiết kế sẵn tầng 1 làm chỗ để xe ô tô. Ngõ 73 Hoàng Ngân là ngõ duy nhất kết nối giao thông từ Hoàng Ngân sang phố Quan Nhân, Lê Văn Lương, Nhân Hòa, Hoàng Đạo Thúy. Vì thế các ngôi nhà nằm trên ngõ 73 Hoàng Ngân rất phù hợp cho việc ở, kinh doanh hay cho thuê văn phòng, căn hộ…
* Khu vực xung quanh nhà cũng khá nhiều tiện ích, hơn 30m ra hồ điều hòa, vài phút đi bộ ra đến ngã tư Lê Văn Lương – Hoàng Đạo Thúy nơi ngập tràn tiện ích từ các tòa chung cư cao cấp như Hà Nội Centerpoint, Golden Palm Lê Văn Lương, BRG 25 Lê Văn Lương hay khu đô thị Trung Hòa Nhân Chính. Bán kính 500m quanh nhà có đầy đủ cây xăng, trường học, bãi gửi xe, chợ, khu vui chơi thể thao, sân bóng mini, sân Tennis…
* Nhà do gia chủ xây để ở nên vô cùng chắc chắn và thiết kế khá đẹp, hiện đại. Nội thất xịn sò, sang chảnh có khả năng làm hài lòng những khách hàng khó tính nhất. Gia chủ tặng lại toàn bộ nội thất cùng ngôi nhà 5 tầng trên diện tích 45 với mặt tiền 5m cho ai cần với giá 7.7 tỷ.
* Quan tâm liên hệ: 0963.14.68.79 gặp anh Dũng."	False	True	True	ngõ 73 phố Hoàng Ngân, phường Nhân Chính, quận Thanh Xuân, thành phố Hà Nội	Ngõ 73	ngõ 73 phố Hoàng Ngân, phường Nhân Chính, quận Thanh Xuân, thành phố Hà Nội
ÔTÔ ngủ trong nhà - 60M2 - Sát chợ BÀ CHIỂU - 5tầng - 6 phòng ngủ	7.7	60.0	6.0	4.0	5	"- Nhà kết cấu 1 trệt 1 lửng, 2 lầu + sân thượng lớn. 6 phòng + 4wc. Có giếng trời giữa và sau nhà thoáng mát, có 2sân thượng, phía trước trông cây và sân thượng lớn phái trên.
- Phòng nào cũng có ban công và cửa sổ, lấy sáng gió tốt. Hẻm xe hơi, hẻm thông thoáng.
- Nhà mới vào ở ngay. Khu vực trung tâm Bình Thạnh, sát ngay Chợ Bà Chiểu, Bạch Đằng, Lê Quang Định, hàng xóm Phú Nhuận và Gò Vấp.
- Sổ sạch đẹp, pháp lý chuẩn
605.32.1875 9.7"	False	False	True	Bạch Đằng, Lê Quang Định, Quận Bình Thạnh	5	Bạch Đằng, Lê Quang Định, Quận Bình Thạnh
Bán nhà phố khu compound 2,365 tỷ 1 trệt 1 lầu nằm ngay đường Tân Phước Khánh 32, Tân Uyên, BD	9.7	61.0	2.0	3.0		"Bán nhà phố khu compound 2,365 tỷ 1 trệt 1 lầu nằm ngay đường Tân Phước Khánh 32, Tân Uyên, BD

Khu dân cư nhà phố Phước Điền Citizen là khu compound an ninh, CCTV 24/7, điện nước âm... Khu dân trí cao, công viên cây xanh thoáng mát, được thiết kế theo kiến trúc Châu Âu.
Toạ lạc tại TP Tân Uyên, Bình Dương với Diện tích: 61.6m².
Thiết kế 1 trệt lầu.
Nhà hoàn thiện bên ngoài, bên trong thô.
- Bán kính xung quanh gần chợ, trường học các cấp, UBND, các khu công nghiệp...
Thích hợp mua nhận nhà ở liền hoặc khai thác cho thuê được ngay.
Mức giá sát với chủ đầu tư, giá thấp nhất khu vực hiện nay
GÓI CHO THUÊ NHÀ 1 NĂM 120 TRIỆU chỉ có tại Phước Điền Citizen
Liên hệ : 0947464497 đi xem nhà trực tiếp và làm việc trực tiếp với chủ đầu tư"	False	True	True	đường Tân Phước Khánh, Quận Tân Uyên, Bình Dương	đường Tân Phước Khánh, Quận Tân Uyên, Bình Dương	đường Tân Phước Khánh, Quận Tân Uyên, Bình Dương
Nhà gần Chợ Vải Tân Bình, 5x10.5m hẻm sạch thoáng. 4.6 tỷ	2.37	55.0	3.0	2.0	Hồng Lạc, P.10, Tân Bình	Nhà xây 2 tầng kiên cố có 3 phòng ngủ. Hẻm thông thoáng cạnh mặt tiền. Vị trí tiện đi các hướng, thông Phạm Phú Thứ và Lạc Long Quân, qua khu Bàu Cát vài phút. Nhà gần Chợ Vải Tân Bình. Khu an ninh, dân trí. Sổ hồng riêng, pháp lý chuẩn. Liên hệ anh Võ: 0909 100 817. Không tiếp trung gian.	False	False	True	Lạc Long Quân, Phường Phạm Phú Thứ, Quận Tân Bình	Hồng Lạc, P.10, Tân Bình	Lạc Long Quân, Phường Phạm Phú Thứ, Quận Tân Bình
Bán nhà mặt tiền Lê Đình Cẩn Bình Tân, DT 75m2, KINH DOANH, chỉ 4,7 tỷ TL	4.6	75.0	2.0	1.0	đường lê đình cẩn, tân tạo, bình tân	"+ Diện tích 4,1 x 14,5m; nở hậu 6,7m tài lộc

+ Lô góc 2 mặt đường ô tô tránh, vị trí hẻm như mặt tiền, tiện kinh doanh, sản xuất, cho thuê,...

+ Hiện trạng nhà C4 gác lửng đang làm kho, sửa lại ở hay xây mới tuỳ khách.

+ Vị trí gần khu tên lửa.

+ Sổ ngợp bank, hạ chào bán gấp.

+ Xem thực tế mới thấy được vị trí và tiện ích của căn nhà.

+ Liên hệ 0978508087 Nguyễn Tiền xem nhà trực tiếp. Miễn trung gian."	True	False	True	đường Lê Đình Cẩn, Phường Bình Tân	đường lê đình cẩn, tân tạo, bình tân	đường Lê Đình Cẩn, Phường Bình Tân
Nhà 1 trệt 2 lầu Phan Chu Trinh, Bình Thạnh giá 1,38 tỷ TL	4700000	15.0	2.0	2.0	Phan Chu Trinh, phường 12, Bình Thạnh	"Nhà nhỏ nhưng đầy đủ công năng, nhẹ tiền phù hợp gia đình nhỏ an cư, lạc nghiệp.
Hiện trạng như hình sơn sửa, setup tí là ở được. Cách mặt tiền Phan Chu Trinh 20m, đối diện học viện cán bộ CVA, khu dân cư yên tĩnh, an ninh.
Kết cấu 1 trệt 2 lầu, 15m2(2,6x7) giấy tờ chính chủ, sang tên trong ngày. Hiện giá 1,38 tỷ thương lượng hỗ trợ tiền tu sửa. Lh: 0329_471_654 xem nhà trực tiếp, cảm ơn."	False	True	True	Phan Chu Trinh, Bình Thạnh	Phan Chu Trinh, phường 12, Bình Thạnh	Phan Chu Trinh, Bình Thạnh
HẺM XE HƠI - 1 CĂN RA MẶT TIỀN NGUYỄN VĂN ĐẬU - 39M2	1.38	39.0	1.0	1.0	4	"DT: 3,5m x 11m
Giá: 4,x tỷ ( thương lượng)
+ Kết cấu 1 trệt + lửng gồm Pk, Bếp, PN, WC
+ Hẻm xe hơi, cách mặt tiền Nguyễn Văn Đậu chỉ 1 căn.
+ Tiện ích xung quanh không thiếu thứ gì: gần chợ, siêu thị Emart, trường học các cấp, Bệnh viện, ngân hàng,…
+ Pháp lý : Sổ hồng riêng - công chứng ngay.
3851.35.11 46"	False	False	True	Nguyễn Văn Đậu	4	Nguyễn Văn Đậu
Bán Ks 9 tầng, thang máy, Trần Hưng Đạo, HK, doanh thu 1.5 tỷ/ năm, DT 98m, MT 8m, 25 tỷ	4.6	98.0				"Cần bán khách sạn 9 tầng thang máy quận Hoàn Kiếm, Phố Trần Hưng Đạo, hiếm có, vị trí đẹp, Phố cổ nhu cầu cực cực kỳ cao. Toà nhà đã có doanh thu có định 120 triệu/ tháng, hợp đồng dài hạn

Diện tích toà nhà là 98m2, mặt tiền 7.9m, thiết kế 16 phòng khép kín.

Phố Trần Hưng Đạo là tuyến phố có nhiều toà văn phòng, lại gần Hồ Hoàn kiếm, bên cạnh là Lý Thường Kiệt, Quang Trung, Quán Thánh, Bà Triệu, Hàng Bài, ……

Vị trí toà khách sạn chỉ cách mặt phố vài chục mét, đường ô tô thoáng rộng,.....

Hiệu suất dòng tiền cao, tiềm năng khu vực chỉ có tăng không có giảm, 1 năm bỏ túi 1.5 tỷ nhẹ nhàng.

SĐCC, sẵn sàng giao dịch
Giá bán 25 tỷ, thương lượng trực tiếp

Mọi thông tin chi tiết liên hệ Em Sơn 0866962639, để xem nhà miễn phí
Chúc anh chị có thật nhiều may mắn, sức khoẻ, An lành."	True	True	True	Phố Trần Hưng Đạo, Quận Hoàn Kiếm	Phố Trần Hưng Đạo, Quận Hoàn Kiếm	Phố Trần Hưng Đạo, Quận Hoàn Kiếm
Bán nhà Chính Chủ	10.8	80.0	2.0	1.0	Hẽm 73, Lê Thánh Tôn, TP. Quảng Ngãi, tỉnh Quảng Ngãi.	"@Mr Truyền: 0912354499. Bán nhà siêu đẹp, không Rẻ hơn.
* *Bán nhà siêu đẹp, diện tích 80,9 m2, nhà 2 mặt tiền, ngang 6,14 mét, dài 11,16 mét nở hậu, hướng Tấy Bắc, nhà có phòng khách, 2 phòng ngủ, nhà tiếp, gát lửng, tolet, có không gian riêng để xe.
** Địa chỉ: Tổ 9, phường Nghĩa Chánh, thành phố Quảng Ngãi, tỉnh Quảng Ngãi.
- Diện tích: 80,9 m2
- Hướng: Tây Bắc
- Ngang: 6,14 met
- Dài 11,16 mét
- Sổ đỏ chính chủ, Pháp lý rõ ràng.
*** Giá: 1.65 tỷ.
** Khu vực trung tâm thành phố siêu tiện ích bước chân ra Vincompalaza, trường học, siêu thị, bến xe, vài phút đi xe tới Bệnh viện.
Địa điểm vàng cho những khách hàng muốn tìm nhà an cư.

**Khẳng định là hoa hậu khó tìm tại Tổ 9, phường Nghĩa Chánh, thành phố Quảng Ngãi, tỉnh Quảng Ngãi ngay lúc này.

*** LH Mr Truyền: 0912.35.44.99 để sở hữu ngôi nhà siêu đẹp, giá siêu nhỏ này."	False	False	True	Tổ 9, phường Nghĩa Chánh, thành phố Quảng Ngãi, tỉnh Quảng Ngãi	Hẽm 73, Lê Thánh Tôn, TP. Quảng Ngãi, tỉnh Quảng Ngãi.	Tổ 9, phường Nghĩa Chánh, thành phố Quảng Ngãi, tỉnh Quảng Ngãi
Giá nào cũng bán 100m2 hẻm ô tô Âu Cơ, P10, Tân Bình 6.3 tỷ 0977943598	1650	100.0				"ÂU CƠ TÂN BÌNH - THÔNG - GẦN 100M2 - NHÀ ĐẸP - NGANG LỚN 5.7M - HẺM XE HƠI - CỰC HOT - CHỈ HƠN 6 TỶ TO TO - Ở LIỀN - XE HƠI - MUA ĐẤT TẶNG NHÀ ĐẸP 3 PN 2 WC
Mô tả:

+ Diện tích 94m2, công nhận đủ. Ngang gần 6m dài 17m. Xây toà căn hộ cho thuê thì tuyệt vời, hái ra tiền hàng tháng.

+ Vị trí gần mặt đường lớn, trước nhà thông thoáng cực kì. Hẻm thông nhiều nơi, có bãi gửi xe hơi sát bên nhà.

+ Bán đất tặng nhà rất đẹp, 1 trệt 1 lửng, 3 phòng ngủ 2 WC, 2 giếng trời, không gian sinh hoạt thoáng mát.
+ Sổ đẹp nở hậu rất nhẹ. Công chứng trong ngày.
LH: 0977943598(Giang có zalo)."	False	False	True	đường Âu Cơ, Phường 10, Quận Tân Bình	đường Âu Cơ, Phường 10, Quận Tân Bình	đường Âu Cơ, Phường 10, Quận Tân Bình
QUẬN 11 - ĐƯỜNG NHỰA NỘI BỘ - KINH DOANH ĐA NGÀNH - 4 TẦNG - CHỈ 6,5 TỶ	6.3	30.0	3.0	4.0		"QUẬN 11 - ĐƯỜNG NHỰA NỘI BỘ - KINH DOANH ĐA NGÀNH - 4 TẦNG

✅ Địa chỉ: 341 LẠC LONG QUÂN, P5 Q11
✅ DT: 3m x 10m ( DTSD: 120m2 )
✅ Kết cấu: 1 trệt 3 lầu 3PN 4WC. Ban công, nhiều cửa sổ trước sau rất thoáng.
✅ Sổ vuông, hoàn công đủ, không lộ giới.

☎️ Gọi ngay đi xem Nhà Đẹp này 093 888 6128 Thúy Dinh ( 翠莹 ).
⏩ Kết bạn Zalo để xem kho hàng và luôn cập nhật hàng mới nhất
---------------------
KHÔNG TIN ẢO - NHÀ THẬT HÌNH THẬT
Ms679"	False	True	True	đường Lạc Long Quán, Phường 5, Quận 11	đường Lạc Long Quán, Phường 5, Quận 11	đường Lạc Long Quán, Phường 5, Quận 11
QUẬN 11 - LÒ SIÊU - 81M2 - 7.6 TỶ , TL	6.5	81.0	7.0			"QUẬN 11 - LÒ SIÊU - 81M2

✅ DT : 4m5 x 14m ( Nở hậu 7m5 ), không chút lộ giới.
✅ Kết cấu: 1 trệt 1 lửng, nhà cũ tiện xây mới, có 7 phòng đang cho thuê.
✅ Vị trí đẹp, tương lai mở đường thành 2MT trước sau
✅ Dòng tiền cho thuê 15tr/tháng.

☎️ Gọi ngay đi xem Nhà Đẹp này 093 888 6128 Thúy Dinh ( 翠莹 ).
⏩ Kết bạn Zalo để xem kho hàng và luôn cập nhật hàng mới nhất
---------------------
KHÔNG TIN ẢO - NHÀ THẬT HÌNH THẬT
Ms609"	True	True	True	Quận 11, Lò Siêu	Quận 11, Lò Siêu	Quận 11, Lò Siêu
bán Nhà 1Trệt lửng ở đường Kha Vạn Cân, P. Linh Chiểu, Diện tích 93.4m², Giá 4.2 Tỷ	7.6	93.0	3.0		Đường Kha Vạn Cân, Phường Linh Chiểu, Quận Thủ Đức, TP HCM	"bán Nhà 1Trệt lửng ở đường Kha Vạn Cân, P. Linh Chiểu, Diện tích 93.4m², Giá 4.2 Tỷ
- Từ nhà 2 -5 phút ra chợ Thủ Đức, Phạm Văn Đồng……..
- Diện tích: 93,4m2 Thổ cư (4m * 19.5m, Nở hậu 5.4m )
– Vị trí nhà đẹp, phong thủy tốt
– NHÀ 1 trệt 1 lửng với đầy đủ công năng sử dụng gồm 3 phòng ngủ, WC, phòng khách, bếp, có sân trước nhà để xe.
– Nhà mới đẹp, xây kiên cố, móng chắc chắn
– Tiện ích xung quanh đầy đủ, gần chợ, tạp hóa, trường học, , bệnh viện, dân cư đông đúc, an ninh tốt, dân trí cao
– Giao thông thuận tiện đi lại nhiều khu vực
- Giá bán: 4,2 tỷ ( có thương lượng với khách thiện chí )
- Phù hợp kinh doanh online.... đầu tư……….
- Sổ hoàn công đủ, công chứng nhanh.
Liên hệ : 0898 408 677 xem nhà và làm việc chính chủ"	False	True	True	đường Kha Vạn Cân, Phường Linh Chiểu	Đường Kha Vạn Cân, Phường Linh Chiểu, Quận Thủ Đức, TP HCM	đường Kha Vạn Cân, Phường Linh Chiểu
LÊ VĂN SỸ -66M2 - Hẻm xe hơi 1 trục - Khu phân lô VIP - 4 tầng BTCT	4.2				Thành phố Hồ Chí Minh	"+ Khu vực dễ kinh doanh - sầm uất - LÊ VĂN SỸ

+ Ngang khủng 5,5 x 12M - 3PN - SÂN THƯỢNG - 4 TẦNG BTCT

+ Hẻm xe hơi 1 trục - thông thoáng - giáp ngay quận 1

+ Khu dân cư an ninh cao - hàng xóm thân thiện - lịch sự

+ Sổ hồng vuông vức - Hoàn công đủ

+ Khu vực dễ kinh doanh SPA - phòng khám - STUDIO"	False	True	True	Lê Văn Sĩ	Thành phố Hồ Chí Minh	Lê Văn Sĩ
Bán nhà Gò Vấp Đường số 51 Phường 14 37m2, 2 tầng chỉ 3.2 tỷ	7.8	37.0	2.0	2.0	Đường Số 51	"MS 17023
* Vị trí: đường số 51 phường 14 Gò Vấp, cách hẻm xe tải 20m.
* Diện tích 37m2, ngang 3.5m, dài 10.6m. Nhà 1 trệt 1 lầu với 2 phòng ngủ, 2 WC.
* Hẻm ba gác, khu dân cư đông đúc, hẻm thông.
* Sổ hồng công nhận đủ, hoàn công đủ."	False	False	True	đường số 51, Phường 14, Quận Gò Vấp	Đường Số 51	đường số 51, Phường 14, Quận Gò Vấp
Shophouse tầm nhìn view sông tại thành phố Huế tại sao lại thu hút khách hàng đến như vậy?	3.2	119.0	4.0	4.0	KHU A, ĐÔ THỊ AN VÂN DƯƠNG, ĐƯỜNG HOÀNG QUỐC VIỆT, THÀNH PHỐ HUẾ	"Các căn shophouse tại BGI Topaz Downtown bám dọc tuyến đường lớn rộng 26m, hướng trọn tầm nhìn ra nhánh sông Như Ý, kết nối trực tiếp ra trung tâm thương mại Aeon Mall, Bộ Chỉ Huy Quân Sự Tỉnh.
Các căn shophouse có vị trí tốt tiếp giáp mặt đường lớn, có tầm nhìn đẹp, thoáng đãng, tiện dừng đỗ xe với lưu lượng dân cư qua lại đông đúc, công viên thành phố với các lô có diện tích đa dạng từ 119m2 cho tới 223m2...
✅ Vị trí: Khu A Đô Thị Mới An Vân Dương , Đường ô tô 19,5m, 26m.
✅ Diện tích: 100m-200m ngang 7m,8m.
✅ Công năng: Sân xe rộng, 4 phòng Ngủ ,4 wc, 1 không gian bếp, 1 không gian làm việc, 1 không gian thờ, ban công, sân phơi,…
✅ Pháp Lý: Có sổ Hồng ngay khi bàn giao nhà.
????????????Giá chỉ XXTỶ. Thương lương chủ đầu tư nhiều chính sách hấp dẫn.
--------------------------
THÔNG TIN LIÊN HỆ:
Công ty CPĐT Bất Động Sản Phúc Đại Việt
""????????????̂́???? ????????̣???? ????????????́ ????????????̣ ????????̛????̛???????? ????????????""
Hotline: 0868472415
Trụ sở chính: 480 Đường 2-9, Phường Hoà Cường Nam, Quận Hải Châu, Đà Nẵng (Địa điểm làm việc chính)
Cơ sở 2: Block A4-08, đường Nguyễn Sinh Sắc, phường Hòa Minh, quận Liên Chiểu, Thành phố Đà Nẵng
Chi nhánh Huế: Lô B9 An Cựu City, Hoàng Quốc Việt, An Đông, TP Huế
Website :http://phucdaiviet.com.vn"	False	False	True	Khu A Đô Thị Mới An Vân Dương, Đường ô tô 19,5m, 26m	KHU A, ĐÔ THỊ AN VÂN DƯƠNG, ĐƯỜNG HOÀNG QUỐC VIỆT, THÀNH PHỐ HUẾ	Khu A Đô Thị Mới An Vân Dương, Đường ô tô 19,5m, 26m
Shophouse tầm nhìn view sông tại thành phố Huế tại sao lại thu hút khách hàng đến như vậy?	9	119.0	4.0	4.0	KHU A, ĐÔ THỊ AN VÂN DƯƠNG, ĐƯỜNG HOÀNG QUỐC VIỆT, THÀNH PHỐ HUẾ	"Các căn shophouse tại BGI Topaz Downtown bám dọc tuyến đường lớn rộng 26m, hướng trọn tầm nhìn ra nhánh sông Như Ý, kết nối trực tiếp ra trung tâm thương mại Aeon Mall, Bộ Chỉ Huy Quân Sự Tỉnh.
Các căn shophouse có vị trí tốt tiếp giáp mặt đường lớn, có tầm nhìn đẹp, thoáng đãng, tiện dừng đỗ xe với lưu lượng dân cư qua lại đông đúc, công viên thành phố với các lô có diện tích đa dạng từ 119m2 cho tới 223m2...
✅ Vị trí: Khu A Đô Thị Mới An Vân Dương , Đường ô tô 19,5m, 26m.
✅ Diện tích: 100m-200m ngang 7m,8m.
✅ Công năng: Sân xe rộng, 4 phòng Ngủ ,4 wc, 1 không gian bếp, 1 không gian làm việc, 1 không gian thờ, ban công, sân phơi,…
✅ Pháp Lý: Có sổ Hồng ngay khi bàn giao nhà.
????????????Giá chỉ XXTỶ. Thương lương chủ đầu tư nhiều chính sách hấp dẫn.
--------------------------
THÔNG TIN LIÊN HỆ:
Công ty CPĐT Bất Động Sản Phúc Đại Việt
""????????????̂́???? ????????̣???? ????????????́ ????????????̣ ????????̛????̛???????? ????????????""
Hotline: 0868472415
Trụ sở chính: 480 Đường 2-9, Phường Hoà Cường Nam, Quận Hải Châu, Đà Nẵng (Địa điểm làm việc chính)
Cơ sở 2: Block A4-08, đường Nguyễn Sinh Sắc, phường Hòa Minh, quận Liên Chiểu, Thành phố Đà Nẵng
Chi nhánh Huế: Lô B9 An Cựu City, Hoàng Quốc Việt, An Đông, TP Huế
Website :http://phucdaiviet.com.vn"	False	False	True	Đường ô tô 19,5m, 26m, Khu A Đô Thị Mới An Vân Dương	KHU A, ĐÔ THỊ AN VÂN DƯƠNG, ĐƯỜNG HOÀNG QUỐC VIỆT, THÀNH PHỐ HUẾ	Đường ô tô 19,5m, 26m, Khu A Đô Thị Mới An Vân Dương
Bán nhà Khương Đình - ngõ nông - nhà đẹp mới koong	9	36.0	5.0	4.0	Hạ Đình - Thanh Xuân - Hà Nội	"Vị trí: Gần Nguyễn Trãi, Bùi Xương Trạch, Kim Giang, trung tâm giao thông thuận tiện.
Diện tích: 36m², mặt tiền 4m, giá 5 tỷ.
Thiết kế: 5 tầng.
Liên hệ: Em Huy 0828 691 090 xem nhà."	False	False	True	Nguyễn Trãi, Kim Giang	Hạ Đình - Thanh Xuân - Hà Nội	Nguyễn Trãi, Kim Giang
